Date,Player,Club Name,Club Type,Club Speed,Attack Angle,Club Path,Club Face,Face to Path,Ball Speed,Smash Factor,Launch Angle,Launch Direction,Backspin,Sidespin,Spin Rate,Spin Rate Type,Spin Axis,Apex Height,Carry Distance,Carry Deviation Angle,Carry Deviation Distance,Total Distance,Total Deviation Angle,Total Deviation Distance,Note,Tag,Air Density,Temperature,Air Pressure,Relative Humidity
7/31/24 20:55:55,Jason,,Gap Wedge,62.31993822073673,-0.6717824935913086,-2.410786867141724,3.619774341583252,6.030561447143555,68.21360037205386,1.0945710525328478,26.285446166992188,2.6717100143432617,4744.36865234375,671.8977661132812,4791.70947265625,Estimated,-8.060629844665527,13.545861735610174,76.7171308734396,0.5818186402320862,0.7790847672115646,85.29617785610208,0.3522151112556457,0.5245879011533141,"Your gap wedge shot shows good power, but the attack angle and club path suggest you're slightly steep and swinging left. This can cause a higher spin rate, leading to shorter carry distance with potential accuracy issues. Focus on leveling out your swing path and ensuring the clubface is squared at impact to maximize distance and control.",swing path drill,1.1913916,70.0,101.325,73
7/31/24 20:56:22,Brian,,Gap Wedge,59.136068812593294,-7.132810115814209,3.284372091293335,19.563220977783203,16.27884864807129,56.42545261225132,0.954163064018812,26.25611686706543,16.48063850402832,3204.560302734375,-1451.1798095703125,3517.830322265625,Estimated,24.36331558227539,8.197638801152493,54.59106552263575,21.487812042236328,19.99689363496373,65.02065780637122,22.11990737915039,24.48327827759817,"Your gap wedge shot showed a decent club speed, but the attack angle is quite steep, meaning you're hitting down too much on the ball. This can lead to excessive spin and reduced distance. The club path is good, but the face is open relative to your path, which is causing the ball to curve left. Working on your face alignment and attack angle will help improve your accuracy and distance.",face alignment drill,1.1913916,70.0,101.325,73
7/31/24 20:56:51,Lauren,,Gap Wedge,46.6660302515752,,5.748694896697998,-3.237786054611206,-8.986480712890625,53.9796141577599,1.1567217924206834,23.1204833984375,-1.940274119377136,6272.72705078125,663.1307373046875,6307.681640625,Estimated,-6.034694671630859,6.634368063583111,48.57309290440935,-3.24159836769104,-2.74667529651191,57.14042129093059,-3.408179521560669,-3.39698489726402,"Your club speed is good for a gap wedge, but the club face was slightly closed at impact, which caused the ball to start left. Focus on keeping the club face square to your target. Your backspin is high, which is great for stopping the ball on the green, but try to improve your carry distance by adjusting your launch angle. Practice hitting with a more neutral face position.",face angle drill,1.1913916,70.0,101.325,73
7/31/24 20:57:09,Lauren,,Gap Wedge,44.50773621365943,,,,0.0,35.30937831456913,0.7933312569542165,5.824036121368408,34.85582733154297,2714.97705078125,0.0,2714.97705078125,Estimated,-0.0,0.1732772288681374,6.159904675281609,34.88746643066406,3.5232570467844653,17.867500813536026,34.874210357666016,10.21621913402464,"It looks like your gap wedge isn't performing as well as it could. Your ball speed is low, and the carry distance is only around 6 yards. We need to work on increasing your club speed and achieving a better launch angle for more distance. Consistency in your impact position is key, so focus on your setup and follow-through.",half swing pause,1.1913916,70.0,101.325,73
7/31/24 20:57:44,Brian,,Gap Wedge,50.68234232435361,-5.063382148742676,1.9381871223449707,-1.474937915802002,-3.4131250381469727,50.65103388548914,0.9993822614064656,18.34844970703125,-0.9690279364585876,2021.0972900390625,1069.1834716796875,2286.479248046875,Estimated,-27.879350662231445,3.382489965867535,36.41548536134678,-3.643627643585205,-2.3142175373075418,53.62599386633656,-4.505022048950195,-4.212155830272934,"Your club speed is decent, but your attack angle is too steep, which can cause the ball to balloon. Also, the club face is slightly closed relative to your path, leading to a draw bias. Focus on ensuring your face is square to your target at impact and try to swing with a more neutral angle. This will help control your distance and direction better.",face alignment drill,1.1913916,70.0,101.325,73
7/31/24 20:58:43,Jason,56,Sand Wedge,57.90140785411904,-6.704780101776123,4.44609260559082,7.130681037902832,2.684588432312012,52.60369829529464,0.9085046503157256,30.930782318115234,6.413629531860352,5717.853515625,-155.8065185546875,5719.97607421875,Estimated,1.5608737468719482,9.693801906992462,49.93015973664978,7.1114373207092285,6.18134826694785,56.21879896849077,7.100421905517578,6.949152542574211,"Your shot shows a decent club speed and ball speed, but the attack angle is a bit steep. This means you're hitting down too much on the ball, which can cause excessive backspin and inconsistent distances. Try to focus on keeping the clubface more square to your path at impact and work on hitting the ball with a flatter angle. This will help you achieve a cleaner strike and improve your carry distances. Additionally, your sidespin indicates a slight hook, so aim for more consistent clubpath alignment.",swing path drill,1.1913916,70.0,101.325,73
7/31/24 20:59:05,Brian,56,Sand Wedge,53.1327033933444,-8.099900245666504,0.4000807702541351,-5.252015590667725,-5.652096271514893,53.31855298294613,1.0034978380118529,25.730424880981445,-4.264063835144043,6917.736328125,955.8959350585938,6983.46728515625,Estimated,-7.867336750030518,7.64171416956998,48.830576618840496,-6.163670539855957,-5.242883852145383,55.49654713718292,-6.333820819854736,-6.122450744583318,"Your shot showed a decent club speed, but the attack angle is too steep. This means your club is coming down too much on the ball, which can lead to less distance and control. Focus on leveling out your swing a bit. The face was slightly closed, pushing your shot to the left. Work on keeping your club face square at impact, and try to aim more toward your target. Also, the high backspin indicates you might be hitting down too hard, which shortens distance. Try to smooth out your swing.",swing path drill,1.1913916,70.0,101.325,73
