Date,Player,Club Name,Club Type,Club Speed,Attack Angle,Club Path,Club Face,Face to Path,Ball Speed,Smash Factor,Launch Angle,Launch Direction,Backspin,Sidespin,Spin Rate,Spin Rate Type,Spin Axis,Apex Height,Carry Distance,Carry Deviation Angle,Carry Deviation Distance,Total Distance,Total Deviation Angle,Total Deviation Distance,Note,Tag,Air Density,Temperature,Air Pressure,Relative Humidity
7/31/24 20:22:00,Brian,,7 Iron,,,,,0.0,97.6916304831957,-43.67206573486328,18.57002639770508,6.1772894859313965,2233.443603515625,92.80144500732422,2235.370849609375,Measured,-2.379318952560425,17.087003304166615,136.11962502555434,5.7865190505981445,13.723922654264584,154.4991062566187,5.671362400054932,15.268033341129922,"Your shots carry an average distance of about 136 yards with decent height, but there's inconsistency due to a wide variance in your carry distances. Focus on improving your swing path and ensuring your clubface is square at impact. This will help tighten your dispersion and improve accuracy.",swing path drill,1.1913916,70.0,101.325,73
7/31/24 20:25:38,Lauren,,5 Iron,69.04708835796464,-6.195860385894775,3.729235172271729,6.409929275512695,2.680694103240967,93.46321632363195,1.3536156056151918,10.000468254089355,5.731889724731445,2040.7725830078125,480.8905029296875,2096.666015625,Measured,-13.25937271118164,5.542760391189631,95.59800448465012,3.457570075988769,5.765486202959608,134.32024272308445,2.7475881576538086,6.438823637771918,"Your shot shows a solid club speed, but the negative attack angle (-6°) indicates you're hitting down on the ball too much. This can lead to excessive backspin and lower carry distances. Also, your club path is slightly in-to-out (3.7°), which is good, but the face angle is even more open (6.4°) than the path. This suggests you're likely pushing the ball to the right. Work on hitting more up on the ball and aligning your clubface better with your target line.",attack angle adjustment drill,1.1913916,70.0,101.325,73
7/31/24 20:26:21,Lauren,,5 Iron,73.62123506291755,-1.7002897262573242,2.5531105995178223,6.92753791809082,4.374427318572998,98.88637723540432,1.3431773747193303,6.63642692565918,6.009899616241455,1000.0000610351562,577.3502197265625,1154.7005615234375,Estimated,-30.0,2.186866455096805,66.43182041510272,3.872267723083496,4.486351789681578,129.66404273149055,2.7999517917633057,6.333877747943177,"Your club speed is good for a 5 iron, but the angle of attack is slightly negative, which can lead to lower launch and less distance. The club face is also open relative to your path, causing the ball to start right and potentially slice. Focus on striking the ball with a more neutral or upward angle and aligning your clubface closer to your swing path.",club face alignment drill,1.1913916,70.0,101.325,73
7/31/24 20:26:59,Brian,,5 Iron,72.88672833528108,-3.730431079864502,6.6148600578308105,8.959274291992188,2.344414234161377,82.3238034808237,1.1294759054368828,12.36902141571045,8.18704891204834,1000.0000610351562,-207.5836334228516,1021.3182983398438,Estimated,11.7271146774292,4.546279226044817,73.3131477757388,9.286540031433104,11.830691459379864,115.60765132303275,9.651641845703123,19.38247666743541,"You're generating a decent club speed and putting a nice launch angle on the ball; however, your attack angle is slightly steeper than ideal. This means you're hitting downward on the ball more than you should, which can affect distance and direction. Additionally, the ball starts right and moves left due to the club face being open relative to your path. Focus on a smoother swing and try to keep the clubface more square at impact for better accuracy and distance.",swing path drill,1.1913916,70.0,101.325,73
7/31/24 20:27:59,Herald,,5 Iron,67.74157168346119,-1.4122387170791626,-0.117081418633461,5.112564086914063,5.229645729064941,96.83360518031714,1.4294561341563712,9.037195205688477,4.18492603302002,1700.5372314453125,-740.53515625,1854.7828369140625,Measured,23.5317440032959,4.604733494283323,91.99865582721486,7.7473955154418945,12.40195320519831,133.75538052389493,8.870373725891113,20.62502540662672,"Great effort with your 5 iron! Your club speed is good, but let's focus on improving your accuracy. Your attack angle is slightly downward, which can lead to lower shots. The club face is open relative to your target, causing the ball to slice. Work on aligning your club face more square at impact and try to maintain a neutral attack angle. This should help with both your placement and distance.",club face alignment drill,1.1913916,70.0,101.325,73
7/31/24 20:31:15,Lauren,4 Hybrid,4 Hybrid,128.54138237184725,,,,0.0,70.54922356451925,0.5488444441995571,16.792388916015625,13.755343437194824,2205.648193359375,-1273.431396484375,2546.863037109375,Estimated,30.0,6.185600899180486,67.37161928556225,18.888330459594727,21.809861415658588,88.53821154041634,20.0572566986084,30.36499979223868,"Your club speed is good, but the ball speed is low, which means you're not getting solid contact. Your launch angle is decent, but the backspin is high, causing your ball to lose distance. Focus on hitting the ball more cleanly and reducing spin for better carry and total distance.",solid contact drill,1.1913916,70.0,101.325,73
7/31/24 20:32:02,Brian,4 Hybrid,4 Hybrid,70.7142691274239,-3.236635446548462,1.7485878467559814,1.248060941696167,-0.5005269050598145,95.2989967483336,1.347662896389541,15.90781021118164,1.2439812421798706,1617.68408203125,-136.27162170410156,1623.41357421875,Measured,4.815155029296875,11.515327099696831,121.88363747473976,2.215583562850952,4.7121303186912655,146.07768669887628,2.365957498550415,6.030504194582306,"Your shot data shows you have a good swing speed and decent ball speed, which is great! However, your attack angle is a bit too negative, meaning you're hitting down on the ball instead of sweeping it off the turf. This can cause a lower launch angle and added backspin, which limits your distance. Focus on making a more shallow swing path to improve ball launch and distance.",swing path drill,1.1913916,70.0,101.325,73
7/31/24 20:38:44,Jason,4 Hybrid,4 Hybrid,73.57612838321256,0.3529984056949615,0.150858998298645,0.2347011864185333,0.0838421881198883,103.0628666605744,1.4007650161175056,12.436846733093262,0.2116654217243194,2042.2362060546875,-451.5027160644531,2091.550537109375,Measured,12.466565132141112,10.306447943918442,129.46491420496386,3.0966134071350098,6.993573906658185,157.59471798031882,3.615304946899414,9.93754265761504,"Your shot with the 4 hybrid showed a decent ball speed and carry distance, but there's room for improvement in your consistency and launch. Focus on your attack angle and reducing sidespin to help straighten your shots. Your club path is nearly straight, which is good! Just ensure your face is slightly more aligned with the path at impact.",swing path drill,1.1913916,70.0,101.325,73
7/31/24 20:39:23,Lauren,4 Hybrid,4 Hybrid,73.09143210740422,-0.213353618979454,0.9670361876487732,12.379620552062988,11.41258430480957,99.75774851767346,1.3648350516799892,16.636476516723633,10.28990364074707,2184.104736328125,-283.52691650390625,2202.4306640625,Measured,7.396420955657959,15.08721694623796,136.31020969843303,12.667956352233888,29.892918503757983,155.14568574353143,12.850943565368652,34.50676008811797,"Your club speed is solid, but your attack angle is slightly negative, meaning you're hitting down on the ball instead of making clean contact. This can lead to less distance and control. Try to work on a more upward angle of attack. Additionally, your face angle at impact is significantly open, which is causing your shots to veer right. Focus on keeping the club face square at impact to improve accuracy.",face angle drill,1.1913916,70.0,101.325,73
7/31/24 20:39:56,Herald,4 Hybrid,4 Hybrid,72.73524634925707,-0.4486014246940613,-7.317972660064697,1.867077350616455,9.185050010681152,102.9234421354704,1.4150421879546116,8.50053882598877,0.6179836988449097,3862.01513671875,386.3976745605469,3881.296630859375,Measured,-5.713475227355957,8.37079993655027,121.59332166645618,-1.1467125415802002,-2.433648189761641,145.39421178146404,-1.4438780546188354,-3.663696641123579,"Your club speed is solid, but the attack angle is a bit negative, which can lead to lower launch and more backspin. Work on getting your attack angle to be slightly upward to help the ball launch higher and carry farther. Additionally, your club path is significantly to the left. Focus on swinging more from the inside to create a straighter shot and reduce side spin.",swing path drill,1.1913916,70.0,101.325,73
7/31/24 20:42:50,Brian,5 Wood,5 Wood,70.66780992998656,,,,0.0,73.95400562448685,1.0465020169403303,15.7073392868042,17.81857681274414,2852.023681640625,-1118.4814453125,3063.501220703125,Estimated,21.41368103027344,6.637506824270815,73.95791669991559,22.509246826171875,28.313504972394185,94.34368500177334,23.38602066040039,37.44727249984271,"Your shot with the 5 Wood is a good start, but there are a few areas to focus on for improvement. Your ball speed is decent for your club speed, but the spin rate is high, which can lead to less distance. Work on lowering your backspin for a more penetrating shot. Also, consider practicing your alignment, as the carry deviation indicates the ball is veering off your target line significantly.",alignment drill,1.1913916,70.0,101.325,73
7/31/24 20:43:45,Herald,5 Wood,5 Wood,67.67374099920562,-6.422933101654053,4.612529277801514,21.62070083618164,17.00817108154297,79.87547332174017,1.1803023173002625,10.10464572906494,18.33688735961914,2714.541015625,-1139.00146484375,2943.81689453125,Estimated,22.76256561279297,3.821636429833632,68.42958866306935,22.438331604003903,26.118817167874795,98.51429540502704,23.61961555480957,39.47100188123295,"Your shot data shows that your club speed is decent, but your attack angle is negative, which can lead to lower ball flight and added backspin. Aim to strike the ball more on the upswing for better launch. Also, the club face is open at impact, causing the ball to start right. Focus on closing the club face during your swing. Aiming for a more neutral club path will help improve your accuracy.",swing path drill,1.1913916,70.0,101.325,73
7/31/24 20:44:59,Brian,,8 Iron,70.3255504112035,-2.160888433456421,-0.1406293660402298,1.9881806373596191,2.128809928894043,92.24866393321008,1.3117375320039306,10.140239715576172,1.6155402660369873,5236.64599609375,795.86572265625,5296.7783203125,Measured,-8.64168643951416,8.35440683454351,104.339201127269,-1.1577515602111816,-2.108163816906,121.04650668937666,-1.5535597801208496,-3.281826171633924,"Your shot data shows a decent club speed and ball speed, resulting in a nice carry distance. However, your attack angle is slightly negative, suggesting you might be hitting down on the ball instead of making solid contact. This leads to high backspin and less distance. Focus on getting the ball higher in the air for better carry. Try to ensure your club face is square to the path, which will help reduce the rightward spin. Also, work on your swing path to improve accuracy and distance.",swing path drill,1.1913916,70.0,101.325,73
7/31/24 20:45:23,Brian,,8 Iron,67.43748559102323,0.6419554352760315,-1.4846205711364746,18.89249992370605,20.377120971679688,78.49841400579771,1.1640175092211154,18.756628036499023,15.332962989807127,2980.677490234375,-1720.894775390625,3441.789794921875,Estimated,30.0,9.975257847509964,87.32616077099738,23.10621452331543,34.27001023727598,102.4898823364365,24.16667366027832,41.95857323911423,"Your club speed is good for an 8 iron, but the face angle was significantly open at impact, which is causing your shots to go right. Focusing on squaring the clubface at impact can help improve your accuracy. Also, try to lower your backspin rate, which is a bit high, for better distance control.",clubface alignment drill,1.1913916,70.0,101.325,73
7/31/24 20:47:02,Jason,,Driver,36.09665030023734,,,,0.0,29.16301507809999,0.8079147188321858,37.50109100341797,-22.48918914794922,4695.900390625,0.0,4695.900390625,Estimated,-0.0,3.6845384501293097,17.408196716344605,-23.07573699951172,-6.823097326837797,24.008485316817087,-22.90591049194336,-9.344561459621332,"Your shot data shows that your club speed is on the lower side, which is affecting your ball speed and distance. The launch angle is quite high, indicating that the ball is going up but not far. Try to work on hitting the ball more on the sweet spot of the club, as your smash factor suggests there’s room for improvement in how you're making contact. It might help to focus on swinging more smoothly and keeping your head still throughout the swing to improve your consistency.",contact drill,1.1913916,70.0,101.325,73
7/31/24 20:47:41,Lauren,,Driver,77.68401059975076,-1.132906436920166,1.9771136045455933,-2.4379210472106934,-4.415034770965576,106.27456294774127,1.3680365126267342,16.744915008544922,-1.7551733255386353,1340.53955078125,-9.73024559020996,1340.5748291015625,Measured,0.4158715307712555,15.186531944239846,149.91105684763895,-1.7181695699691772,-4.494954048579132,174.74229900072532,-1.6995024681091309,-5.182517854935099,"Your swing is showing some potential! The club speed is decent, and you’re getting solid ball speed, but the attack angle is slightly negative, which means you're hitting down on the ball a bit. This can lead to lower launch and distance. Try to create a more upward angle when you strike the ball to help maximize your launch and carry distance. Also, consider straightening your club path to help with accuracy.",upward attack angle drill,1.1913916,70.0,101.325,73
7/31/24 20:48:24,Herald,,Driver,104.03770341606014,,,,0.0,105.51181121257105,1.014168976708528,10.420772552490234,5.547305107116699,1610.3175048828125,929.7171020507812,1859.434326171875,Measured,-30.0,7.113204023468995,116.35006548084492,0.2494460344314575,0.5061401859035648,159.14429268686945,-1.249135136604309,-3.46946581195175,"Your driver swing shows good ball speed, but there's room for improvement. Your launch angle is a bit low for maximizing distance, and the sidespin might be causing some unwanted curvature on your shots. Focus on hitting up on the ball and aiming for a higher launch angle for better carry distance. A more stable clubface can help reduce sidespin, leading to straighter shots.",launch angle drill,1.1913916,70.0,101.325,73
7/31/24 20:49:07,Herald,,Driver,79.83817455197277,-2.348558187484741,6.410960674285889,-3.909279584884644,-10.320240020751951,110.40417078034623,1.3828493875254593,16.560150146484375,-2.408986568450928,2234.96337890625,865.6138916015625,2396.737060546875,Measured,-21.171667098999023,18.869997719384173,158.35729029283175,-9.008152961730955,-24.794811878681458,177.4500164313631,-9.693695068359377,-29.87920995732861,"Your driver shot shows that you're hitting the ball with a decent speed and getting a respectable carry distance. However, your attack angle is slightly downward, which means you're hitting down on the ball too much. That can lead to less distance and higher spin. Also, your club face angle is left of the target, causing a slice. Focus on hitting more upwards and keeping the face square to the path to improve your shot accuracy and distance.",upward swing drill,1.1913916,70.0,101.325,73
7/31/24 20:49:42,Jason,,Driver,82.12431351522719,-3.82540512084961,7.594527721405029,-5.20120906829834,-12.795736312866213,115.22594342899174,1.4030673560227322,16.60111427307129,-3.322110652923584,1523.9200439453125,8.623250961303711,1523.9444580078125,Measured,-0.3242103457450866,18.89434645073993,173.20357098337627,-3.5072150230407715,-10.595761476401776,197.1545625897197,-3.500901222229004,-12.03922323108361,"Your driver performance shows potential, but there are some key areas to work on. Your attack angle is negative, meaning you are hitting slightly down on the ball, which can reduce distance. Focus on making sure you're sweeping the ball off the tee with a slight upward angle. Your club path is quite good, but the face angle suggests you're occasionally closing the clubface at impact, leading to a slice. Try to align your clubface more towards your target at address and through impact. Remember, a better upward strike and aligned face will help with both distance and accuracy.",upward attack angle drill,1.1913916,70.0,101.325,73
7/31/24 20:50:32,Jason,,Driver,78.3153590506272,-2.604547500610352,6.525287628173828,-2.454107999801636,-8.979395866394043,113.64053664962194,1.451063214511456,11.221305847167969,-1.1993703842163086,2750.040771484375,-1046.230224609375,2942.332763671875,Measured,20.828903198242188,13.041879708417127,150.39894092792565,5.327485084533691,13.96423626827982,169.768674821451,6.095256805419922,18.026392294928428,"Your driver speed is decent, but your attack angle is a bit on the negative side, which means you're hitting down on the ball. This can lead to excessive backspin and a lower launch. Try to hit up on the ball slightly. Your club path is good, but the club face is open at impact, causing the ball to curve left. Focus on squaring the face at impact for straighter shots.",swing path drill,1.1913916,70.0,101.325,73
7/31/24 20:51:24,Brian,,Pitching Wedge,62.326926940123485,-1.0027711391448977,-4.420799255371094,-2.036372900009156,2.3844263553619385,82.83473092072836,1.3290360200223958,20.42560195922852,-2.225884199142456,7116.12353515625,-3380.828369140625,7878.40185546875,Estimated,25.412118911743164,15.293678460435444,95.26884084181074,7.361966609954834,12.207522129456606,102.23022094055796,8.001185417175293,14.229771563541362,"Your swing speed is good for a pitching wedge, but your attack angle and club path suggest you may be coming in a bit too steep, which can lead to a hook or slice. Focusing on a more neutral swing path and ensuring your club face is aligned at impact will help improve accuracy and distance.",swing path drill,1.1913916,70.0,101.325,73
7/31/24 20:51:56,Lauren,,Pitching Wedge,65.24288690520643,-3.5532937049865723,1.185339331626892,-0.1323882043361663,-1.3177275657653809,89.13052603353572,1.366133999604224,20.569047927856445,0.0395712777972221,7670.11279296875,-2821.921142578125,8172.751953125,Estimated,20.199138641357425,18.946037182490727,106.1248498524883,8.823208808898926,16.278061395316968,112.12225965107064,9.241162300109863,18.005714750687048,"Your shot data shows that you're making good contact, but your attack angle and spin suggest that you're hitting down too much on the ball. This can lead to higher backspin and less distance. Try to focus on a slightly more positive attack angle by sweeping the club through impact. Additionally, your club path is slightly toward the target while your club face is a bit closed, which may cause your ball to curve left. Work on aligning your club face with your path during your swing.",swing path drill,1.1913916,70.0,101.325,73
7/31/24 20:52:26,Brian,,Pitching Wedge,67.2707504476075,-1.3967825174331665,3.5183253288269043,2.043968439102173,-1.4743568897247314,86.74410449368406,1.289477282719523,21.28546905517578,2.119199514389038,6411.1123046875,138.4622802734375,6412.60693359375,Estimated,-1.2372380495071411,18.82504445034897,106.97256867523356,1.8043931722640991,3.368207796451543,114.34085814757418,1.7601418495178225,3.5120265516573,"Your shot data shows that you're hitting the ball with solid speed and a decent launch angle. However, your attack angle is just slightly negative, which can cause the ball to stay lower than ideal and may affect your spin. The club path and face are also closing slightly, which could lead to some slices or hooks. Focus on achieving a more neutral swing path and a slightly more upward angle of attack for better height and carry distance.",swing path drill,1.1913916,70.0,101.325,73
7/31/24 20:53:03,Brian,,Pitching Wedge,66.04141422771363,0.3172986209392547,0.6858350038528442,1.6019067764282229,0.9160717725753784,86.54760116030411,1.3105049637774908,20.417110443115234,1.40165913105011,6015.669921875,64.50564575195312,6016.015625,Estimated,-0.6143555045127869,17.64591546855854,107.02100331432212,1.2731854915618896,2.377937925300955,115.19296570764254,1.2475675344467163,2.5079563543994823,"Your pitching wedge shot shows a decent swing speed at 66 mph, producing solid ball speed. However, your attack angle is nearly level, which may lead to a lower launch. To maximize your distance, try to hit slightly down on the ball with a consistent follow-through. Your high backspin indicates good control, but it might be affecting your carry distance. Focus on improving your swing path to aim for straighter shots with less side spin. Overall, a minor adjustment in your attack angle could yield better results.",swing path drill,1.1913916,70.0,101.325,73
7/31/24 20:53:34,Brian,,Pitching Wedge,72.20179970243953,-2.925678253173828,0.8685567378997803,4.259513854980469,3.3909571170806885,84.50419859714202,1.1703890892665216,24.06616973876953,3.607540845870972,7457.67333984375,334.41278076171875,7465.16748046875,Estimated,-2.5675048828125,20.76967226483498,101.4254967250863,2.907508373260498,5.144788063727788,106.5447752531236,2.838970184326172,5.2771343592011135,"Your club speed and ball speed are solid, but your attack angle is a touch too steep, which can lead to inconsistent strikes. The face angle suggests you're aiming a bit right of your target. To optimize your shot, work on keeping your clubface square at impact, and consider adjusting your swing path to be more neutral. Practicing with a focus on a higher launch angle will also help achieve a better height on your shots.",swing path drill,1.1913916,70.0,101.325,73
7/31/24 20:54:11,Jason,,Pitching Wedge,51.75485475317328,-4.1394548416137695,-0.9435153603553772,4.056066513061523,4.999581813812256,66.91809318209334,1.2929819531179412,24.39144325256348,3.213685989379883,6646.5546875,-1085.5438232421875,6734.619140625,Estimated,9.275894165039062,11.996904455983326,72.1046180085068,6.187828540802002,7.77203296852332,79.3365562539766,6.398407936096191,8.841375203953362,"Your shot shows a few areas to improve. The club speed is decent, but the attack angle is slightly negative, which means the club is coming down a bit steep. This can lead to less-than-ideal contact. Try to focus on a more neutral or slightly positive attack angle. The club face is open relative to your swing path, which can cause the ball to curve. Aim for a more square club face at impact. Lastly, the high backspin shows potential but may be adding unwanted height and reducing distance. Work on your setup and alignment to improve consistency.",face alignment drill,1.1913916,70.0,101.325,73
7/31/24 20:54:25,Brian,,Pitching Wedge,51.440853041776336,-2.612541675567627,-4.858884811401367,-1.874466180801392,2.984418630599976,54.71739338098223,1.0636952955765515,21.34828758239746,-2.1477067470550537,3826.951416015625,-141.8633270263672,3829.579833984375,Estimated,2.1229562759399414,5.751813116860319,48.68526435796775,-1.8509719371795648,-1.572587287454141,60.72315365486975,-1.770451903343201,-1.8760695684447484,"Your pitching wedge shot shows good ball speed, but your club path and face angles indicate that you're cutting across the ball. This can cause more sidespin and reduce accuracy. Work on getting the club path more neutral and keeping the clubface square at impact. Also, try to achieve a more consistent attack angle for better launch and distance.",swing path drill,1.1913916,70.0,101.325,73
7/31/24 20:54:39,Herald,,Pitching Wedge,54.54602895763082,-0.856980562210083,-2.098251819610596,9.08949089050293,11.187742233276367,55.96831441856693,1.0260749588579745,21.87934684753418,7.203765869140625,4665.60595703125,-991.7155151367188,4769.84033203125,Estimated,12.0001220703125,6.387533399160873,50.9213760857283,9.689576148986816,8.570600123446752,61.8478927480196,10.042203903198242,10.784644053436525,"Your club speed is solid, but your attack angle and club path indicate you might be cutting across the ball a bit, which causes side spin and affects your direction. Focus on aligning your club path more towards your target. A higher launch angle and a good amount of backspin are great, but let's work on straightening out that trajectory for better accuracy.",swing path drill,1.1913916,70.0,101.325,73
7/31/24 20:54:52,Jason,,Pitching Wedge,58.60009206162658,-4.691119194030762,-1.772952914237976,26.870006561279297,28.64295959472656,50.68081060868826,0.8648588905865534,21.50462913513184,21.849788665771484,2816.2265625,-871.8963623046875,2948.10693359375,Estimated,17.202388763427734,4.625643616572006,41.02510299462347,24.55110549926757,17.046124844238193,54.08307752109431,25.01315689086914,22.867745271193144,"Your swing path is slightly out to the right and the face is open at impact, leading to a high slice. Focus on keeping your club path more neutral as you swing and aim to close the club face a bit more at impact. This will help you get the ball flying straighter and reduce excessive spin for better control.",swing path drill,1.1913916,70.0,101.325,73
7/31/24 20:55:09,Brian,,Pitching Wedge,49.99950433406366,-5.996450901031494,-1.141445517539978,12.15051555633545,13.29196071624756,50.77424526427467,1.0154949722108184,17.824384689331055,9.837883949279783,2167.127197265625,788.7174072265625,2306.190673828125,Estimated,-19.998779296875,3.293526255396955,36.57924950927281,7.963730812072754,5.067926755324038,53.80477233519969,7.297912120819092,6.83473665871179,"Your swing shows a bit of an open club face at contact, which may be causing the ball to veer off to the right. Focus on aligning your clubface more square to your target at impact. Additionally, your attack angle is slightly downwards; aim to level that out for better contact. Working on these areas will help improve your accuracy and distance.",club face alignment drill,1.1913916,70.0,101.325,73
