asin,url,title,brand,price,availability,categories,primary_image,images,upc,manufacturer,item_model_number,package_dimensions,date_first_available,country_of_origin,color,material,style,important_information,product_overview,about_item,description,specifications,uniq_id,scraped_at
B0CJHKVG6P,https://www.amazon.com/dp/B0CJHKVG6P,"GOYMFK 1pc Free Standing Shoe Rack, Multi-layer Metal Shoe Cap Rack With 8 Double Hooks For Living Room, Bathroom, Hallway",GOYMFK,$24.99,Only 13 left in stock - order soon.,"['Home & Kitchen', 'Storage & Organization', 'Clothing & Closet Storage', 'Shoe Organizers', 'Free Standing Shoe Racks']",https://m.media-amazon.com/images/I/416WaLx10jL._SS522_.jpg,"['https://m.media-amazon.com/images/I/416WaLx10jL._SS522_.jpg ', ' https://m.media-amazon.com/images/I/41kuxipTsuL._SS522_.jpg ', ' https://m.media-amazon.com/images/I/51T9x4yZd3L._SS522_.jpg ', ' https://m.media-amazon.com/images/I/61w6ifIrCpL._SS522_.jpg ', ' https://m.media-amazon.com/images/I/51bBQlUn8GL._SS522_.jpg']",,GOYMFK,TK019,"2.36""D x 7.87""W x 21.6""H","September 21, 2023",China,White,Metal,Modern,[],"[{'Brand': ' GOYMFK '}, {'Color': ' White '}, {'Material': ' Metal '}, {'Recommended Uses For Product': ' Coats, Umbrella, Hats, Shoes '}, {'Product Dimensions': ' 2.36""D x 7.87""W x 21.6""H '}]","['Multiple layers: Provides ample storage space for shoes, coats, hats, and other accessories ', ' Easy assembly: Requires no tools and can be assembled in minutes ', ' Versatile design: Suitable for various rooms in the home, such as the hallway, living room, or bathroom ', ' Sturdy and durable: Made of high-quality metal for long-lasting use ', ' Dimensions: 47.24 inches high x 11.81 inches wide x 13.78 inches deep']","multiple shoes, coats, hats, and other items Easy to assemble: Includes all necessary hardware and instructions for easy assembly Versatile: Perfect for use in living rooms, bathrooms, hallways, and more","['Brand: GOYMFK', 'Color: White', 'Material: Metal', 'Recommended Uses For Product: Coats, Umbrella, Hats, Shoes', 'Product Dimensions: 2.36""D x 7.87""W x 21.6""H', 'Installation Type: Free Standing', 'Special Feature: Stackable', 'Style: Modern', 'Finish Type: Coated', 'Load Capacity: 44.1 Pounds', 'Number of Shelves: 5', 'Furniture Finish: Metal', 'Frame Material: Metal', 'Assembly Required: Yes', 'Maximum Weight Recommendation: 20 Kilograms', 'Manufacturer: GOYMFK', 'Part Number: TK019', 'Item Weight: 2.7 pounds', 'Country of Origin: China', 'Item model number: TK019', 'Finish: Coated', 'Special Features: Stackable', 'Included Components: 1 x Assembly instructions', 'Batteries Included?: No', 'Batteries Required?: No', 'Warranty Description: 1 year', 'ASIN: B0CJHKVG6P', 'Customer Reviews: 1.0  1.0 out of 5 stars    \n    1 rating   \n\n\n 1.0 out of 5 stars', 'Best Sellers Rank: #569,353 in Home & Kitchen (See Top 100 in Home & Kitchen)  #1,051 in Free Standing Shoe Racks', 'Date First Available: September 21, 2023']",02593e81-5c09-5069-8516-b0b29f439ded,2024-02-02 15:15:08
B0B66QHB23,https://www.amazon.com/dp/B0B66QHB23,"subrtex Leather ding Room, Dining Chairs Set of 2, Black",subrtex,,,"['Home & Kitchen', 'Furniture', 'Dining Room Furniture', 'Chairs']",https://m.media-amazon.com/images/I/31SejUEWY7L._SS522_.jpg,"['https://m.media-amazon.com/images/I/31SejUEWY7L._SS522_.jpg ', ' https://m.media-amazon.com/images/I/41mr+A9JmbL._SS522_.jpg ', ' https://m.media-amazon.com/images/I/41JjrWgA0XL._SS522_.jpg ', ' https://m.media-amazon.com/images/I/41ie5FbnfkL._SS522_.jpg ', ' https://m.media-amazon.com/images/I/41EDoJzFehL._SS522_.jpg ', ' https://m.media-amazon.com/images/I/31RijT4dnfL._SS522_.jpg ', ' https://m.media-amazon.com/images/I/71hWfuIyNPL.SS125_SS522_.jpg']",,Subrtex Houseware INC,VCZYSBTPZCY04,"18.5""D x 16""W x 35""H","July 10, 2022",,Black,Sponge,Black Rubber Wood,[],,"['【Easy Assembly】: Set of 2 dining room chairs. To make it easier for you to install our chairs, we have included tools and instructions in the package and added an installation video to the webpage. It will make the whole installation process easier and quicker(Estimated time 10-20 minutes). ', ' 【Waterproof Leather Fabric】: subrtex upholstered dinging room chair is made of premium pu leather, waterproof, breathable, skin-friendly and easy to clean when it gets water or dirty. ', ' 【Black Rubber Wood Legs】: Hold up to 265 LBS. Anti-slip padded feet design that can prevent the floor from scratching. Tips: The solid wooden legs can not be replaced individually, if you encounter problems with the legs, you can contact us to replace a new dining chair. ', ' 【Ergonomic Backrest Design】: Ergonomically designed chair back, effectively protecting your waist and back.sitting for a long time without fatigue. The simple backrest decoration fits perfectly into any kitchen, dining room decor. ', ' 【Customer Services】: One year warranty, if you have any quality or installation problems with the components of this dining room chair you can contact us, we will definitely give you a satisfactory solution, it will be a good choice!']",subrtex Dining chairs Set of 2,"['Brand: subrtex', 'Color: Black', 'Product Dimensions: 18.5""D x 16""W x 35""H', 'Size: Dining Chairs set of 2', 'Back Style: Solid Back', 'Special Feature: Ergonomic', 'Product Care Instructions: Dry Clean, Wipe Clean', 'Unit Count: 2.0 Count', 'Recommended Uses For Product: Dining,Living Room', 'Maximum Weight Recommendation: 265 Pounds', 'Style: Dining Chairs', 'Pattern: Solid', 'Room Type: Kitchen, Living Room, Dining Room', 'Age Range (Description): Teen', 'Included Components: dining room chairs set of 2', 'Shape: Rectangular', 'Model Name: leather dining chairs', 'Cartoon Character: Waterproof', 'Surface Recommendation: Hard Floor', 'Indoor/Outdoor Usage: Indoor', 'Form Factor: Upholstered', 'Furniture Finish: Leather', 'Fill Material: Sponge', 'Cushion Style: Upholstered', 'Leg Style: Black Rubber Wood', 'Item Weight: 25.4 pounds', 'Manufacturer: Subrtex Houseware INC', 'ASIN: B0B66QHB23', 'Item model number: VCZYSBTPZCY04', 'Customer Reviews: 4.0  4.0 out of 5 stars    \n    14 ratings   \n\n\n 4.0 out of 5 stars', 'Best Sellers Rank: #2,872,859 in Home & Kitchen (See Top 100 in Home & Kitchen)  #4,615 in Kitchen & Dining Room Chairs', 'Date First Available: July 10, 2022']",5938d217-b8c5-5d3e-b1cf-e28e340f292e,2024-02-02 15:15:09
B0BXRTWLYK,https://www.amazon.com/dp/B0BXRTWLYK,"Plant Repotting Mat MUYETOL Waterproof Transplanting Mat Indoor 26.8"" x 26.8"" Portable Square Foldable Easy to Clean Gardening Work Mat Soil Changing Mat Succulent Plant Transplanting Mat Garden Gifts",MUYETOL,$5.98,In Stock,"['Patio, Lawn & Garden', 'Outdoor Décor', 'Doormats']",https://m.media-amazon.com/images/I/41RgefVq70L._SS522_.jpg,"['https://m.media-amazon.com/images/I/41RgefVq70L._SS522_.jpg ', ' https://m.media-amazon.com/images/I/414SPEuzxlL._SS522_.jpg ', ' https://m.media-amazon.com/images/I/51gknsPKCHL._SS522_.jpg ', ' https://m.media-amazon.com/images/I/51mcO9+8GLL._SS522_.jpg ', ' https://m.media-amazon.com/images/I/51BbYwggQSL._SS522_.jpg ', ' https://m.media-amazon.com/images/I/51tkCe9KQzL._SS522_.jpg ', ' https://m.media-amazon.com/images/I/71EIk5N4xcL.SS125_SS522_.jpg']",,MUYETOL,htdz-2038,"26.8""L x 26.8""W",,,Green,Polyethylene,Modern,[],"[{'Brand': ' MUYETOL '}, {'Size': ' 26.8*26.8 '}, {'Item Weight': ' 0.08 Kilograms '}, {'Pile Height': ' High Pile '}, {'Back Material Type': ' Polyethylene '}]","['PLANT REPOTTING MAT SIZE: 26.8"" x 26.8"", square, foldable, easy to carry. Good size perfectly suited for daily gardening needs. ', ' TRANSPLANTING MAT MATERIAL: High quality thick PE material, light texture and no odor. Double waterproof coating and very wear-resistant can be reused. A pair of buttons at each corner, if you button up it, the mat will turns into a square tray with sides, Keep soil and water from spilling. ', ' SOIL CHANGING MAT USES: This Gardening mat is perfect for indoor outdoor patio and lawn use for pot transplanting, soil changing, loosening, pruning, watering, fertilizing, transplanting, hydroponics, changing pots, clean up your vases, artwork etc, While controlling dirt and keeping it tidy. ', ' EASY TO CLEAN & STORE: Rinse with water or wipe clean with a damp paper towel or cloth. Easily folded, folded size 7"" x 7"" x 0.5"" or smaller, Takes up little space so it\'s easy to carry and store. ', ' GARDENING GIFT IDEAS: This foldable gardening mat can replace newspapers and cardboard boxes to make gardening easy fun and tidy, so this is a great gift for anyone who loves plants and gardening.']",,"['Brand: MUYETOL', 'Size: 26.8*26.8', 'Item Weight: 0.08 Kilograms', 'Pile Height: High Pile', 'Back Material Type: Polyethylene', 'Color: Green', 'Indoor/Outdoor Usage: Indoor', 'Theme: Garden,Plant,Succulent', 'Is Stain Resistant: No', 'Product Care Instructions: Hand Wash Only', 'Pattern: Solid', 'Shape: Rectangular', 'Special Feature: Waterproof', 'Product Dimensions: 26.8""L x 26.8""W', 'Style: Modern', 'Number of Pieces: 1', 'Item Weight: 2.89 ounces', 'Manufacturer: MUYETOL', 'ASIN: B0BXRTWLYK', 'Item model number: htdz-2038', 'Customer Reviews: 4.7  4.7 out of 5 stars    \n    107 ratings   \n\n\n 4.7 out of 5 stars', 'Best Sellers Rank: #19,814 in Patio, Lawn & Garden (See Top 100 in Patio, Lawn & Garden)  #272 in Outdoor Doormats', 'Antibacterial treatment: Buckle', 'Batteries required: No']",b2ede786-3f51-5a45-9a5b-bcf856958cd8,2024-02-02 15:15:09
B0C1MRB2M8,https://www.amazon.com/dp/B0C1MRB2M8,"Pickleball Doormat, Welcome Doormat Absorbent Non-Slip Floor Mat Bathroom Mat 16x24",VEWETOL,$13.99,Only 10 left in stock - order soon.,"['Patio, Lawn & Garden', 'Outdoor Décor', 'Doormats']",https://m.media-amazon.com/images/I/61vz1IglerL._SS522_.jpg,"['https://m.media-amazon.com/images/I/61vz1IglerL._SS522_.jpg ', ' https://m.media-amazon.com/images/I/41KiuOZ9IlL._SS522_.jpg ', ' https://m.media-amazon.com/images/I/61N7oADRxIL._SS522_.jpg ', ' https://m.media-amazon.com/images/I/51P410C3CpL._SS522_.jpg ', ' https://m.media-amazon.com/images/I/51VZUO3bm3L._SS522_.jpg ', ' https://m.media-amazon.com/images/I/61Gchr9jOHL._SS522_.jpg']",,Contrence,,"24""L x 16""W","April 6, 2023",,A5589,Rubber,Modern,[],"[{'Brand': ' VEWETOL '}, {'Size': ' 16*24INCH '}, {'Material': ' Polyester, Rubber '}, {'Pile Height': ' Low Pile '}, {'Back Material Type': ' Rubber '}]","['Specifications: 16x24 Inch ', "" High-Quality: Our mat's back are made of high quality rubber Material, Backed with a rubber non-slip, Made of high quality polyester. Perfect for both indoor and outdoor use. "", ' Easy to Wash: You Can be easily cleaned by shaking, can sweep with a broom, clean it with a hand-held vacuum. ', "" Decor Mat Use For Home: Have a wonderful begin in the kitchen/bathroom/indoor/floor mats/Living Room. Decor to your front door, home, lobby, farmhouse, office, patio, garage, bathroom, living spaces and many more common areas. As a gift for Valentine's Day, Christmas, Halloween,New Year, Birthday, all holiday and party gifts. "", ' Customer Service: We provide 100% 0 risk purchase, we promise the best service, if you have any question about our product, please contact us , we will reply by e-mail within 24 hours.']","The decorative doormat features a subtle textured surface that absorbs moisture and helps remove dirt and debris from your shoes.Molded from recycled rubber with a coarse polyester surface, this door mat offers added functionality for your entryways exposed to the elements.The low-profile height offers ideal functionality for high traffic areas and in entryways as it will not obstruct doors from opening or closing.Simply vacuum, shake out, or sweep off debris, spot clean with a solution of mild detergent and water. Do not bleach. Air dry. Dry flat.Greet your guests with this stylish and durable doormat. Perfect for any entryway in your home and Airbnb properties.We provide 100% 0 risk purchase, we promise the best service, if you have any question about our product, please contact us , we will reply by e-mail within 24 hours.","['Brand: VEWETOL', 'Size: 16*24INCH', 'Material: Polyester, Rubber', 'Pile Height: Low Pile', 'Back Material Type: Rubber', 'Color: A5589', 'Indoor/Outdoor Usage: Indoor', 'Is Stain Resistant: No', 'Product Care Instructions: Hand Wash Only', 'Pattern: Letter Print', 'Shape: Rectangular', 'Special Feature: Absorbent,Non-slip', 'Room Type: Bathroom', 'Product Dimensions: 24""L x 16""W', 'Rug Form Type: Doormat', 'Style: Modern', 'Item Weight: 3.36 ounces', 'Manufacturer: Contrence', 'ASIN: B0C1MRB2M8', 'Customer Reviews: 3.0  3.0 out of 5 stars    \n    1 rating   \n\n\n 3.0 out of 5 stars', 'Best Sellers Rank: #599,420 in Patio, Lawn & Garden (See Top 100 in Patio, Lawn & Garden)  #9,205 in Outdoor Doormats', 'Date First Available: April 6, 2023']",8fd9377b-cfa6-5f10-835c-6b8eca2816b5,2024-02-02 15:15:10
B0CG1N9QRC,https://www.amazon.com/dp/B0CG1N9QRC,"JOIN IRON Foldable TV Trays for Eating Set of 4 with Stand,Folding TV/Snack Tray Table Set,Folding TV Dinner Tables for Small Space,(Grey)",JOIN IRON Store,$89.99,Usually ships within 5 to 6 weeks,"['Home & Kitchen', 'Furniture', 'Game & Recreation Room Furniture', 'TV Trays']",https://m.media-amazon.com/images/I/41p4d4VJnNL._SS522_.jpg,"['https://m.media-amazon.com/images/I/41p4d4VJnNL._SS522_.jpg ', ' https://m.media-amazon.com/images/I/51nycdOa5kL._SS522_.jpg ', ' https://m.media-amazon.com/images/I/416f7xG0D6L._SS522_.jpg ', ' https://m.media-amazon.com/images/I/51ayCcN+W7L._SS522_.jpg ', ' https://m.media-amazon.com/images/I/51vzmAJZk8L._SS522_.jpg ', ' https://m.media-amazon.com/images/I/51ayCcN+W7L._SS522_.jpg']",,,,"18.9""D x 14.2""W x 26""H",,,Grey Set of 4,Iron,X Classic Style,[],,"['Includes 4 Folding Tv Tray Tables And one Coordinating Stand.TV Tray Table Set Measures: 26"" H x 18.9"" W x 14.2"" D, Coordinating Stand Set Measures: 34.4"" H x 10.5"" W x 10.2"" D,Desktop Material: Particleboard Wood; Support Material: Metal. ', ' 【X Classic Style】This elegant industrial-style TV tray combines an X-shaped base with industrial gray particleboard for a unique exquisite charm. Whether you want to match your home computer cabinet, coffee table or sofa, it will bring you convenience and speed. ', ' 【Multi-Occasion Use】Four folding tray tables can be used alone, or a combination of two tray tables, four tray tables can be used. Very suitable for a person in front of the TV to enjoy dinner or snacks, a few people outdoor picnic, etc., a variety of special occasions pull out to use. ', ' 【Versatile Use】This table not only provides ample room to keep things within reach but also works perfectly as a quick pop-up table to serve extra drinks and snacks. The perfect addition to dorm rooms or smaller living spaces, its sleek design can also fit in with many styles of decor, a perfect choice for every home. ', "" 【Space Save】These folding tables set of 4 are very flexible.Each table can be folded flat for storage.You can fold it up and put it on the storage rack when you don't need it.""]",Set of Four Folding Trays With Matching Storage Rack.,"['Brand: JOIN IRON', 'Shape: Rectangular', 'Included Components: Hardware', 'Color: Grey Set of 4', 'Model Name: ICZDZ22916', 'Model Number: ICZDZ22916', 'Age Range (Description): Adult', 'Customer Reviews: 5.0  5.0 out of 5 stars    \n    3 ratings   \n\n\n 5.0 out of 5 stars', 'Best Sellers Rank: #1,685,657 in Home & Kitchen (See Top 100 in Home & Kitchen)  #210 in TV Trays', 'Style: X Classic Style', 'Table design: Tray Table', 'Pattern: Solid', 'Assembly Required: Yes', 'Recommended Uses For Product: Dining, Snacking', 'Product Dimensions: 18.9""D x 14.2""W x 26""H', 'Item Width: 14.2 inches', 'Size: 26"" H x 18.9"" W x 14.2"" D', 'Item Weight: 26.8 Pounds', 'Number of Items: 1', 'Unit Count: 1.0 Count', 'Frame Material: Iron', 'Top Material Type: Iron', 'Is Stain Resistant: No', 'Special Feature: Folding', 'Is Foldable: Yes', 'Base Type: X', 'Indoor/Outdoor Usage: Indoor']",bdc9aa30-9439-50dc-8e89-213ea211d66a,2024-02-02 15:15:11
B0C9WYYFLB,https://www.amazon.com/dp/B0C9WYYFLB,"LOVMOR 30'' Bathroom Vanity Sink Base Cabine, Storage Cabinet with 3-Drawers on The Left, Suitable for Bathrooms, Kitchens, Laundry Rooms and Other Places.",LOVMOR,,Only 5 left in stock - order soon.,"['Home & Kitchen', 'Furniture', 'Bathroom Furniture', 'Bathroom Sets']",https://m.media-amazon.com/images/I/41zMuj2wvvL._SS522_.jpg,"['https://m.media-amazon.com/images/I/41zMuj2wvvL._SS522_.jpg ', ' https://m.media-amazon.com/images/I/41h0FQWG5IL._SS522_.jpg ', ' https://m.media-amazon.com/images/I/41thgR6LltL._SS522_.jpg ', ' https://m.media-amazon.com/images/I/41oC3JqceaL._SS522_.jpg ', ' https://m.media-amazon.com/images/I/5114WNPHqLL._SS522_.jpg ', ' https://m.media-amazon.com/images/I/51srjcedjJL._SS522_.jpg ', ' https://m.media-amazon.com/images/I/41+zRuSrmkL._SS522_.jpg']",,,Bathroom vanity,"21""D x 30""W x 34.5""H","July 1, 2023",Vietnam,Cameo Scotch,Wood,"Soft-closing Switch, Soft-closing Switch",[],,"['Durable & Lightweight Construction: Our bathroom sink base cabinets are crafted from plywood and high-quality HDF density fiberboard, providing a sturdy, lightweight design that resists cracking, warping, and moisture for long-lasting use. ', ' Adjustable storage space: Our bathroom storage cabinets do not include shelves, the interior of the bathroom cabinets are left with screw holes where shelves can be installed, with 2-3 positions for DIY accessories. (Note: Depending on the width of the cabinet, some drawers are only used as decoration!) ', ' ADVANCED SOFT CLOSING DESIGN: This sink storage cabinet has a soft closing design for the cabinet door. Any quick closing of the cabinet door is able to close quietly and smoothly without making any noise. ', ' High quality finish: The surface paint of this bathroom cabinet uses a spray painting process, which is comfortable to touch and looks very beautiful. Moreover, the paint with strong stain resistance makes cleaning very easy and can be cleaned up with just a light wipe with a damp cloth. ', ' MULTI-PURPOSE, EASY ASSEMBLY: Our bathroom sink base cabinets do not come with a sink suitable for bathrooms, laundry rooms, kitchens and more. Our kitchen sink base cabinets require assembly, and the package includes all necessary accessories and hardware, plus our detailed instructions for quick and easy assembly.']","Our versatile bathroom sink base cabinet is perfect for adding style and function to your home. It's made from high-quality materials that are lightweight, durable and resistant to moisture. The spray paint ensures a long-lasting, smooth appearance. With adjustable shelves and soft-close doors, this cabinet offers flexible storage options while being easy to maintain. Ideal for bathrooms, kitchens or other spaces, your mood will be happier as you transform your living area into an organized, clutter-free environment. Don't wait any longer, it's time to get a new set of cabinets for your home!","['Brand: LOVMOR', 'Color: Cameo Scotch', 'Recommended Uses For Product: Undersink', 'Product Dimensions: 21""D x 30""W x 34.5""H', 'Special Feature: Bagless', 'Mounting Type: Floor Mount', 'Room Type: Bathroom', 'Door Style: Soft-closing Switch, Soft-closing Switch', 'Included Components: Cover', 'Finish Type: Painted', ""Size: 30''W+Left"", 'Shape: Rectangular', 'Item Weight: 77 Pounds', 'Base Type: Pedestal', 'Installation Type: Freestanding', 'Back Material Type: Engineered Wood', 'Assembly Required: Yes', 'Frame Material: Wood', 'Item Weight: 77 pounds', 'Country of Origin: Vietnam', 'Item model number: Bathroom vanity', 'ASIN: B0C9WYYFLB', 'Customer Reviews: 5.0  5.0 out of 5 stars    \n    4 ratings   \n\n\n 5.0 out of 5 stars', 'Best Sellers Rank: #5,572,904 in Home & Kitchen (See Top 100 in Home & Kitchen)  #284 in Bathroom Furniture Sets', 'Date First Available: July 1, 2023']",20da3703-26f1-53e5-aa0b-a8104527d1bb,2024-02-02 15:15:11
B09NZY3R1T,https://www.amazon.com/dp/B09NZY3R1T,"Folews Bathroom Organizer Over The Toilet Storage, 4-Tier Bathroom Shelves Over Toilet Shelf Above Toilet Storage Rack Freestanding Bathroom Space Saver Adjustable Shelves and Baskets, Black",Folews Store,$63.99,In Stock,"['Home & Kitchen', 'Furniture', 'Bathroom Furniture', 'Over-the-Toilet Storage']",https://m.media-amazon.com/images/I/41ixgM73DgL._SS522_.jpg,"['https://m.media-amazon.com/images/I/41ixgM73DgL._SS522_.jpg ', ' https://m.media-amazon.com/images/I/41WLiP-jOaL._SS522_.jpg ', ' https://m.media-amazon.com/images/I/41i3PONnKTL._SS522_.jpg ', ' https://m.media-amazon.com/images/I/31U4qzySmeL._SS522_.jpg ', ' https://m.media-amazon.com/images/I/51pJLCJgtZL._SS522_.jpg ', ' https://m.media-amazon.com/images/I/51CkG4IzRnL._SS522_.jpg ', ' https://m.media-amazon.com/images/I/71D2M6vIXAL.SS125_SS522_.jpg']",,Folews,Over the toilet shelf 4 tiers,"12.6""D x 25.2""W x 68.5""H","December 22, 2021",China,,,Classic,[],,"['4 Tier Large Capacity: The 4-tier design of our over toilet storage maximizes the vertical space of a limited bathroom, providing efficient storage for bathroom essentials, while the compact footprint ensures suitability for bathrooms of all sizes ', ' Stable Over Toilet Shelf: Thickened support poles, three stabilizer bars, and the bottom widening anti-tilt design make the over-toilet-storage more stable and durable. Suitable for bathrooms, laundry rooms, balconies, porches, and so on ', ' Easy To Install: There are no tools required to assemble, just joint clips and screw threads! And this bathroom shelf over toilet comes with a detailed installation guide ', ' Durability and Quality: Built with a sturdy iron construction, our over toilet storage shelf ensures long-lasting durability, and the powder-coated black finish provides resistance against wear and tear, maintaining its quality over time ', ' Adjustable Toilet Rack: The order and spacing of shelves/baskets can be adjusted, and stabilizer bars are also fully adjustable, so it is suitable for toilets of various heights with or without a wall pipe ', ' Well-Considered Design: The over toilet storage shelf is designed for easy leveling on uneven floors with the leveling feet. Six hooks and one toilet paper holder bring you extra storage space. The 4 shelf liners prevent small objects from falling ', "" Worry-Free Customer Service: If anything is missing or there are any other issues with your over the toilet storage shelf, please get in touch and we'll provide a solution within 24 hours. We value every customer's shopping experience""]",,"['Room Type: Laundry Room, Bathroom, Bedroom, Living Room, Dining Room', 'Number of Shelves: two baskets and two open shelves', 'Special Feature: Durable, Adjustable', 'Product Dimensions: 12.6""D x 25.2""W x 68.5""H', 'Style: Classic', 'Age Range (Description): Adult', 'Finish Type: Painted', 'Brand: Folews', 'Product Care Instructions: Wipe with Dry Cloth', 'Size: 25.2 x 12.6 x 68.5 inches', 'Assembly Required: Yes', 'Recommended Uses For Product: Bathroom, Toilet', 'Number of Items: 1', 'Manufacturer: Folews', 'Model Name: Folews over toilet shelf', 'Item Weight: 18.3 Pounds', 'Furniture Finish: Black', 'Installation Type: Freestanding', 'Specific Uses For Product: Bathroom space saver over toilet', 'Product Name: 4-tier over the toilet storage', 'Item Weight: 18.3 pounds', 'ASIN: B09NZY3R1T', 'Country of Origin: China', 'Item model number: Over the toilet shelf 4 tiers', 'Customer Reviews: 4.6  4.6 out of 5 stars    \n    518 ratings   \n\n\n 4.6 out of 5 stars', 'Best Sellers Rank: #151,522 in Home & Kitchen (See Top 100 in Home & Kitchen)  #114 in Over-the-Toilet Storage', 'Date First Available: December 22, 2021']",aba4138e-6401-52ca-a099-02e30b638db4,2024-02-02 15:15:12
