asin,url,title,brand,price,availability,categories,primary_image,images,upc,manufacturer,item_model_number,package_dimensions,date_first_available,country_of_origin,color,material,style,important_information,product_overview,about_item,description,specifications,uniq_id,scraped_at
B0CHMQC63H,https://www.amazon.com/dp/B0CHMQC63H,"KoiHome Wooden Daybed with 2 Storage Drawers, Twin Size Platform Bed Frame, Daybed Twin for Kids Boy Girls Bedroom,Living Room, Office, No Box Spring Needed, Twin Size Day Beds Sofas in Espresso",KoiHome,,In Stock,"['Home & Kitchen', 'Furniture', 'Bedroom Furniture', 'Beds, Frames & Bases', 'Beds']",https://m.media-amazon.com/images/I/511irNkgawL._SS522_.jpg,"['https://m.media-amazon.com/images/I/511irNkgawL._SS522_.jpg ', ' https://m.media-amazon.com/images/I/41fKQMircFL._SS522_.jpg ', ' https://m.media-amazon.com/images/I/41q7yGDOiLL._SS522_.jpg ', ' https://m.media-amazon.com/images/I/51t9HFFCCNL._SS522_.jpg ', ' https://m.media-amazon.com/images/I/51GzUgPobkL._SS522_.jpg ', ' https://m.media-amazon.com/images/I/31mzUXcDkwL._SS522_.jpg ', ' https://m.media-amazon.com/images/I/31TqO2sac0L._SS522_.jpg']",,,Wood Bed,"77.1""L x 40.7""W x 23.1""H","September 8, 2022",Vietnam,Espresso,,,[],,"['【Built-in Drawers Daybed】 : The daybed is equipped with a pair of drawers. This compact and functional design saves space, increases storage and provides hiding space for clothes and bedtime stories. Roller design makes drawer push out and hide more easily. This twin size bed is both practical and beautiful, and will enhance any bedroom. This will definitely make the best assistant in your bedroom. ', ' 【Multiple Application Scenarios】: The upholstered daybed twin size is widely used. In the room, it is a small platform bed, which is very suitable for small compact rooms. If placed in the office, it can be used as a couch for receiving guests or a temporary rest tool for lying down. This design meets the needs of modern people and can definitely bring you ultimate convenience. ', ' 【Modern Design Style Twin Size Daybed】: This twin size bed is designed with a clean silhouette and elegant tones. It adds a modern and timeless style spark to any room. Contemporary design with clean lines that complement any decor. This daybed is definitely a great addition to your bedroom. ', ' 【Clean Lines & High Quality Daybed】: The daybed twin size is made of high-quality pine wood and MDF, All of the wood pieces have a smooth, splinter-free finish on all sides. Featuring clean lines, this girls/boys bed adds a dose of rustic style to your room, elegant and suitable for any room style. Solid and reinforced wood slats provide excellent support, increasing load-bearing capacity and ensuring safe use. No Box Spring Required. ', ' 【Easy Assembly】: Each order comes with a clear and detailed assembly instruction guide . All parts included in your package are indicated clearly and provides all the necessary tools to get your product assembled quickly. If you have any questions, please don’t hesitate to contact one of our friendly customer service representatives.']","The simple and exquisite style also comes with two drawers. It is a very practical single-layer bed. This bed is a good choice in the living room and bedroom. Two large drawers can hold a lot of items and are placed under the bed, saving a lot of space. Drawers with wheels can be placed on both sides of the bed. High-quality materials can make this bed long-lasting and very durable. Description:Material: Pine wood+MDFSize: TwinColor: EspressoDecoration: With two drawersNumbers of Package: 1Spring box: No needAssembly Required: YesOrigin: VietnamWeight & Dimensions:Overall Product Dimension: 77.1''L*40.7''W*23.1''HPackage Dimension: Please refer to the SpecificationBed Dimension: 40.7''x 77.1''Drawer: 36.8'' x 17.6''Total Height: 23.1''Numbers of slat: 8Overall Product Weight: 68.5lbWeight Capability: 250lb Recommended Mattress Thickness: 6''Modern Bed FrameThis bed frame is a minimalistic, stylish bed frame that works well with a variety of decorating styles and makes it easy for you to enhance and improve your space.Feature:- Constructed with durable wood and steel frame with thick foam padding for unique durability and support.- Create beautiful natural textured linen upholstery on a sturdy bed frame. It looks gorgeous and modern.- The mattress can be placed directly on the slats, no box springs needed, you can save more money and time.Rest PeacefullyHigh quality bed frame with strong support for your mattress and a comfortable design.Superior CraftsmanshipDurable construction crafted with care and easy to maintain upholstery.Versatile Style Great for Farmhouse, Transitional, or TraditionalUpdate your bedroom with this beautiful versatile farmhouse, transitional, or traditional style bed frame.","['Size: Twin Size Platform Bed with 2 Storage Drawers', 'Product Dimensions: 77.1""L x 40.7""W x 23.1""H', 'Special Feature: Spindles', 'Color: Espresso', 'Included Components: Bed', 'Brand: KoiHome', 'Furniture Finish: Wooden', 'Assembly Required: Yes', 'Item Weight: 10 pounds', 'Country of Origin: Vietnam', 'Item model number: Wood Bed', 'ASIN: B0CHMQC63H', 'Best Sellers Rank: #3,061,418 in Home & Kitchen (See Top 100 in Home & Kitchen)  #7,310 in Beds', 'Date First Available: September 8, 2022']",a8c63d2b-e8f3-5c06-a8d4-33f15bdcbdf3,2024-02-02 18:55:57
B07X5VSLV1,https://www.amazon.com/dp/B07X5VSLV1,"Soerreo Shoe Slot Storage Box Adjustable Shoe Rack Save Space Suitable for High Low Heels, Sneakers and Sandals (10 Piece Set)",Soerreo,$15.49,In Stock,"['Home & Kitchen', 'Storage & Organization', 'Clothing & Closet Storage', 'Shoe Organizers', 'Shoe Slots']",https://m.media-amazon.com/images/I/4127YVIANkL._SS522_.jpg,"['https://m.media-amazon.com/images/I/4127YVIANkL._SS522_.jpg ', ' https://m.media-amazon.com/images/I/41fYsXEAsHL._SS522_.jpg ', ' https://m.media-amazon.com/images/I/41xIma7qzJL._SS522_.jpg ', ' https://m.media-amazon.com/images/I/41d4ezoOuTL._SS522_.jpg ', ' https://m.media-amazon.com/images/I/51W40qzepKL._SS522_.jpg ', ' https://m.media-amazon.com/images/I/61NZhW2rPCL._SS522_.jpg ', ' https://m.media-amazon.com/images/I/61WBPpbYu6L._SS522_.jpg']",,Soerreo,Shoe Slots-1,9.84 x 3.74 x 2.75 inches,"August 27, 2019",China,10 Piece Set,Plastic,Modern,[],"[{'Brand': ' Soerreo '}, {'Color': ' 10 Piece Set '}, {'Material': ' Acrylonitrile Butadiene Styrene '}, {'Recommended Uses For Product': ' Shoes '}, {'Installation Type': ' Free Standing '}]","['【Non Slip ABS Plastic】The Shoe Slots are made of high quality non slip ABS plastic, with great grip for your shoes sole, these slots can hold any shoe footwear outfit and size. Get your shoe pair at a glance, stiletto, high heels, sneakers, slippers or sandals. ', ' [Optimize Space Efficiency] Double-Layer Shoe Rack Design, Now Choose Soerreo Shoe Slot, You Can Save 50% Of Storage Capacity Immediately! Save Space. Make Your Room Look More Tidy And Orderly. ', "" 【NON-SLIP DESIGN】The surface bump processing makes the sole have better grip, so don't worry that the shoes will fall. "", ' 【ADJUSTABLE HEIGT】It’s got a adjustment button at the back,you can change the height very easily within a second. The hollow bars aside the adjuster and the very open structure as a whole make more space for air circulation. Sturdy joints provide firm holding of your beloved shoes. Easy to operate and clean. ', ' We are committed to providing our customers with higher quality products and a comfortable customer experience. If you have any problems with the , please let us know and we will try our best to do our best.']",,"['Brand: Soerreo', 'Color: 10 Piece Set', 'Material: Acrylonitrile Butadiene Styrene', 'Recommended Uses For Product: Shoes', 'Installation Type: Free Standing', 'Special Feature: With Adjustable Shelves', 'Style: Modern', 'Frame Material: Plastic', 'Assembly Required: Yes', 'Item Weight: 2.4 Pounds', 'Maximum Weight Recommendation: 35 Pounds', 'Manufacturer: Soerreo', 'Part Number: Shoe Slots-1', 'Item Weight: 2.4 pounds', 'Product Dimensions: 9.84 x 3.74 x 2.75 inches', 'Country of Origin: China', 'Item model number: Shoe Slots-1', 'Special Features: With Adjustable Shelves', 'Batteries Included?: No', 'Batteries Required?: No', 'ASIN: B07X5VSLV1', 'Customer Reviews: 4.1  4.1 out of 5 stars    \n    307 ratings   \n\n\n 4.1 out of 5 stars', 'Best Sellers Rank: #76,145 in Home & Kitchen (See Top 100 in Home & Kitchen)  #12 in Shoe Slots', 'Date First Available: August 27, 2019']",feca0b89-547f-5bca-9b97-f255c5467e47,2024-02-02 18:55:58
B0CJV7SF48,https://www.amazon.com/dp/B0CJV7SF48,"Arch Window Wall Mirror for Living Room,White Cathedral Wooden Decorative Arch Windowpane Mirror Large Vintage Farmhouse Mirror",GLCS GLAUCUS Store,$99.99,Only 12 left in stock - order soon.,"['Home & Kitchen', 'Home Décor Products', 'Mirrors', 'Wall-Mounted Mirrors']",https://m.media-amazon.com/images/I/419YPa-PWhL._SS522_.jpg,"['https://m.media-amazon.com/images/I/419YPa-PWhL._SS522_.jpg ', ' https://m.media-amazon.com/images/I/41IVBtESloL._SS522_.jpg ', ' https://m.media-amazon.com/images/I/41mYi0-0r1L._SS522_.jpg ', ' https://m.media-amazon.com/images/I/310wq4g-jxL._SS522_.jpg ', ' https://m.media-amazon.com/images/I/41rqrTl4EJL._SS522_.jpg ', ' https://m.media-amazon.com/images/I/41xIsdE1cHL._SS522_.jpg ', ' https://m.media-amazon.com/images/I/51XVmxEr+CL._SS522_.jpg']",,,,"36""L x 24""W",,,Black,Wood,French Country,[],"[{'Brand': ' GLCS GLAUCUS '}, {'Room Type': ' Living Room '}, {'Shape': ' Arch '}, {'Product Dimensions': ' 36""L x 24""W '}, {'Frame Material': ' Engineered Wood '}]","['Arch Wall Mirror Size: Wall display dimensions are 24 inches across by 36 inches high by 0.98 inches deep. The large size makes it an easy way to add dimension to your space. ', ' Wood Windowpane Arch Mirror Design：Large Arch mirrors is made of high-quality glass, reflects clear image that gives the best visual experience. It makes the bright light bounce around to provide a second look at your favorite decor mirror.Distressed white farmhouse mirror for a minimal cathedral design. ', ' Easy to Hang: Comes ready to hang with 2 pre-installed D-ring on the back. Perfect to mount in an entry or hallway, living room, bathroom or bedroom. ', ' Arch Wall Mirror for Living Room Use:The windowpane motif of this decor accessory makes it look like an additional window opening at the wall And the curved arches add a vintage farmhouse appeal. Hang in a dining area or any indoor rooms for an added aesthetic that pops. The pursuit of beauty, maintain their love of beauty, to be the most beautiful themselves. ', ' Distressed Finish Handcraft: Since our products has been lightly distressed finish for a vintage feel, this part of process are proudly made in the handwork,so each product looks slightly different. It is recommended to unpack the package and place it in a ventilated place for two days before hanging it.']","Brighten up any room or create the illusion of a larger space with this Distressed White Arched Windowpane Wood Framed Wall Mounted Mirror!Product Specification:Color: Distressed whiteShape: ArchedProduct Care: Wipe clean with soft, dry clothKey Features:* Made of sturdy wood frame and HD glass mirror.* Easy to hang with 2 pre-installed D-ring hangers.* Hangs securely on any surface with 2 metal D-rings on the back or lean it up against a wall on your mantel.* Arched-shaped design, a classic minimalist design gives visible comfort.* The cathedral inspired arched design mirror is an affordable way to decorate your wall while bringing light and space into a room.* Distressed white wall mirror delivers an elegant rustic farmhouse touch, which will be the perfect focal point to any decor.* Perfect to mount in an entry, hallway, living room or bedroom.Warranty:Full refund or free replacement for mirror(s) damaged on arrival, no return is needed.Just send some pictures to us through Amazon Message to show the damaged mirror(s).Feel free to ask us with any questions or concerns and we will be happy to help in less than 24 hours!","['Room Type: Living Room', 'Mounting Type: Wall Mount', 'Surface Recommendation: Glass', 'Special Feature: Window Mirror', 'Frame Type: Framed', 'Frame Material: Engineered Wood', 'Finish Type: Brushed', 'Material: Wood', 'Product Dimensions: 36""L x 24""W', 'Assembly Required: No', 'Customer Reviews: 4.2  4.2 out of 5 stars    \n    21 ratings   \n\n\n 4.2 out of 5 stars', 'Best Sellers Rank: #913,711 in Home & Kitchen (See Top 100 in Home & Kitchen)  #2,658 in Wall-Mounted Mirrors', 'Brand: GLCS GLAUCUS', 'Number of Pieces: 1', 'Number of Items: 1', 'Shape: Arch', 'Style: French Country', 'Color: Black', 'Theme: Vintage']",8e230727-1a1b-547f-a233-3ccc4ef17bdb,2024-02-02 18:55:58
B0C9FWFGRP,https://www.amazon.com/dp/B0C9FWFGRP,"Jennifer Taylor Home Jacob 18"" Storage Cube Ottoman, Tan Floral Jacquard",Jennifer Taylor Home Store,,Temporarily out of stock.,"['Home & Kitchen', 'Furniture', 'Living Room Furniture', 'Ottomans']",https://m.media-amazon.com/images/I/51KOhS-ZWZL._SS522_.jpg,"['https://m.media-amazon.com/images/I/51KOhS-ZWZL._SS522_.jpg ', ' https://m.media-amazon.com/images/I/51XdOLpK3EL._SS522_.jpg ', ' https://m.media-amazon.com/images/I/51rreowhDcL._SS522_.jpg ', ' https://m.media-amazon.com/images/I/511RI4PfCgL._SS522_.jpg']",,"ACG Green Group, Inc.",2319-599,"19""D x 19""W x 18""H","April 27, 2017",China,Tan Floral Jacquard,Engineered Wood,Contemporary,[],,"['Jennifer Taylor Home Natalia Storage Ottoman Nailhead Accent Trim Navy Blue ', ' Bench-made home furnishing products carefully hand built by experienced craftsmen and women ', ' A sturdy frame of kiln-dried solid hardwood and 11-layer plywood for strength and support that will last ', ' Upholstered in high-quality woven fabric atop premium high-density flame-retardant foam for a luxurious medium firm feel']","The Jacob Collection cube storage ottoman by Jennifer Taylor Home is a multi-functional all-star for any space in the home. The seat flips open on sturdy hinges to reveal a storage compartment for storing away toys, blankets, and knick knacks. Place this pouf in a bedroom at the end of a bed, living room as a side table or footrest, or entryway for a perfect seat.","['Product Dimensions: 19""D x 19""W x 18""H', 'Color: Tan Floral Jacquard', 'Brand: Jennifer Taylor Home', 'Fabric Type: Velvet', 'Base Material: Birch', 'Frame Material: Engineered Wood', 'Seat Height: 18 Inches', 'Product Care Instructions: Hand Wash Only', 'Maximum Weight Recommendation: 150 Pounds', 'Assembly Required: No', 'Size: 18 inch', 'Style: Contemporary', 'Item Weight: 11 pounds', 'Manufacturer: ACG Green Group, Inc.', 'ASIN: B0C9FWFGRP', 'Country of Origin: China', 'Item model number: 2319-599', 'Best Sellers Rank: #1,936,209 in Home & Kitchen (See Top 100 in Home & Kitchen)  #2,540 in Ottomans', 'Date First Available: April 27, 2017']",a031f165-da10-5a86-8d1b-d281590e33c9,2024-02-02 18:55:59
B0BWY5RPD1,https://www.amazon.com/dp/B0BWY5RPD1,"C COMFORTLAND Unstuffed Faux Leather Ottoman Pouf, Round Foot Rest Poof Ottomans, Floor Foot Stool Poufs, Bean Bag Cover with Storage for Living Room, Bedroom, Grey (No Filler)",C COMFORTLAND Store,$27.99,Only 10 left in stock - order soon.,"['Home & Kitchen', 'Furniture', 'Living Room Furniture', 'Poufs']",https://m.media-amazon.com/images/I/51qAukZMUDL._SS522_.jpg,"['https://m.media-amazon.com/images/I/51qAukZMUDL._SS522_.jpg ', ' https://m.media-amazon.com/images/I/5165Qs2tqxL._SS522_.jpg ', ' https://m.media-amazon.com/images/I/411BjwSPtEL._SS522_.jpg ', ' https://m.media-amazon.com/images/I/51HkF-V4r8L._SS522_.jpg ', ' https://m.media-amazon.com/images/I/519FZWz1eSL._SS522_.jpg ', ' https://m.media-amazon.com/images/I/51CsOhmyf2L._SS522_.jpg']",,,Pouf,"22.83""D x 22.83""W x 13.98""H","February 27, 2023",China,Grey3,This is an empty shell that you have to stuff.,Modern,[],,"['Great Storage for Space-Saving: Comfortland Ottoman Pouf are shipped UNSTUFFED, this is an empty shell that you have to stuff. You can fill it with old towels, poly fill, bubble pack, cotton batting, fabric remnants, comforters, throw blankets, clothes, plush toys, extra cushion, old pillows, stuffed animals,sleeping bags etc., the unstuffed pouf can takes a lot to save your much more space. ', ' Material & Size: Made of high quality faux suede, this strong and durable material perfectly holds the shape, it\'s easy to clean withstands everyday use. When stuffing finished, the poof ottomans dimension is approximately 23""dia. and 14""high. It depends on filling material, it can takes a lot, the poufs are designed to hold 220lbs. ', ' Multi-Functional: The well made round pouf ottoman gives you a comfortable footstool without getting in the way. Great way to make your couch or chair even more comfortable with added foot stool or footrest for support. It also can be used as a extra seat, ottoman, floor sitting, bean bag chair, floor cushion, side table, storage solution or as décor. ', "" Easy to fill and Invisible Zipper: This pouf has a U zipper to give you a larger opening for easier stuffing. And the thicken zipper teeth is durable and easy for open and close, also it's hidden, so you can don't worry about any scratches on your floor. "", "" Comfort and Accent: This pouf adds style and personality to your space. It can be placed in a bedroom, living room, or other space throughout the home or office. It's easy to move, sturdy & comfortable for sitting in outdoor or indoor. Comfortland pouf is a stylish piece of furniture that accents your space with beauty and functionality. This ottoman has warm, several colors that will soften any space.""]",,"['Product Dimensions: 22.83""D x 22.83""W x 13.98""H', 'Color: Grey3', 'Brand: C COMFORTLAND', 'Fabric Type: Faux Leather, Leath-aire, Pu, Suede, Leatherette', 'Frame Material: This is an empty shell that you have to stuff.', 'Seat Height: 14 Inches', 'Product Care Instructions: Spot clean only', 'Maximum Weight Recommendation: 220 Pounds', 'Assembly Required: Yes', 'Size: Medium (23""Diax14""H)', 'Style: Modern', 'Storage Volume: 0.06 Cubic Meters', 'Item Weight: 1.17 pounds', 'ASIN: B0BWY5RPD1', 'Country of Origin: China', 'Item model number: Pouf', 'Customer Reviews: 4.4  4.4 out of 5 stars    \n    261 ratings   \n\n\n 4.4 out of 5 stars', 'Best Sellers Rank: #465,482 in Home & Kitchen (See Top 100 in Home & Kitchen)  #101 in Poufs', 'Date First Available: February 27, 2023']",55eabd2a-352d-5354-a153-f15dcc657226,2024-02-02 18:56:00
B0CBDLJ32L,https://www.amazon.com/dp/B0CBDLJ32L,"ZZQXTC Over Toilet Storage Cabinet, Bathroom Storage Cabinet with Doors and Shelves, Wood Metal Bathroom Space Saver Above Toilet, White",ZZQXTC,$129.99,In Stock,"['Home & Kitchen', 'Furniture', 'Bathroom Furniture', 'Over-the-Toilet Storage']",https://m.media-amazon.com/images/I/31cXPz4r76L._SS522_.jpg,"['https://m.media-amazon.com/images/I/31cXPz4r76L._SS522_.jpg ', ' https://m.media-amazon.com/images/I/41PNhhUcr2L._SS522_.jpg ', ' https://m.media-amazon.com/images/I/512+WooGWTL._SS522_.jpg ', ' https://m.media-amazon.com/images/I/512hkZAcBxL._SS522_.jpg ', ' https://m.media-amazon.com/images/I/41vBTz-VwfL._SS522_.jpg ', ' https://m.media-amazon.com/images/I/41C+RfoG18L._SS522_.jpg ', ' https://m.media-amazon.com/images/I/717I+l-hFAL.SS125_SS522_.jpg']",,ZZQXTC,OTCMD002-WH,"11.8""D x 24.8""W x 65.5""H","September 10, 2023",China,Over the Toilet Storage Cabinet White,Wood,wood,[],,"['𝐕𝐞𝐫𝐬𝐚𝐭𝐢𝐥𝐞 𝐃𝐞𝐬𝐢𝐠𝐧: This storage cabinets with doors and shelves, offering the flexibility to create open or concealed storage space. The mesh doors can be assembled up or down according to your usage habits. The adjustable shelf can be customized to accommodate items of different heights, while the top shelf provides a perfect spot for displaying plants. This allows you to efficiently organize and declutter your bathroom, kitchen, laundry room, or any other space. ', ' 𝐒𝐩𝐚𝐜𝐞-𝐒𝐚𝐯𝐢𝐧𝐠 𝐒𝐨𝐥𝐮𝐭𝐢𝐨𝐧: Maximize storage space while minimizing clutter! The bathroom storage cabinet utilizes the vertical space above your toilet, providing ample storage for toilet paper, towels, toiletries, and decorative accessories. The compact design not only keeps your bathroom neat and tidy but also optimizes limited floor space. ', ' 𝐒𝐭𝐮𝐫𝐝𝐲 𝐚𝐧𝐝 𝐃𝐮𝐫𝐚𝐛𝐥𝐞: This over toilet storage cabinet made of MDF, metal ladder-shaped legs, ensures stability and durability . Solid metal ""X"" crossbar provide extra support, preventing it from tipping forward. Additionally, two anti-tipping devices can be easily attached to the wall for enhanced stability and safety. Adjustable feet are also included to level the shelf on uneven floors and protect your flooring from scratches. ', "" 𝐌𝐮𝐥𝐭𝐢-𝐟𝐮𝐧𝐜𝐭𝐢𝐨𝐧𝐚𝐥 & 𝐖𝐢𝐝𝐞 𝐀𝐩𝐩𝐥𝐢𝐜𝐚𝐭𝐢𝐨𝐧: With a spacious open bottom space(23.62'' W, 35'' H), our above toilet storage cabinet fits most standard toilets and can be placed in bathroom, laundry rooms, kitchens, entryways, balconies, porches, dorms, and hotels. It can be utilized not only as a behind the toilet storage organizer but also as laundry room cabinets, kitchen rack, minifridge stand with storage, or any other storage solution you need. "", ' 𝐄𝐚𝐬𝐲 𝐀𝐬𝐬𝐞𝐦𝐛𝐥𝐲 & 𝐌𝐚𝐢𝐧𝐭𝐞𝐧𝐚𝐧𝐜𝐞: All parts and hardware of this tall bathroom storage cabinet are labeled for easy identification, and detailed assembly instructions are provided to ensure quick and hassle-free installation. The surface finish of this storage cabinet with doors is easy to clean, requiring only a damp cloth to wipe and maintain its dryness, ensuring the service life of the bathroom storage cabinet freestanding.']",,"['Brand: ZZQXTC', 'Color: Over the Toilet Storage Cabinet White', 'Product Dimensions: 11.8""D x 24.8""W x 65.5""H', 'Special Feature: Waterproof, Durable', 'Mounting Type: Floor Mount', 'Room Type: Bathroom, Laundry, Kitchen', 'Door Style: wood', 'Included Components: Hardware, Assembly Instruction, over the toilet storage cabinet', 'Number of Shelves: 3', 'Item Weight: 27 Pounds', 'Base Type: Legs', 'Installation Type: Freestanding', 'Back Material Type: Wood', 'Assembly Required: Yes', 'Item Weight: 27 pounds', 'Manufacturer: ZZQXTC', 'ASIN: B0CBDLJ32L', 'Country of Origin: China', 'Item model number: OTCMD002-WH', 'Customer Reviews: 3.0  3.0 out of 5 stars    \n    2 ratings   \n\n\n 3.0 out of 5 stars', 'Best Sellers Rank: #1,305,201 in Home & Kitchen (See Top 100 in Home & Kitchen)  #517 in Over-the-Toilet Storage', 'Date First Available: September 10, 2023']",8f3f62a9-3e8c-537b-b7b0-a12da9f859eb,2024-02-02 18:56:00
B0CG9CDKQ7,https://www.amazon.com/dp/B0CG9CDKQ7,"40ft Upholstery Elastic Webbing,Two Inch (2"") Wide Stretch Latex Band for Furniture Sofa, Couch, Chair Repair Modification (5cm Green)",Generic,$10.99,In Stock,"['Home & Kitchen', 'Furniture', 'Replacement Parts', 'Sofa Parts']",https://m.media-amazon.com/images/I/51oKu+lxwzL._SS522_.jpg,"['https://m.media-amazon.com/images/I/51oKu+lxwzL._SS522_.jpg ', ' https://m.media-amazon.com/images/I/51VtLWMxD7L._SS522_.jpg ', ' https://m.media-amazon.com/images/I/41Bj2r8ARkL._SS522_.jpg']",,,,8.07 x 5.71 x 2.56 inches,"August 22, 2023",,,,,[],[],"['【Material】: Polyester And Latex Thread ', ' 【Dimensions】: Length12 m/40ft ,Wide Two Inch (2"")/5cm,Green/Black ', ' 【Applied in indoors】:40ft allowing you to cover more chairs with less work. It can cover several chairs or 1 sofa ', ' 【Function】Quality elastic band, elastic webbing for stapling on wooden structures, suitable for seats with high rubber content, such as chairs, armchairs, sofas, armchairs etc. Coefficient of elasticity of 20% for stapling on wooden structures ', "" 【Service Guarantee】If you're not 100% satisfied of the product, please let us know, full refund or a free replacement, Don't hesitate to contact us if you have any question.""]","1 Roll 2"" Width 40' Length Upholstery Elastic Webbing A high quality alternative to rubber webbing with round bonded edges and excellent stretch resistance. 70mm Width Multi-purpose webbing / strapping. can be stapled or nailed without splitting The webbing is strong but supportive and suitable for various types of furniture, especially those that require a flat-surface such as dining chairs & much more.","['Item Weight: 15.2 ounces', 'Package Dimensions: 8.07 x 5.71 x 2.56 inches', 'ASIN: B0CG9CDKQ7', 'Best Sellers Rank: #313,429 in Home & Kitchen (See Top 100 in Home & Kitchen)  #143 in Sofa Replacement Parts', 'Date First Available: August 22, 2023']",e4fda4d9-23b6-59e9-86f8-fe7960dab725,2024-02-02 18:56:01
