asin,url,title,brand,price,availability,categories,primary_image,images,upc,manufacturer,item_model_number,package_dimensions,date_first_available,country_of_origin,color,material,style,important_information,product_overview,about_item,description,specifications,uniq_id,scraped_at
B08WF83LMF,https://www.amazon.com/dp/B08WF83LMF,"Imports Décor PVC Backed Coir Doormat, Eighth Note Welcome, 18""x30""",Imports Décor,,,"['Patio, Lawn & Garden', 'Outdoor Décor', 'Doormats']",https://m.media-amazon.com/images/I/51H9lDOICrL._SS522_.jpg,"['https://m.media-amazon.com/images/I/51H9lDOICrL._SS522_.jpg ', ' https://m.media-amazon.com/images/I/414DYCo9-1L._SS522_.jpg ', ' https://m.media-amazon.com/images/I/41DrSKZcz+L._SS522_.jpg ', ' https://m.media-amazon.com/images/I/31EPxi+cQgL._SS522_.jpg']",,Imports Décor,576PVC,"30""L x 18""W",,,Black and Beige,Vinyl,Art Deco,[],"[{'Brand': ' Imports Décor '}, {'Material': ' Coir '}, {'Pile Height': ' Low Pile '}, {'Construction Type': ' Handmade '}, {'Back Material Type': ' Vinyl '}]","['Lovely doormat shows off your love of music with eighth note design ', ' 100-percent coir fiber ', ' Vinyl backing prevents skidding ', ' Ideal for moderate to heavy-use traffic areas ', ' Measures 18-inch by 30-inch']","Welcome guests on a musical note with this Eighth Note Welcome doormat by Import's Decor. Our coir doormats are constructed from the best quality coir and printed with water-based colors. Coir is the natural fiber extracted from the husk of Coconuts. Coir fiber is relatively waterproof, has superior scrubbing power and is resistant to the elements. The vinyl backing provides reinforcement and prevents the doormat from skidding. With a coir doormat from Imports Decor, you can feel confident dirt and debris will be left at the front door and not in your home.","['Brand: Imports Décor', 'Material: Coir', 'Pile Height: Low Pile', 'Construction Type: Handmade', 'Back Material Type: Vinyl', 'Color: Black and Beige', 'Indoor/Outdoor Usage: Outdoor', 'Theme: Music', 'Is Stain Resistant: No', 'Pattern: Letter Print', 'Shape: Rectangular', 'Special Feature: Non Slip', 'Product Dimensions: 30""L x 18""W', 'Rug Form Type: Doormat', 'Style: Art Deco', 'Number of Pieces: 1', 'Item Thickness: 0.5 Inches', 'Item Weight: 4.62 pounds', 'Manufacturer: Imports Décor', 'ASIN: B08WF83LMF', 'Item model number: 576PVC', 'Best Sellers Rank: #154,571 in Patio, Lawn & Garden (See Top 100 in Patio, Lawn & Garden)  #1,947 in Outdoor Doormats']",d7ff0631-4ccc-5b95-b1d7-c41b37cbe727,2024-02-02 18:54:08
B09DGFRM4B,https://www.amazon.com/dp/B09DGFRM4B,"Croydex Chester Square Flexi-Fix Wall Mounted Bathroom Tilt Mirror, 14.96in x 14.96in x 3.4in, Chrome",Croydex Store,$90.00,Only 1 left in stock - order soon.,"['Home & Kitchen', 'Bath', 'Bathroom Accessories', 'Bathroom Mirrors']",https://m.media-amazon.com/images/I/41sDO1HW2cL._SS522_.jpg,"['https://m.media-amazon.com/images/I/41sDO1HW2cL._SS522_.jpg ', ' https://m.media-amazon.com/images/I/21WPGP7WJJL._SS522_.jpg ', ' https://m.media-amazon.com/images/I/214S95u4GnL._SS522_.jpg ', ' https://m.media-amazon.com/images/I/21Ato6NUmrL._SS522_.jpg ', ' https://m.media-amazon.com/images/I/21juphUZ2TL._SS522_.jpg ', ' https://m.media-amazon.com/images/I/21F+EJ5CISL._SS522_.jpg ', ' https://m.media-amazon.com/images/I/41qi5xx3Z5L._SS522_.jpg']",,Croydex,QM441041AZ,3.54 x 14.96 x 14.96 inches,,,Silver,,,[],,"['Zinc Alloy, Glass ', ' EASY TO FIT – unique bracket allows you to reuse old drill holes ', ' DURABLE zinc alloy construction ', ' HIGH QUALITY chrome plated finish ', ' All hardware included.']","Our Chester tilt mirror complements geometric bathroom designs, adding a bold, contemporary feel to your bathroom décor. Adding a mirror creates an essential focal point to your overall bathroom design. Maximizing available light, mirrors make spaces brighter and more inviting, even making smaller rooms feel more spacious. With two easy ways to fit, refreshing your bathroom is a breeze with Flexi Fix accessories! The award-winning, innovative ‘no drills’ solution, Flexi Fix can reuse most screw fittings from your old accessories. Or you can drill new holes if you prefer. How you fit Flexi Fix is completely up to you! By simply updating your bathroom accessories and linen colors, you can completely reimagine your bathroom on a budget. With a full range of complementary easy to fit accessories available, why not start that bathroom makeover now?!","['Auto Part Position: Left, Right', 'Item Dimensions LxWxH: 3.54 x 14.96 x 14.96 inches', 'Brand: Croydex', 'Color: Silver', 'Mounting Type: Wall Mount', 'Included Components: Accessory, fittings, instruction leaflet', 'Special Feature: Unique X Plate for easy fitting, Chrome plated', 'Item Weight: 4.78 Pounds', 'Operation Mode: Manual', 'Shape: Square', 'Lens Curvature Description: Convex', 'Product Dimensions: 3.54 x 14.96 x 14.96 inches', 'Item Weight: 4.78 pounds', 'Manufacturer: Croydex', 'ASIN: B09DGFRM4B', 'Item model number: QM441041AZ', 'Best Sellers Rank: #5,167,512 in Home & Kitchen (See Top 100 in Home & Kitchen)  #7,842 in Bathroom Mirrors', 'Fabric Type: Zinc Alloy, Glass', 'Care instructions: Wipe clean with damp cloth, do not use harsh chemicals', 'Assembly required: No', 'Number of pieces: 1', 'Batteries required: No']",9e04c6fa-668b-5bcf-8201-9d947210889f,2024-02-02 18:54:09
B09FR4XSCT,https://www.amazon.com/dp/B09FR4XSCT,itbe Easy Fit Ready-to-Assemble Multipurpose One Door Wall Steel Cabinet Space Organizer (Blue),itbe Store,,,"['Home & Kitchen', 'Furniture', 'Accent Furniture', 'Storage Cabinets']",https://m.media-amazon.com/images/I/21NWASZgUVL._SS522_.jpg,"['https://m.media-amazon.com/images/I/21NWASZgUVL._SS522_.jpg ', ' https://m.media-amazon.com/images/I/31GQkrBv6fL._SS522_.jpg ', ' https://m.media-amazon.com/images/I/21WZKaJN5gL._SS522_.jpg ', ' https://m.media-amazon.com/images/I/21RmDe3Y+GL._SS522_.jpg ', ' https://m.media-amazon.com/images/I/31YR01bzAoL._SS522_.jpg ', ' https://m.media-amazon.com/images/I/310qo+NZn8L._SS522_.jpg ', ' https://m.media-amazon.com/images/G/01/HIT/ImageBlockDimension/dimensions_SS522_.png']",,itbe,3500001734,"11.22""D x 13.77""W x 25.19""H","August 11, 2021",,Blue,Alloy Steel,Flat Panel,[],,"['11.22"" L × 13.77"" W × 25.19"" H ', ' Maximum distributed weight supported per shelf: 22 lb. ', ' Organize your belongings with quality and space, with the One-Door Floating Space Organizer Steel Cabinet in black and gray; black and orange; blue or in white. ', ' Made of steel for durable day-to-day use. ', ' Removable shelf for you to adjust and make the most of your space, the way that works for you.']",,"['Brand: itbe', 'Color: Blue', 'Recommended Uses For Product: Tools', 'Product Dimensions: 11.22""D x 13.77""W x 25.19""H', 'Special Feature: Durable,Removable', 'Mounting Type: Wall Mount', 'Room Type: Home Office', 'Door Style: Flat Panel', 'Weight Limit: 22 Pounds', 'Included Components: Shelves', 'Finish Type: Powder Coated', 'Size: 11.22"" L × 13.77"" W × 25.19"" H', 'Number of Shelves: 1', 'Base Type: Pedestal', 'Back Material Type: Alloy Steel', 'Assembly Required: Yes', 'Item Weight: 13.67 pounds', 'Manufacturer: itbe', 'ASIN: B09FR4XSCT', 'Item model number: 3500001734', 'Customer Reviews: 4.0  4.0 out of 5 stars    \n    38 ratings   \n\n\n 4.0 out of 5 stars', 'Best Sellers Rank: #753,913 in Home & Kitchen (See Top 100 in Home & Kitchen)  #1,454 in Storage Cabinets', 'Date First Available: August 11, 2021']",9b0e0b55-3984-5624-9bb6-3552bb4d262f,2024-02-02 18:54:09
B09LVSZRZS,https://www.amazon.com/dp/B09LVSZRZS,Delta ARV18-DN Arvo 18-in Wall Mount Towel Bar with 6-in Extender Bath Hardware Accessory in Brushed Nickel,Delta,,In Stock,"['Tools & Home Improvement', 'Hardware', 'Bathroom Hardware', 'Towel Bars']",https://m.media-amazon.com/images/I/11zzs81fXBL._SS522_.jpg,"['https://m.media-amazon.com/images/I/11zzs81fXBL._SS522_.jpg ', ' https://m.media-amazon.com/images/I/415W0NWrn4L._SS522_.jpg ', ' https://m.media-amazon.com/images/I/31o498cFHFL._SS522_.jpg ', ' https://m.media-amazon.com/images/I/21WTgM5RgyL._SS522_.jpg ', ' https://m.media-amazon.com/images/I/41udpUao-HL._SS522_.jpg ', ' https://m.media-amazon.com/images/I/41HzmDsO08L._SS522_.jpg ', ' https://m.media-amazon.com/images/I/51uVUbnEooL.SS125_SS522_.jpg']",,Liberty Hardware,ARV18-DN,"22.72""L x 3.31""W x 1.89""H","November 29, 2021",China,Spotshield Brushed Nickel,Multiple Base Materials,"18"" Towel Bar with 6"" Extender",[],"[{'Color': ' Spotshield Brushed Nickel '}, {'Material': ' Multiple Base Materials '}, {'Product Dimensions': ' 22.72""L x 3.31""W x 1.89""H '}, {'Finish Type': ' Brushed '}, {'Brand': ' Delta '}, {'Installation Type': ' Screw-In '}, {'Shape': ' Straight '}]","['BATH HARDWARE: SpotShield brushed nickel 18-in towel bar with 6-in extension for the bathroom ', ' FINISH: SpotShield brushed nickel is a spot-resistant, warm, muted silver finish with earthy undertones ', ' KEEP IT CLEAN: SpotShield technology keeps hardware cleaner for longer by resisting water spots, fingerprints, and stains ', ' DURABLE: Crafted from multiple metals for strength and reliability ', ' DIMENSIONS: Towel bar without the extender measures 1.89-in H x 22.72-in L and 3.31-in D including the extender ', ' EASY INSTALL: All mounting hardware, template, and instructions provided ', ' COORDINATE: Complete your look with the coordinating Arvo Bath Collection of accessories (sold separately) ', ' WARRANTY: Enjoy the look you love for life with Delta’s Limited Lifetime Warranty']","The fluid lines of the Delta Arvo Bath Collection bring a delicate, serene look to the bath, while providing wall-mounted storage. This design pairs effortlessly with contemporary and modern home design. This 18-in wall mount towel bar features a 6-in extender piece allowing you to extend the bar from 18 to 24-in to accommodate a large towel or several hand towels. Complete your space with coordinating pieces from the full collection (sold separately).","['Color: Spotshield Brushed Nickel', 'Material: Multiple Base Materials', 'Product Dimensions: 22.72""L x 3.31""W x 1.89""H', 'Finish Type: Brushed', 'Brand: Delta', 'Installation Type: Screw-In', 'Shape: Straight', 'Manufacturer: Liberty Hardware', 'Part Number: ARV18-DN', 'Item Weight: 11.8 ounces', 'Country of Origin: China', 'Item model number: ARV18-DN', 'Style: 18"" Towel Bar with 6"" Extender', 'Finish: Brushed', 'Item Package Quantity: 1', 'Included Components: 18 inch Towel Bar, Posts, Installation Instructions, Installation Hardware', 'Batteries Required?: No', 'Warranty Description: Limited Lifetime Warranty', 'ASIN: B09LVSZRZS', 'Customer Reviews: 4.3  4.3 out of 5 stars    \n    129 ratings   \n\n\n 4.3 out of 5 stars', 'Best Sellers Rank: #19,130 in Tools & Home Improvement (See Top 100 in Tools & Home Improvement)  #348 in Bath Towel Bars', 'Date First Available: November 29, 2021']",e1b2c330-c5aa-5a67-9320-39fdee20e34d,2024-02-02 18:54:10
B08VWTB8CH,https://www.amazon.com/dp/B08VWTB8CH,"Bamboo Waste Basket | Waste Basket for Bathroom | Waste Basket for Office | Bathroom Trash Can | Bedroom Trash Can | Trash Can Small Wastebasket Bamboo Decor (1, 12"" x 6.5"" x 15.3"")",Cabot & Carlyle Store,$39.97,In Stock,"['Home & Kitchen', 'Storage & Organization', 'Trash, Recycling & Compost', 'Wastebaskets']",https://m.media-amazon.com/images/I/318RY00VlIL._SS522_.jpg,"['https://m.media-amazon.com/images/I/318RY00VlIL._SS522_.jpg ', ' https://m.media-amazon.com/images/I/41vdgy5SDaL._SS522_.jpg ', ' https://m.media-amazon.com/images/I/41h09tG2dKL._SS522_.jpg']",,,,,,,,,,[],"[{'Brand': ' Cabot & Carlyle '}, {'Capacity': ' 6.45 Gallons '}, {'Color': ' Bamboo '}, {'Opening Mechanism': ' Open-Top '}, {'Material': ' Bamboo '}, {'Recommended Uses For Product': ' Bathroom,Kitchen,Office '}, {'Room Type': ' Bathroom,Bedroom,Kitchen,Laundry Room,Living Room,Office,Room '}, {'Special Feature': ' Waterproof '}, {'Shape': ' Rectangular '}, {'Item Weight': ' 2.16 Kilograms '}]","['Bamboo waste basket fits perfectly into many spaces around the house: bathroom, kitchen, bedroom, laundry room, office and convenient modern waste disposal, SIZE: 15"" x 6.5"" x 15.3"" ', ' Office trash, recycling basket, storage basket for accessories set cleaning supplies excellent quality ', ' We use real bamboo, strong and waterproof, great for daily use and its easy to clean ', ' Makes for a great gift this modern bin can be used in the bathroom, dinning room, living room and bedroom, bringing an elegant atmosphere effect to any room ', ' Manufactured upholding the excellent quality control, materials and standards.']",,[],95c4f44f-0f83-5c3b-8a4a-c41fa91f5150,2024-02-02 18:54:10
B075M1PKSW,https://www.amazon.com/dp/B075M1PKSW,Way Basics Vinyl Record Storage - 2 Tier Book Shelf Turntable Stand (Fits 170 Albums),Way Basics Store,$68.99,Only 2 left in stock (more on the way).,"['Home & Kitchen', 'Furniture', ""Kids' Furniture"", 'Bookcases, Cabinets & Shelves']",https://m.media-amazon.com/images/I/41YMttt7a5L._SS522_.jpg,"['https://m.media-amazon.com/images/I/41YMttt7a5L._SS522_.jpg ', ' https://m.media-amazon.com/images/I/51yzeLq7dPS._SS522_.jpg ', ' https://m.media-amazon.com/images/I/31jJ0Zmz2qL._SS522_.jpg ', ' https://m.media-amazon.com/images/I/51N2ybo4P5L._SS522_.jpg ', ' https://m.media-amazon.com/images/I/51giPvYTs+L._SS522_.jpg ', ' https://m.media-amazon.com/images/I/61iF5dOPu0L.SS125_SS522_.png ', ' https://m.media-amazon.com/images/I/51j5DYE3CCL.SS125_SS522_.jpg']",,No,Vinyl Record Storage -,"14.2""D x 18""W x 29.1""H","September 13, 2017",Taiwan,White,Recycled Material,Modern,[],"[{'Material': ' Recycled Material '}, {'Color': ' White '}, {'Special Feature': ' Space Saving '}, {'Product Dimensions': ' 14.2""D x 18""W x 29.1""H '}, {'Shelf Type': ' vinyl record storage cube '}]","[""IT'S NOT WOOD; IT'S BETTER - Made with eco-friendly and sustainable zBoard, non-toxic and free of formaldehyde & VOC. "", ' TOOL FREE ASSEMBLY - Easy to assemble, no tools required, just peel the 3M adhesive strips and put together with easy-align pins ', ' STRONG and DURABLE - Maximum load 30 lbs (recommended); Made to stand upright, do not place on side or back ', ' DIMENSIONS - Exterior D : 14.2"" W : 18.0"" H : 29.1"" Interior D : 13.6"" W : 16.4"" H : 13.4""']","Way Basics has come up with a modern way to organize a not so modern item! The 2 Shelf Cube is made to fit vinyl records. With tons of space, you can now organize your record collection and do so in a fashionable, simply and modern way. This 2 Shelf Cube in white is made out of zBoard, a sustainable and strong patented material that is eco-friendly and safe for your home. Way Basics uses a 3M industrial adhesive instead of hardware. which means no tools are required. No handy man needed, assembly is easy! Oh and disco ball not included.","['Material: Recycled Material', 'Color: White', 'Special Feature: Space Saving', 'Product Dimensions: 14.2""D x 18""W x 29.1""H', 'Shelf Type: vinyl record storage cube', 'Number of Shelves: 2', 'Room Type: Living Room', 'Finish Type: Veneer', 'Assembly Required: Yes', 'Mounting Type: Floor Mount', 'Recommended Uses For Product: Storage', 'Included Components: Alignment pins, adhesive tapes, zBoard', 'Item Weight: 11.9 Pounds', 'Brand: Way Basics', 'Style: Modern', 'Shelf Weight Capacity: 30 Pounds', 'Item Weight: 11.9 pounds', 'Country of Origin: Taiwan', 'Item model number: Vinyl Record Storage -', 'Is Discontinued By Manufacturer: No', 'Weight: 11.9 Pounds', 'ASIN: B075M1PKSW', 'Customer Reviews: 4.1  4.1 out of 5 stars    \n    2,254 ratings   \n\n\n 4.1 out of 5 stars', ""Best Sellers Rank: #83,261 in Home & Kitchen (See Top 100 in Home & Kitchen)  #40 in Kids' Bookcases, Cabinets & Shelves  #711 in Accent Furniture"", 'Date First Available: September 13, 2017']",e092329c-8feb-545c-be6e-1c3f06da4dc3,2024-02-02 18:54:11
B0BWRVGQRM,https://www.amazon.com/dp/B0BWRVGQRM,"TocTen Double Bath Towel Bar - Thicken SUS304 Stainless Steel Towel Rack for Bathroom, Bathroom Accessories Double Towel Rod Heavy Duty Wall Mounted Square Towel Holder (Matte Black,24 INCH)",TocTen Store,$27.99,In Stock,"['Tools & Home Improvement', 'Hardware', 'Bathroom Hardware', 'Towel Bars']",https://m.media-amazon.com/images/I/41cFJKXyA5L._SS522_.jpg,"['https://m.media-amazon.com/images/I/41cFJKXyA5L._SS522_.jpg ', ' https://m.media-amazon.com/images/I/31-sIFbf01L._SS522_.jpg ', ' https://m.media-amazon.com/images/I/41rkPgjGdoL._SS522_.jpg ', ' https://m.media-amazon.com/images/I/41CB1B057aL._SS522_.jpg ', ' https://m.media-amazon.com/images/I/41K4nD2UUwL._SS522_.jpg ', ' https://m.media-amazon.com/images/I/41Ckf5wT45L._SS522_.jpg ', ' https://m.media-amazon.com/images/I/61ag3XTXwDL.SS125_SS522_.jpg']",,TocTen,,"23.63""L x 3.55""W x 5.4""H","February 24, 2023",,Matte Black,Stainless Steel,,[],"[{'Color': ' Matte Black '}, {'Material': ' Stainless Steel '}, {'Product Dimensions': ' 23.63""L x 3.55""W x 5.4""H '}, {'Finish Type': ' Matte Black '}, {'Brand': ' TocTen '}, {'Installation Type': ' Wall-Mounted '}, {'Shape': ' Square '}]","['【SAVING SPACE & FASHION DESIGN】: You can get bath towel rail with double rods, which are very flexible to use. There are double rods to maximize the use of your wall and storage twice as much stuff. Fashion design suitable for installation in bathrooms, kitchens, entrances, wardrobes, back doors, etc. ', ' 【HIGH and LOW ROD DESIGN】: The double towel hanger total length is 24 inches. Long enough for you to hang 2 bath towel or even 4 hand towels at the same time. Staggered rod design, the distance between the two rods is wider, not only dries the towel quickly, but also allows you to hang and remove them easily. ', ' 【DURABLE & THICKEN MATERIAL】 -- Very heavy duty bathroom towel holder are connected by sturdy square base. Concealed screw wall mounted towel hanger design makes the product look more beautiful and modern, adds 4 protection layers on stainless steel thicken material surface. Never get rust or paint off. We care about every details, the welding part of the product is polished by multiple processes. ', ' 【VERSATILE & EASY TO INSTALL】 -- Only one double towel rod can make your bathroom and kitchen look more elegant and tidy. We provide all the screw accessories needed for installation in the package. There is no need to worry about installation, we will give you an installation instruction manual, otherwise you can email us for an installation video. ', ' 【CLICK ADD TO CART NOW】 -- We believe that the main reason to retain customers is always quality, not just price. So we attach great importance to the quality of each product, please rest assured. 100% customer satisfaction is our aim. Products are inspected strictly many times to ensure that there are no quality problems before they are on store.']",,"['Color: Matte Black', 'Material: Stainless Steel', 'Product Dimensions: 23.63""L x 3.55""W x 5.4""H', 'Finish Type: Matte Black', 'Brand: TocTen', 'Installation Type: Wall-Mounted', 'Shape: Square', 'Item Weight: 1.7 pounds', 'Manufacturer: TocTen', 'ASIN: B0BWRVGQRM', 'Customer Reviews: 4.4  4.4 out of 5 stars    \n    82 ratings   \n\n\n 4.4 out of 5 stars', 'Best Sellers Rank: #41,591 in Tools & Home Improvement (See Top 100 in Tools & Home Improvement)  #183 in Bath Towel Bars', 'Date First Available: February 24, 2023']",0a8d1a88-cead-55fe-a935-eca4807430db,2024-02-02 18:54:12
B0CB7SG59J,https://www.amazon.com/dp/B0CB7SG59J,"MoNiBloom Adjustable Bar Stools Set of 2, 360° Swivel Counter Height Barstool Kitchen Counter Island Dining Chair, Dark Grey PU Leather Bistro Swivel Stool for Living Room Kitchen, 250 lbs Capacity",MoNiBloom Store,$55.00,Only 1 left in stock (more on the way).,"['Home & Kitchen', 'Furniture', 'Game & Recreation Room Furniture', 'Home Bar Furniture', 'Barstools']",https://m.media-amazon.com/images/I/41jD28iN4bL._SS522_.jpg,"['https://m.media-amazon.com/images/I/41jD28iN4bL._SS522_.jpg ', ' https://m.media-amazon.com/images/I/51hip63NhYL._SS522_.jpg ', ' https://m.media-amazon.com/images/I/41t3Y06qcvL._SS522_.jpg ', ' https://m.media-amazon.com/images/I/41lXQBqZhqL._SS522_.jpg ', ' https://m.media-amazon.com/images/I/41bDZO0Qz2L._SS522_.jpg ', ' https://m.media-amazon.com/images/I/31Q3UImdzqL._SS522_.jpg ', ' https://m.media-amazon.com/images/I/91l+VAPadIL.SS125_SS522_.png']",,MoNiBloom,A02-ST-012-2P-DG-CH,"15""D x 18""W x 39""H",,China,Dark Grey,,Straight,[],,"['360-Degree Swivel Seat - The innovative swivel design and integrated footrest ensure effortless movement and unparalleled comfort while seated, allowing you to easily rotate in any direction with grace. ', ' Durable Gas-Lift Mechanism - Seamlessly adjust the height of this versatile barstool from counter to bar height, effortlessly accommodating various dining tables, bar tables, or kitchen islands, for a customized and convenient seating experience. ', ' Durable Leather Upholstery - Crafted from high-quality leather, known for its longevity, this barstool exhibits a natural patina that only gets more alluring with time, adding a touch of elegance and sophistication to any space. ', ' Unmatched Comfort and Support - Engineered with medium-firm upholstery foam, this barstool offers the perfect balance of comfort and support. Designed to cradle your body gently, it evenly distributes your weight and relieves pressure, ensuring a pleasurable seating experience. ', "" Quick and Effortless Assembly - The package includes all the necessary installation tools, making the assembly process a breeze. With clear instructions, you'll have each barstool assembled in a mere 5 minutes, saving you time and effort.""]",,"['Product Dimensions: 15""D x 18""W x 39""H', 'Color: Dark Grey', 'Brand: MoNiBloom', 'Style: Modern', 'Furniture Finish: Painted', 'Seat Height: 22 Inches', 'Leg Style: Straight', 'Product Care Instructions: Wape with Damp Cloth', 'Number of Pieces: 2', 'Item Weight: 32.5 pounds', 'Manufacturer: MoNiBloom', 'ASIN: B0CB7SG59J', 'Country of Origin: China', 'Item model number: A02-ST-012-2P-DG-CH', 'Best Sellers Rank: #4,024,862 in Home & Kitchen (See Top 100 in Home & Kitchen)  #8,367 in Barstools']",db5c35ba-437d-5200-9a51-f803a8393aef,2024-02-02 18:54:12
