asin,url,title,brand,price,availability,categories,primary_image,images,upc,manufacturer,item_model_number,package_dimensions,date_first_available,country_of_origin,color,material,style,important_information,product_overview,about_item,description,specifications,uniq_id,scraped_at
B08QRF4TTL,https://www.amazon.com/dp/B08QRF4TTL,"AnRui Folding Floor Chair with Adjustable Back Support, Comfortable, Semi-Foldable, and Versatile, for Meditation, Seminars, Reading, TV Watching or Gaming, Suitable for Home Or Office",AnRui Store,$52.99,Only 11 left in stock - order soon.,"['Home & Kitchen', 'Furniture', 'Game & Recreation Room Furniture', 'Gaming Chairs', 'Video Game Chairs']",https://m.media-amazon.com/images/I/51iuIrMVq+L._SS522_.jpg,"['https://m.media-amazon.com/images/I/51iuIrMVq+L._SS522_.jpg ', ' https://m.media-amazon.com/images/I/41lozX79pqL._SS522_.jpg ', ' https://m.media-amazon.com/images/I/514-TGg5InL._SS522_.jpg ', ' https://m.media-amazon.com/images/I/51X4reGzKTL._SS522_.jpg ', ' https://m.media-amazon.com/images/I/514r3CpQHNL._SS522_.jpg ', ' https://m.media-amazon.com/images/I/61j6JVqbb5L.SS125_SS522_.jpg']",,AnRui,G1ZTJJ010535#PP,32.5 x 16 x 3 inches,"December 16, 2020",China,Stripe,Foam,Solid Back,[],,"['The backrest prevents slouching, promotes healthy posture. Quality foam conforms ideally to the body and offers maximum comfort for sitting and reclining. The backrest is very stable and can support body weight of up to 100 kg (220 lb). ', ' The padded Floor Chair chair is easy to transport because of its low weight around 5.0lbs, And if you just want to create some space, its small footprint makes it easy to store. Cleaning the cover is easy(Hand Wash Only), It is made out of quality linen and is easily wiped the dust clean with a damp sponge. ', ' Whether as a lounge, meditation chair, for reading, relaxing, TV-watching, seminars, or discussion groups in the office, our floor chair functions as a floor lounger and seat cushion and is not only eye-catching, but also fits perfectly into any room. ', ' Adjustable backrest: 90°to 180°, 5 Angles easy to find your cozy position, preventing backache and cervical pain. ', ' Padded Floor Chair perfect for small spaces, this lightweight, versatile chair can be easily moved around and placed on any clean and dry surface.']",,"['Brand: AnRui', 'Color: Stripe', 'Back Style: Solid Back', 'Special Feature: Adjustable', 'Product Care Instructions: Hand wash only', 'Unit Count: 1.0 Count', 'Recommended Uses For Product: Office, Reading, Gaming', 'Maximum Weight Recommendation: 220 Pounds', 'Pattern: Solid', 'Room Type: Office, Living Room', 'Surface Recommendation: Hard Floor', 'Form Factor: Foldable', 'Fill Material: Foam', 'Package Dimensions: 32.5 x 16 x 3 inches', 'Item Weight: 4.59 pounds', 'Manufacturer: AnRui', 'ASIN: B08QRF4TTL', 'Country of Origin: China', 'Item model number: G1ZTJJ010535#PP', 'Customer Reviews: 3.5  3.5 out of 5 stars    \n    12 ratings   \n\n\n 3.5 out of 5 stars', 'Best Sellers Rank: #1,508,104 in Home & Kitchen (See Top 100 in Home & Kitchen)  #624 in Video Game Chairs', 'Date First Available: December 16, 2020']",e037f8af-d28c-51a1-8f1c-3f524620910e,2024-02-02 18:54:58
B07WLK9TNS,https://www.amazon.com/dp/B07WLK9TNS,"sogesfurniture 5 Tier Free Standing Wooden Shoe Storage Shelf Shoe Organizer, 29.5 inches Shoe Rack Shoe Organizer Storage Cabinet for Entryway, Living Room, Hallway, Doorway, Black",sogesfurniture Store,,Only 1 left in stock (more on the way).,"['Home & Kitchen', 'Storage & Organization', 'Clothing & Closet Storage', 'Shoe Organizers', 'Shoe Cabinets']",https://m.media-amazon.com/images/I/51j2v3ij2uL._SS522_.jpg,"['https://m.media-amazon.com/images/I/51j2v3ij2uL._SS522_.jpg ', ' https://m.media-amazon.com/images/I/41XofJvuwHL._SS522_.jpg ', ' https://m.media-amazon.com/images/I/51-VSQAMmvL._SS522_.jpg ', ' https://m.media-amazon.com/images/I/51I7GskNgaL._SS522_.jpg ', ' https://m.media-amazon.com/images/I/51BqXKxjrML._SS522_.jpg ', ' https://m.media-amazon.com/images/I/51uianAYMbL._SS522_.jpg ', ' https://m.media-amazon.com/images/I/51g1ot2JmIL._SS522_.jpg']",,sogesfurniture,,"11.8""D x 29.5""W x 37""H",,,,Engineered Wood,Modern,[],,"['Elegant and Functional Design: Our 5-tier Wooden Shoes Rack Organizer combines style and practicality, making it the perfect addition to your entryway, living room, hallway, or doorway. The sleek wooden construction and thoughtfully designed storage compartments create a visually appealing piece that complements any decor while keeping your space tidy. ', ' Ample Storage Capacity: With five spacious tiers, this shoe storage shelf provides ample room for organizing your footwear collection. From sneakers to heels, this organizer can accommodate various shoe types and sizes, helping you keep your shoes neatly arranged and easily accessible. ', "" Integrated Storage Compartment: Beyond its tiered shelves, our organizer also features a convenient storage compartment that's ideal for storing shoe accessories, keys, or other essentials. This hidden compartment adds an extra layer of functionality, allowing you to keep clutter at bay and maintain a clutter-free environment. "", ' Sturdy and Durable Build: Crafted from thickened laminated wood material, this free-standing shoe rack offers excellent durability and stability. NOTE: Due to the uncertainty during shipping, the shoes rack are probable to be broken. If you receive cracked products or you are not 100% satisfied with our Free Standing Shoe Racks, please contact us immediately for a full refund or replacement risk-free ', ' Sturdy and Durable Build: Crafted from thickened laminated wood material, this free-standing shoe rack offers excellent durability and stability. NOTE: Due to the uncertainty during shipping, the shoes rack are probable to be broken. If you receive cracked products or you are not 100% satisfied with our Free Standing Shoe Racks, please contact us immediately for a full refund or replacement risk-free']",,"['Mounting Type: Floor Mount', 'Room Type: Living Room', 'Shelf Type: Engineered Wood', 'Number of Shelves: 5', 'Special Feature: Space Saver', 'Recommended Uses For Product: Living Room, Hallway', 'Installation Method: Freestanding', 'Material: Engineered Wood', 'Product Care Instructions: Wipe with Dry Cloth', 'Furniture Finish: Brown', 'Shape: Rectangular', 'Style: Modern', 'Assembly Required: Yes', 'Customer Reviews: 4.3  4.3 out of 5 stars    \n    253 ratings   \n\n\n 4.3 out of 5 stars', 'Best Sellers Rank: #1,703,509 in Home & Kitchen (See Top 100 in Home & Kitchen)  #86 in Shoe Cabinets', 'Age Range (Description): Adult', 'Brand: sogesfurniture', 'Number of Items: 1', 'Manufacturer: sogesfurniture', 'Included Components: Hardware', 'Model Name: L24', 'Model Number: BHUS-L24-BK-CA', 'Product Dimensions: 11.8""D x 29.5""W x 37""H', 'Size: 29.5 inches', 'Item Weight: 27 Pounds']",f28d5cba-ecd4-5d82-87da-d926d48e1155,2024-02-02 18:54:58
B0CNVJ24YF,https://www.amazon.com/dp/B0CNVJ24YF,"fengxiaomin-Plastic Bed Slat End Caps Holders Plastic End Caps Holders Plastic Black End Caps Holders Suitable for Single, Double, King and Queen beds (55mm*9mm Black) -12pcs",fengxiaomin,$8.59,Only 12 left in stock - order soon.,"['Home & Kitchen', 'Furniture', 'Replacement Parts', 'Bed Parts']",https://m.media-amazon.com/images/I/41gvi7RjrZL._SS522_.jpg,"['https://m.media-amazon.com/images/I/41gvi7RjrZL._SS522_.jpg ', ' https://m.media-amazon.com/images/I/41cj2KzvJsL._SS522_.jpg ', ' https://m.media-amazon.com/images/I/31PnQmLvmaL._SS522_.jpg ', ' https://m.media-amazon.com/images/I/31UU-rpx1IL._SS522_.jpg ', ' https://m.media-amazon.com/images/I/514FJtLTWyL._SS522_.jpg']",,,,7.87 x 5.51 x 1.06 inches,"November 23, 2023",,,,,[],[],"['The plastic bed plate end cap retainer is made of plastic to ensure durability, the quality of the hard head is very good, very firm, and the top is very hard, which can fix the plate well. ', ' Bed cover replacement bracket end cover is easy to install, just snap the end cover on the bed strip, no need to install other tools, place the bottom plate in the bracket, or point the plastic at the mounting hole, your bed base will be fixed. ', ' Plastic hat racks are perfect for replacing any broken or missing slatted covers, you can easily replace damaged or missing slatted supports and save money, and are black and wear resistant for all types of bed boards. ', ' Plastic end cover bracket These fixers are fixed on the side and middle support rail of the bed frame with two latches, and then fixed on the bed frame with pre-drilled holes, and the plastic end cover bracket can also be used as a connection piece of the rib bed. ', ' The black plastic end cover bracket is suitable for single, double, king and queen-size beds, which can be attached to the bed frame with wooden slats, suitable for a variety of wooden bed frames, and can be used in commercial or residential environments.']","Specifications:Product name: plastic bed plate end cap fixatorMaterial: PlasticSize: 55*9mm/2.2*0.4inchColor: BlackHigh quality slatted covers are ideal for replacing any broken or missing slatted covers, and you can easily replace damaged ormissing slatted supports and save money. The plastic bed end cap retainer is mounted on the side and middle support rail of the bed frame using two pins, which you can attach to the bed frame using pre-drilled holes to hold it firmly in place. The plastic bed end cap retainer is suitable for single, double, king and queen-size beds and can be fixed to the bed frame.Package includes: 12 plastic bed end cap retainersWarm reminder:Dimensions are measured manually and may be slightly inaccurate.There may be slight differences in color due to different screen displays.","['Item Weight: 2.4 ounces', 'Package Dimensions: 7.87 x 5.51 x 1.06 inches', 'ASIN: B0CNVJ24YF', 'Best Sellers Rank: #1,443,277 in Home & Kitchen (See Top 100 in Home & Kitchen)  #400 in Bed Replacement Parts', 'Date First Available: November 23, 2023']",4c0cfeab-9dc3-577e-a6b0-3d751e1cff13,2024-02-02 18:54:59
B0BZKMYST2,https://www.amazon.com/dp/B0BZKMYST2,"MoNiBloom Massage Gaming Recliner Chair with Speakers PU Leather Home Theater Seating Single Bedroom Video Game Sofa Recliners Ergonomic Gaming Couch with Detachable Neck Support and Footrest, Green",MoNiBloom Store,,In Stock,"['Home & Kitchen', 'Furniture', 'Game & Recreation Room Furniture', 'Gaming Chairs', 'Video Game Chairs']",https://m.media-amazon.com/images/I/41Md8gR4YYL._SS522_.jpg,"['https://m.media-amazon.com/images/I/41Md8gR4YYL._SS522_.jpg ', ' https://m.media-amazon.com/images/I/51MdfIC2c0L._SS522_.jpg ', ' https://m.media-amazon.com/images/I/41c8wDMOSGL._SS522_.jpg ', ' https://m.media-amazon.com/images/I/51upOrfMFRL._SS522_.jpg ', ' https://m.media-amazon.com/images/I/41iQSU9TxPL._SS522_.jpg ', ' https://m.media-amazon.com/images/I/A1OKOECohQL.SS125_SS522_.png ', ' https://m.media-amazon.com/images/I/512nHBgdHoL.SS125_SS522_.jpg']",,,A11-GC-LS-002-GN,"23""D x 32""W x 43""H","March 25, 2023",China,Green,,Modern,[],,"['Massage Function to Relax Your Body - Our massage gaming chair with 8 massage spots, 2 on shoulder, 2 on lumbar, 2 on thigh and 2 on calf, it can help to relax your body. In addition, this massage chair features 5 massage mode and 2 massage strength, as well as adjustable positions and time, to meet your different needs. It is an ideal seat of choice for working, studying and gaming. ', ' Audio Gaming Chair - The gaming chair built-in two Bluetooth speakers to provide extraordinary and rich stereo effects. Connect a mobile phone or other Bluetooth-enabled device to the speaker to enjoy the thrilling theater-like sound of a game or movie. ', ' Adjustable Backrest and Footrest - This gaming recliner chair is equipped with adjustable backrest and retractable footrest. Not only you can easily change the most suitable angle of backrest between 95-125 degrees, and open the footrest to relax your legs. ', ' Humanized Design - Removable headrest ensure a comfortable daylong gaming time. The side pouch allows you to store controller or handy stuffs, and the cup holder on both sides of armrest are more convenient for you to place drink without getting up. ', ' Wide Applications - Our reclining gaming chair is very comfortable for taking a nap during busy workdays or relaxing at weekends, or even having a rest in the course of the exciting playtime. Great for use in entertaining room, living room, family room and so on. ', ' High Quality and Comfortable Material - Covered with environmental friendly PU leather, the reclining gaming chair is not only skin-friendly and easy to clean, but also breathable and water-proof. Padded with high-density thicker sponge, it is highly resilient and more comfortable.']",,"['Brand: MoNiBloom', 'Color: Green', 'Product Dimensions: 23""D x 32""W x 43""H', 'Back Style: Solid Back', 'Special Feature: Adjustable Lumbar, Arm Rest, Ergonomic, Swivel, Cushion Availability', 'Product Care Instructions: Wipe with a damp cloth', 'Unit Count: 1.0 Count', 'Recommended Uses For Product: Relaxing, Gaming', 'Maximum Weight Recommendation: 300 Pounds', 'Style: Modern', 'Pattern: Solid', 'Room Type: Living Room, Bedroom, Study Room, Office Room', 'Age Range (Description): Adult', 'Included Components: video game chair', 'Shape: Rectangular', 'Model Name: MoNiBloom A11-GC-LS-002-GN', 'Surface Recommendation: Hard Floor', 'Furniture base movement: Rock', 'Indoor/Outdoor Usage: Indoor', 'Form Factor: Recliner', 'Furniture Finish: Leather', 'Seat Depth: 23 inches', 'Item Weight: 50.7 pounds', 'Country of Origin: China', 'Item model number: A11-GC-LS-002-GN', 'ASIN: B0BZKMYST2', 'Customer Reviews: 3.7  3.7 out of 5 stars    \n    11 ratings   \n\n\n 3.7 out of 5 stars', 'Best Sellers Rank: #1,629,493 in Home & Kitchen (See Top 100 in Home & Kitchen)  #688 in Video Game Chairs', 'Date First Available: March 25, 2023']",50b8782e-b051-551d-aa0d-494b46dd0676,2024-02-02 18:54:59
B0BP9QYFTL,https://www.amazon.com/dp/B0BP9QYFTL,"SUNSLASH Wall Mounted Mirror, Arched Wall Mirror for Bathroom, 36""x24"" Arch Bathroom Mirror with Metal Frame, Black Vanity Mirror Decor for Mantle, Bedroom, Entryway, Living Room",SUNSLASH Store,$69.99,In Stock,"['Home & Kitchen', 'Home Décor Products', 'Mirrors', 'Wall-Mounted Mirrors']",https://m.media-amazon.com/images/I/41nGiqXS+5L._SS522_.jpg,"['https://m.media-amazon.com/images/I/41nGiqXS+5L._SS522_.jpg ', ' https://m.media-amazon.com/images/I/415dCvxOAJL._SS522_.jpg ', ' https://m.media-amazon.com/images/I/511pgsiDi3L._SS522_.jpg ', ' https://m.media-amazon.com/images/I/41Lx+5vQkrL._SS522_.jpg ', ' https://m.media-amazon.com/images/I/41OuN7vF1HL._SS522_.jpg ', ' https://m.media-amazon.com/images/I/41SMQ6gOY9L._SS522_.jpg ', ' https://m.media-amazon.com/images/I/31CdAsXC07L._SS522_.jpg']",,,,"36""L x 24""W",,,Black（arched）,Aluminum,,[],"[{'Brand': ' SUNSLASH '}, {'Room Type': ' Bathroom '}, {'Shape': ' Arched '}, {'Product Dimensions': ' 36""L x 24""W '}, {'Frame Material': ' Glass, Aluminum '}]",[''],bathroom mirror for wall,"['Room Type: Bathroom', 'Mounting Type: Wall Mount', 'Special Feature: Rustproof, Shatterproof, Thin Frame', 'Frame Type: Framed', 'Frame Material: Glass, Aluminum', 'Finish Type: Metal', 'Material: Aluminum', 'Product Dimensions: 36""L x 24""W', 'Assembly Required: No', 'Customer Reviews: 4.5  4.5 out of 5 stars    \n    40 ratings   \n\n\n 4.5 out of 5 stars', 'Best Sellers Rank: #731,197 in Home & Kitchen (See Top 100 in Home & Kitchen)  #2,149 in Wall-Mounted Mirrors', 'Brand: SUNSLASH', 'Number of Pieces: 1', 'Number of Items: 1', 'Shape: Arched', 'Color: Black（arched）', 'Theme: modern']",2fe90f14-adab-5df2-8a36-de747ac0b957,2024-02-02 18:55:00
B07ZSF42WD,https://www.amazon.com/dp/B07ZSF42WD,"Allied Brass Carolina Crystal Collection Frameless Oval Tilt Beveled Edge Wall Mirror, Antique Brass",Allied Brass Store,,Temporarily out of stock.,"['Home & Kitchen', 'Home Décor Products', 'Mirrors', 'Wall-Mounted Mirrors']",https://m.media-amazon.com/images/I/21+UCtQ6p9L._SS522_.jpg,['https://m.media-amazon.com/images/I/21+UCtQ6p9L._SS522_.jpg'],,,,21 x 4.8 x 29 inches,,,Antique Brass,Brass,Antique,[],"[{'Brand': ' Allied Brass '}, {'Room Type': ' Bathroom '}, {'Shape': ' Oval '}, {'Product Dimensions': ' 29""L x 21""W '}, {'Frame Material': ' Brass '}]","['Crafted from the finest solid brass materials ', ' Stunning crystal accents make this item sparkle ', ' Concealed screw mounting hardware installs easily ', ' Tilts for all viewing angles for people of all heights ', ' 21-in wide x 29-in high oval mirror with beveled edge ', ' Provided with a limited lifetime']","Add a beautiful focal point to your bathroom with this elegant and practical Carolina Crystal Collection wall mounted tilt mirror with crystal accents. With its classic traditional style, this frameless mirror adds a decorative look to the sink area. Mirror mounts easily and tilts to accommodate adjusting viewing angles for people of any height. Sure to be a welcomed addition to any bathroom, this beautiful mirror with the added sparkle of crystal is extremely attractive and very useful.","['Room Type: Bathroom', 'Mounting Type: Wall Mount', 'Special Feature: Frameless', 'Frame Type: Unframed', 'Frame Material: Brass', 'Material: Brass', 'Shape: Oval', 'Style: Antique', 'Color: Antique Brass', 'Theme: Antique', 'Best Sellers Rank: #3,039,910 in Home & Kitchen (See Top 100 in Home & Kitchen)  #7,813 in Wall-Mounted Mirrors', 'Brand: Allied Brass', 'Number of pieces: 1', 'Number of Items: 1', 'Product Dimensions: 29""L x 21""W', 'Item Dimensions LxWxH: 21 x 4.8 x 29 inches', 'Assembly required: No']",b7838b38-a622-52b8-b226-972abfab2abc,2024-02-02 18:55:01
B0CN1LGXNP,https://www.amazon.com/dp/B0CN1LGXNP,"Home Source 40.7' Elegance Bar Server and Wine Glass Cabinet, 12-Bottle Wine Rack, Rollers for Mobility, and Interior Drawer (Walnut)",Home Source Store,$349.00,Temporarily out of stock.,"['Home & Kitchen', 'Furniture', 'Game & Recreation Room Furniture', 'Home Bar Furniture', 'Bars & Wine Cabinets', 'Wine Cabinets']",https://m.media-amazon.com/images/I/41nYPK8XbrL._SS522_.jpg,"['https://m.media-amazon.com/images/I/41nYPK8XbrL._SS522_.jpg ', ' https://m.media-amazon.com/images/I/316W823P+1L._SS522_.jpg ', ' https://m.media-amazon.com/images/I/41sNLTdkzKL._SS522_.jpg ', ' https://m.media-amazon.com/images/I/41R6GXj3MKL._SS522_.jpg ', ' https://m.media-amazon.com/images/I/51hkYfs0o9L._SS522_.jpg ', ' https://m.media-amazon.com/images/I/41fWRP-IWWL._SS522_.jpg ', ' https://m.media-amazon.com/images/I/61UkOndMdtL.SS125_SS522_.jpg']",,Home Source,JZ74-Parent,"18.7""D x 31.5""W x 40.7""H","November 9, 2023",,Walnut,Walnut Wood,Fluted shape,[],,"['12-bottle wine rack12-bottle wine rack ', ' Stemware hanger for 8 glasses ', ' 1 interior drawer ', ' Rollers for mobility ', ' Assembly required']",This elegant bar server adds modern style and understated elegance to any contemporary lounge or dining room. It provides ample shelf and storage space for beverages.,"['Brand: Home Source', 'Color: Walnut', 'Recommended Uses For Product: Tools', 'Product Dimensions: 18.7""D x 31.5""W x 40.7""H', 'Special Feature: Wheeled', 'Mounting Type: Floor Mount', 'Room Type: Kitchen, Living Room, Dining Room', 'Door Style: Fluted shape', 'Included Components: Shelves', 'Shape: Rectangular', 'Item Weight: 73.04 Pounds', 'Base Type: Legs', 'Installation Type: Freestanding', 'Assembly Required: Yes', 'Frame Material: Walnut Wood', 'Item Weight: 73 pounds', 'Manufacturer: Home Source', 'ASIN: B0CN1LGXNP', 'Item model number: JZ74-Parent', 'Customer Reviews: 5.0  5.0 out of 5 stars    \n    3 ratings   \n\n\n 5.0 out of 5 stars', 'Best Sellers Rank: #782,346 in Home & Kitchen (See Top 100 in Home & Kitchen)  #101 in Wine Cabinets', 'Date First Available: November 9, 2023']",60625d76-c337-5108-86fe-2ffd881051e9,2024-02-02 18:55:01
B0CMTHD198,https://www.amazon.com/dp/B0CMTHD198,"Shintenchi 60"" Small Loveseat, 3 in 1 Cute Convertible Sofa Bed, Modern Futon Recliner Sleeper w/2 Cup Holder, Upholstered Folding Couch for Small Space, Dark Gray",Shintenchi Store,,,"['Home & Kitchen', 'Furniture', 'Living Room Furniture', 'Sofas & Couches']",https://m.media-amazon.com/images/I/41SkpIbGdQL._SS522_.jpg,"['https://m.media-amazon.com/images/I/41SkpIbGdQL._SS522_.jpg ', ' https://m.media-amazon.com/images/I/412KsuyQSqL._SS522_.jpg ', ' https://m.media-amazon.com/images/I/41JPW-kI8bL._SS522_.jpg ', ' https://m.media-amazon.com/images/I/51GZWJc3ufL._SS522_.jpg ', ' https://m.media-amazon.com/images/I/41wAxZIeDvL._SS522_.jpg ', ' https://m.media-amazon.com/images/I/51iTMzLtb4L._SS522_.jpg ', ' https://m.media-amazon.com/images/I/415N121r2sL._SS522_.jpg']",810140367761,Shintenchi,SNSSF,"29""D x 59.4""W x 31.5""H","September 26, 2023",,Dark Gray,Wood,Pillow-Top,[],,"['3 in 1 Design Multi-Function: Crafted with 3 adjustable position, you can adjust the backrest as your like. Three different position make it three different usage. Buy 1 to get a sofa, a recliner and a sleeper at the same time! ', ' Perfect for Small Space: Comes with a 59.4”W x 29”D x 31.5”H size, the sofa bed is perfect for small space. It won’t take much space but will provide you extra comfort to your sweet home ', ' Timeless Appeal: The stylish simple lines outlook combines with the solid color make the sofa bed modern and minimalist. The classic and timeless appeal make it suitable for most decor style. Available in 6 colors for your choice ', ' Custom Velvet Comfort: Made by breathable and skin-friendly velvet fabric, padded with high-density sponge, this loveseat sofa bed will bring extra comfort to you. Solid wood legs are equipped for long lasting ', ' Assembly Notice: A detailed step-by-step manual is included in each box. You can follow the instruction to get a new sofa with no hassle. Please noted that all the legs and hardware are hidden in the fabric pocket at the bottom of the sofa']","Still looking for a tiny sofa for watching TV, a recliner for relaxing, a sleeper for napping, but still worrying about no more space left? Our Shintenchi Convertible sofa bed would be your perfect choice! The backrest can be adjusted in to 3 different position, means that you will get a sofa, recliner and sleeper at the same time. Also the tiny size will never take up too much space! It’s a wonderful choice for small areas. The modern outlook make it suitable for various decor styles. And we provide 6 different choice as you like. The breathable and skin-friendly velvet fabric is comfortable enough even for long time sitting! After you receiving the package, please find the legs and hardware in the fabric pocket at the bottom of the sofa, they are definitely not missing.","['Brand: Shintenchi', 'Manufacturer: Shintenchi', 'ASIN: B0CMTHD198', 'Item model number: SNSSF', 'UPC: 810140367761', 'Customer Reviews: 4.0  4.0 out of 5 stars    \n    14 ratings   \n\n\n 4.0 out of 5 stars', 'Best Sellers Rank: #352,155 in Home & Kitchen (See Top 100 in Home & Kitchen)  #433 in Sofas & Couches', 'Date First Available: September 26, 2023', 'Age Range (Description): Adult', 'Included Components: Hardware', 'Assembly Required: Yes', 'Special Feature: Recliner', 'Product Dimensions: 29""D x 59.4""W x 31.5""H', 'Item Weight: 71.1 Pounds', 'Seating Capacity: 2', 'Item Package Quantity: 1', 'Material: Wood', 'Upholstery Fabric Type: Velvet', 'Frame Material: Wood', 'Type: Sofa Bed', 'Color: Dark Gray', 'Pattern: Solid', 'Style: Modern', 'Room Type: Living Room', 'Arm Style: Pillow-Top']",4ff545f6-13f7-5a9a-9e73-34ba9f43066d,2024-02-02 18:55:02
