,Time,ProductId,UserId,Score,Summary,Text
436,1351209600,B0012C2GFM,A2T28XGN21AZ0A,2,Super healthy but tastes like ass,"I have no idea what these people are thinking saying this stuff tastes great. They must work for Nutiva or have a friend who does.<br />This stuff is super healthy, I'm sure - but tastes friggin' awful. It's like cardboard pulp. I make smoothies with it which my mom said look like diarrhea.<br /><br />I'm stuck with this huge 3 lb bag - which, in its defense - is a fantastic bargain. But I got it in 2010 and I'm still trying to choke it down two years later. Spend the extra money and get yourself some Vega. It's certainly pricier, but you get what you pay for."
437,1351209600,B004LLGBQG,A4IL0CLL27Q33,1,Buyer beware,Nespresso makes GREAT coffee and GREAT machines. The Nespresso capsule offers posted here are from a third party who is putting a large additional margin on their price.<br /><br />You can order the same products online from Nespresso for approx $0.55 each (half the price here).
438,1351209600,B0001M10TW,A3DUXBNB660QGM,5,This product is great however the price of $9.32 must be a misprint.  It is available for around $3.50 on other websites.,"This product is very good on all meat products, vegetables and soups.  It has just the right amount of pepper.<br /><br />I would not pay $9.32 for it when it is available on other websites for under $4.00!!!<br />[...]"
439,1351209600,B0048KH218,A2JAEJJA6TJHLY,4,Busted,"The bag came broken. Product was leaking out of the box, due to poor packing standards.<br />Hope next items arrive unscathed. Quinoa tasted good."
440,1351209600,B001G0MG46,A2SM0RC2BDLFU4,4,Delicious!,"This was a gift for my brother, and he finished it within 10 days of its receipt. Need I say more!"
441,1351209600,B001EQ4OY2,A19N1RDH99TTJZ,5,Can't live without it!,"I'm french so I literally grew up with this salt, I don't even know how to cook without it. What a nice surprise when I found out I can easily order it here on Amazon in the US!<br />Basically this is 2/3 real sea salt and 1/3 herb salt (like celery salt and such) so you can cut on salt without even thinking about it.<br />The taste? So much better than dumb salt, it adds a wonderful but subtle herb/vegetables flavor (kinda like a bouquet garni?).<br />Everybody loves it, husband, friends, grandma and brother in law, everybody.<br />Best way to enjoy it? Fresh bread, butter, sprinkle the salt on the top of the ""tartine"" and eat with fresh radish! Yum!<br /><br />My mother always insist on sending me some from France ""But Mom I can just order it from Amazon here!"".<br />It's hard to believe that 50 years ago, this was just a local product and now it's sold on Amazon in the US. But it totally deserves it! Thank you Alfred Vogel for offering us healthy AND yummy products since 1963! Way before organic products were trendy.<br />This is a true 6 stars product."
442,1351209600,B002K9BG16,A30A7W9CZ77GFY,4,Butler's chocolate is the real deal direct from Ireland,"Nifty hot chocolate discs added to your warm milk or milk alternative is simply yum! Made in Ireland so you know the chocolate is high quality.<br /><br />Ingredients for those that desire it (I think it should be a requirement on any listing):<br />Milk chocolate 29% (sugar, whole milk powder, cocoa butter, cocoa mass, emulsifier:soya lecithin, flavouring: natural<br />vanilla), Cocoa mass 25%, Invert sugar syrup, Sugar syrup, sugar, water, preservtive:sorbic acid), Sweetened condensed<br />milk (milk, sugar). Milk chocolate contains 32% cocoa, solids minimum, 20% milk solids minimum.<br /><br />Shelf life is about 18 months."
443,1351209600,B00438XVGU,A2GW6JUVTALDPV,1,I did not receive my order,"I placed my order through Amazon and after about 10 days inquired about my order because it had not shipped.  I received an email back from Starbucks that my order had been canceled. No explanation at all, just that it had been canceled. I checked back on Amazon and see that this item is still available but they had raised the price.<br /><br />So instead of honoring the price they just blew me off like the sale never happened.  Shame on Amazon for allowing a seller to do this.<br /><br />Bottom line, Amazon has gone down a few points in my eyes.  Greedy Starbucks can keep their coffee."
444,1351209600,B00171APVA,A21BT40VZCCYT4,5,Healthy Dog Food,This is a very healthy dog food. Good for their digestion. Also good for small puppies. My dog eats her required amount at every feeding.
445,1351209600,B0029ZAOW8,A2E2F8WSUB33VE,5,Excelent,"Good price, flavor, fast delivery And good presentation overall. Very eficient when playing  golf,  it really gives extra Energy and it helps to achieve  a better game"
446,1351209600,B005ZBZM52,A1BSGNCHEI1PJI,5,Very Nice Medium Roast,"This coffee has the best aroma!  Great medium taste.  I have replaced our Starbucks Pike's Peak Roast because my husband and I like the taste better.  I store it in a sealed container, don't mind that I can't store it in my drawer with the other k-cups.  The overall morning experience is pleasant!"
447,1351209600,B000JL9EOS,A399ZRBKJS8YKT,5,Great on everything!,"We purchased this seasoning in Kauai, and use it on everything - beef, chicken, fish, it is absolutely our favorite! It is expensive but very worth the extra cost."
448,1351209600,B000IHJEDE,A2DFSA2JXQKVY3,4,Not bad.,"These are small and very salty. The taste is good, but very strong, so it's a good thing the package contains a small amount. It only takes a few little crisps to cure my salty/crunchy craving. I can snack on one package for an entire day. Of course these would not be a good snack if you're very hungry, because there isn't enough there to fill you up. For less than $1 per pack it's an okay deal."
449,1351209600,B0049D7HRS,A3LR9HCV3D96I3,5,Delicious,Individually packaged assorted rice crackers are really good.  I could without all the packaging.  Really great price for a high quality mix of rice crackers with some wasabi peas included.  I mixed with salted peanuts for a delicious snack.
450,1351209600,B0042WXFJU,A3KUC5K5VSJNU9,5,"It's FANTASTIC! Mixes with Many kinds of Soups, etc. Yes.","I just love it, and I am Not a major Indian cooking fan--just enough. Really, it mixes with anything you are doing like <a href=""http://www.amazon.com/gp/product/B000FIXT2I"">Steamed Brown Rice Bowl, Organic, Microwaveable, 7.4-Ounce Bowls (Pack of 12)</a> (I use these for convenience, and then I don't eat the whole pot of rice). In many kinds of soups, etc. Beef it up with some <a href=""http://www.amazon.com/gp/product/B001FA1KLW"">Amore Tomato Paste, 4.5-Ounce Tubes (Pack of 12)</a>, which is so, so convenient. Sweeten to taste if you prefer. Here's the best artificial sweetener on Amazon <a href=""http://www.amazon.com/gp/product/B0019LTH3U"">NuNaturals Nustevia Alcohol Free Stevia Glass Bottle Liquid, 2-Ounce</a>. (Stop using Splenda which contains three Chlorine moities. It's essentially bleach, folks.) Enjoy, lentils are so healthy, and this way they really have flavor!<br />FYI: This costs $3-5/PER PACK at our local stores when you can find it. It is Not overpriced, as someone here said."
451,1351209600,B000CQC0B4,A26DOVGY14V7NX,5,breakfast tea,We switch to this decaf tea at night for a great cup of tea and no sleep problems. Thanks for a good cup of tea.
452,1351209600,B0034WSXIC,A2EOLZ2F8PG87D,5,Awsome Figs,I am an big lover of fig jam and this fig jam has a very unique flavor. Kind of a mix between the light kadoda  figs and the dark mission figs. Must try it!
453,1351209600,B006N3IE6A,A3GFZIL1E0Z5V8,5,Rodeo Drive is Crazy Good Coffee!,Rodeo Drive is my absolute favorite and I'm ready to order more!  That's if I can find it.<br />I don't know why they are discontinuing it.<br />It arrived very fast.
454,1351209600,B002Y3CSD8,ATL8TGSAEMDV1,5,I would buy it again,"I decided to try this sauce recently and overall I thought it was delicious.  I've had Pad Thai at many different restaurants around Chicago and Boston, and my version of Pad Thai using this sauce felt less ""greasy"" as my wife put it.  Another reviewer commented that the flavor was not ""authentic""; whether this is true or not, it was still good.  In the future I may try a different sauce just to compare, but I would have no problems buying this sauce again."
455,1351209600,B0029NU2E0,A1HKHIP6VCMALP,3,Our dogs love it but finding low price and 12 oz cans is tough,"When Amazon LLC was selling large cans it was affordable via super saving shipping.  You expect a price reduction when buying large size cans.  One quarter of these cans was only partially filled with chunks, having an inch of fluid before touching the meat product.  I shake each of these large cans before opening one.  We prefer the smaller cans of this product, but local chains do not carry it in either size, and Amazon only offers it in large.  Our dogs love the pedigree brand pouches and cans, especially the beef and liver.  Although, they use corn product (one reviewer noted) and my veterinarian espouses ""...it's mostly water,"" our dogs vote is positive.  We treat our pets and give this to them because they like it...not for their health.<br /><br />After finding the substantial price increase this morning, I found the small cans at PetCo.  Perhaps, Amazon will get a small can supplier for the ""beef and liver"" chunks in the future."
456,1351209600,B0054ES1MG,A25QCYSED869Q3,5,If you like mint candy......,"This is the best hard mint candy in the world.  Expensive, though.  I can't find it in stores.  Anyone know where I can get it off-line?"
457,1351209600,B001BOE3UW,A18J98YVUMMDOA,5,You can taste the ginger.,"I love these ginger candy, tastes like ginger nothing added but natural ingredients.  I got them because the were gluten free.  My daughter took them to school for her teachers with colds, I handed them out to my neighbours.  I will be getting more."
458,1351209600,B004FD13RW,A1BPLP0BKERV,5,It is awesome.,"My partner is very happy with the tea, and is feeling much better since starting to drink it.<br />She has been drinking it both hot (normal) and iced (chilled) and likes the refreshing nature of it."
459,1351209600,B000LKTXMU,A2J3PR6J36UTVH,5,Michael Seasons Unsalted Potato Chips,"These are the best chips ever!  They are unsalted and being on a low sodium diet critical in allowing my husband and I to eat chips.  They are all natural and low fat which is a great extra bonus.  Additionally they have the BEST flavor...you really taste the potato flavor and not the salt!  I would choose these chips over ANY chip on the market today, salted or not!! These chips as well as ANY unsalted chips are very hard to find in the stores so THANK YOU Amazon for selling them."
460,1351209600,B000RZNY5G,A2ZGTXBI8C7FYI,5,YUMMY,"Very good, still have a little left. I like the salty taste (that's why I buy them)  Not too salty nuts are open and easy to pop out"
461,1351209600,B007PA30TG,A29BJSTYH9W3JI,5,super coffee,Great coffee and so easy to brew.  This coffee has great aroma and is good to the last drop.  I actually like all the brands.  This is the way coffee should taste!!
462,1351209600,B000RNENU8,A1BCHCP9C7ZE8B,5,Works like a charm and easy to use,"We have a lot of container plants, including a fig tree, tomatoes, roses, etc., and they need regular fertilizing.  Mixing granular fertilizer into a bucket is messy, so I switched to liquid Miracle-Gro and have been very happy with it.  People remark on how healthy and productive our rooftop garden is.  For use of use and results this is well worth the cost."
463,1351209600,B0083COD6O,A1DOLU6HS6R05M,5,Great flavor!,"I purchased this in a local health foods store, and loved it right away. I've tried other almond milks, and always found them to have a gritty or grainy aftertaste. Not so with this drink. It's very smooth. I could have this in cereal or my fave chai latte's or straight out of the box. Love it!"
464,1351209600,B005HI55CS,A36ERNIM0TKG3T,5,Hidden Springs Maple syrup,"This is one of the very finest maple syrups I have ordered and enjoyed. I bought the Fancy Grade, for the light amber color. It has a very great taste. I will reorder."
465,1351209600,B0033HPPIO,A2U3RRCA2URS56,5,Delish!!,So yummy... Drinking it Black coffee or w cream this coffee is delish .... One of my favs... I would recommend this coffee to everyone :)
466,1351209600,B008FXKOKK,A3RKYD8IUC5S0N,5,Tasty and works!,"First off, my cat HATES regular Greenies (the big crunchy ones) and won't even try to lick them. Any flavor. But my big fluffy Himalayan was hacking up stinky furballs in unreachable places, so when I saw these at the pet store I bought them on a whim.<br /><br />She loves them! I don't think she even chews the things, she inhales them so fast. Tuna treats are ok but chicken were more popular around here. She likes these better than the Temptations treats she had before, and I am convinced that these are somewhat healthier.<br /><br />The pouch recommends 12 treats a day, all at once, or even more for my big-boned cat. I usually do more like 5-6, because that many treats seems excessive (she would love it though). Either way, she hasn't had any hairballs since. I am not positive about the causal relationship, but I suspect these did the trick. They're great!"
467,1351209600,B002QZ2AZ0,A18PSXOI64YFZC,3,its delicious...,I was surprised at how delicious these toasted chips are. They ship well with little damage. I have ordered them several times. Also they are very fresh. Not one bit was left in the bag when I got through.
468,1351209600,B002ULC2V2,A4VW6XVS48EMF,5,Seeds!,"I love sunflower seeds and I have found that Planters has the best tasting, fresh and delicious ones out there!  they are hard to find so i am glad I found them on Amazon, I recommend to all to give these a try!!!"
469,1351209600,B007PA32OE,A3UOYYQS5Z47MS,5,Morning Coffee,Great coffee at a good price. I'm a subscription buyer and I buy this month after month. What more can I say?
470,1351209600,B0042WXFJU,A1ESX96TOYF8X5,5,Really tasty,I never thought I'd buy this type of item but tried it at C****o when they had one of their numerous taste tests.  Both my 8 year old and I liked it.  So good for you and reasonably priced there especially with an instant coupon! Comes in a 4 pack box for under $10.
471,1351209600,B000KOT5O8,A2KD4B8AZMAWJU,5,Fantastic Flavor! Great for Tuna Steaks!!,Why would someone pay almost $15 for this product (although the taste is worth it)when you can get it for less. Check your prices before paying too much.
472,1351209600,B007KPFSJ6,A506HOOCVL8GW,5,BEST cup of coffee I've ever had!,"I thought I'd splurge and try this coffee.  It costs much more than other decaf K-Cup options.  But I hoped that meant it was better coffee.  It IS better coffee.  I've never had a better cup of coffee than this.  It is excellent when compared to any other decaf or regular coffee I've tried.<br /><br />If you like BOLD, FLAVORFUL decaf coffee try this coffee and you'll really like it."
473,1351209600,B002J771J0,A1TED4G0PWZPQV,1,Was rotten,"Culd not eat it, but the other flavor I ordered was fine, not sure why it was not ok, when the other one was"
474,1351209600,B00196P9PA,A3D9688QO6PLGD,1,Disappointed,The metal cover has severely disformed. And most of the cookies inside have been crushed into small pieces. Shopping experience is awful. I'll never buy it online again.
475,1351209600,B0045TI2HU,A62DE4ONLWSD,5,Sugar-Free Brownies - Diabetes related issue,"Extremely satisfied... got precisely what I ordered and wanted.  I appreciate that we are permitted to modify the order while still keeping it in force.  Next time the option appears, I will either spread it out to more than three months or reduce the number.  Six boxes in three months maybe a bit more than I need as I am told to cut back/eliminate.  But these are a great way to get my chocolate fix.  Only the CHOC FUDGE is carried by our stores, but the MILK CHOC is what I prefer.<br /><br />On a similar note, why do stores limit their sugar free inventory?  Because they do is why I had to come online to purchase this product.  I had made requests at our local stores to carry this product, but it was not accommodated."
476,1351209600,B0001M0ZWA,AUEA2NJHMK9DF,4,Like this tea,This tea has a nice flavor although I wish it was a little stronger.  I have brewed way it states and even tried letting it sit longer  to get a stronger cup but it didn't work.  Am pleased with purchase and flavor overall.
477,1351209600,B005F0JM7W,A3U9177XF7ZF3P,5,"Works great, simple install.",I bought two of these. Easy to install and works great. The only problem is now my wife is buying more K-cups.
478,1351209600,B0001TNCK0,A1GCFTFXELCHRP,4,Still unsure about its benefits.,"ACV is supposed to help maintain the immune system, help lose weight, along with many other claims.  I know that drinking a tablespoon of ACV, diluted with a glass of water, once per day, has helped me; but I haven't seen the benefits of the pill yet.  Only been taking it for 2 weeks though, but it's certainly much more manageable than drinking directly.  PS:  Still smells awful though."
479,1351209600,B0005YW0TU,A22SW4MALCSDWV,1,Inedible,"I am one of the least picky eaters that I know, but I had to throw my bowl out after a few spoons of this.  It was disgusting and inedible.  I wonder if anyone at these big companies try their products before marketing them.  The flavor was heavily artificial with strong off-notes of bitterness and tree bark.  Dont believe me?  Go ahead and try it."
480,1351209600,B008JKTTUA,AEY5NHLOAWM21,3,The Kind Plus item was sticky,"I have no complaint about the product itself. I likely would have rated it very good had it not been subjected excessive heat somewhere along, before it arrived. Although I ate them, each one was sticking to the wrapper and<br />difficult to eat without sticky deposits on my face and hands."
481,1351209600,B001PICX42,A13W6WYHKSKAT,5,Favorite fruits snacks!,"I try to buy only organic when it comes to my kids and my son is obsessed with fruit snacks. I discovered these a couple yrs ago and fell in love right away. Not only does my son love them, but I do too! Plus, I love how soft they are! I don't worry about my younger son, who is 1.5, choking on them because they are very easy to chew. I also love how they sell them in only berry flavors because I have never been fond of citrus flavored candy and I like to eat these just as much as my kids. lol"
482,1351209600,B003TNANSO,AEY5NHLOAWM21,3,The Kind Plus item was sticky,"I have no complaint about the product itself. I likely would have rated it very good had it not been subjected excessive heat somewhere along, before it arrived. Although I ate them, each one was sticking to the wrapper and<br />difficult to eat without sticky deposits on my face and hands."
483,1351209600,B001P05K8Q,A3L0B5NBTQ7ZHO,4,Great results but they stink,"We originally purchased these chews from our veterinarian. Decided to order them here from Amazon because of the reduced cost and lack of shipping temperature restrictions on the product. We get complimented on the whiteness of our dogs' ""smiles"" all the time. Our vet is happy and so am I because I don't have to brush their teeth a lot! You definitely want to wash your hands after handling the chews because they have a peculiar odor.  Now if someone can figure out how to ship heart worm prevention without it getting too hot, I'd be ecstatic!"
484,1351209600,B0029ZAOW8,AYTSBGA5A3UWI,5,A God Sent Remedy!!!,I love this stuff! It's a God sent Remedy for hangovers!.... I understand the health concerns many people have and I can also see that this can be habit forming. I make sure I only take one every so often and not everyday.
485,1351209600,B002RBRY0Y,A11LYF3HM1QQK7,3,very delicious,"This is my very favorite of the truffles. It is a medium dark and very delicious. If I have one, it screams at me to have just one more! As long as they are made, I will be first in line to purchase."
486,1351209600,B003VXHGPK,A3GFZIL1E0Z5V8,5,Rodeo Drive is Crazy Good Coffee!,Rodeo Drive is my absolute favorite and I'm ready to order more!  That's if I can find it.<br />I don't know why they are discontinuing it.<br />It arrived very fast.
487,1351209600,B0084MBGNQ,A3F526Y77Y64KT,5,Great Outdoor Dog Treat,I have two Weims that have a strong need to chew. These bones serve that need very well.  Be sure to keep the bones in an area where you don't have to worry about stains as they are greasy.
488,1351209600,B000QSON4K,A2I606SLG4SWHF,5,Perfect for Giving Medications to Our Dogs,"Every month, we give our three dogs (two Aussies and a Golden/Flat-Coat Retriever mix) pills for flea/tick/worm repellant.  In addition, one of our Aussies needs daily thyroid pills.  We found Pill Pockets is the very best way to do this.  Opening the mouth wide and trying to put the pill waaay in the back of the mouth before clamping the jaws shut and massaging the throat until the poor dog swallows is a bad thing to do to a beloved pet.  It's bad because Pill Pockets make this chore a happy and delicious time for the dog involved.  The Pockets (in the pet store we use) come in chicken or beef flavors, so we alternate flavors every time we buy a new supply.  Everybody is happy, and the dogs get the required meds."
489,1351209600,B0046IIPMW,A27IEA7DADM64W,5,Great for a Paleo diet,I've been eating a strict Paleo eating diet for nearly one year and including Ghee has been a huge taste benefit. Ghee has virtually no lactose and is healthier than regular butter. I brush this on my chicken breasts and then bake them with a a bit of crushed black pepper and sunflower seeds. The flavor really comes out with so few ingredients. This brand and another one are two of my favorite and they are usually listed with Prime available.
490,1351209600,B007O17V2I,A1571CSWXSP125,5,Oat Bran,This oat bran was great as a cereal & pancakes.  Just adjust your recipes to your diet & add the oat bran.  Great!
491,1351209600,B003VN97GQ,A20DC4NK8YMOQT,5,One of the Best Dressings Around,"As stated above, a great salad dressing at a great price,  especially when you purchase the cruet as an accessory included in the package. When ever I serve this to guests, most are not aware that this is a packaged dressing (I doctor it up a bit), until I tell them.<br />A good inexpensive gift for your favorite cook."
492,1351209600,B006392MMG,A36ERNIM0TKG3T,5,Hidden Springs Maple syrup,"This is one of the very finest maple syrups I have ordered and enjoyed. I bought the Fancy Grade, for the light amber color. It has a very great taste. I will reorder."
493,1351209600,B000NM1BHQ,A2JDXKFZ0PFHKU,2,Received broken,I bought these to use as decorative center pieces for a birthday party. The packaging looked nice but when going through the candies to put in my decor I noticed that over half of them (43 to be exact) were broken and unusable.
494,1351209600,B0065AOUKK,A1KRZB2K7O6XC,5,Yummy!,Got this for my brother & nephew and they just love it!!  Said it's better than regular hot chocolate. Allows whole family to use the Kuerig so not just for coffee.
495,1351209600,B0012VSXIM,A2TOUMUWSN7FJY,5,Good & Plenty Licorice Candy,If you like licorice you will love this candy.  I can remember eating this candy from a box at the local movie theatre when I was a kid and it is still just as good.
496,1351209600,B000FACFIA,A1TTGEM50SIS2R,5,"Licorice Scottie Dogs, Red",I love the Gimbals Red Licorice Scottie dogs I purchased from Candy Crate.  The price per pound was less than I paid from another source and the purchase qualified for free shipping.  I'll be back...........for more when my supply is gone!
497,1351209600,B0019GZ7Z2,ANSBPV2CZVZ39,4,Great product,"This is a wonderful flour to use. low carbs, and full of nutrients. I dont use it though because it has a very strong sweet coconuty flavor and I am not a coconut kind of person. If I DO add it, it is a minute amount. But defintiely number one flour to buy and use..even for baking for your doggie cookies. I only gave it 4 stars cause of the taste."
498,1351209600,B0049K99RW,A1Y73Y4VX3AJMZ,4,Nice traditional chai,"I got hooked on this chai when I decided to give up coffee.  It still has a little bit of caffeine, but much less than coffee does.  It's nice and spicy (you really get the flavor of black pepper) and actually easy to prepare.  Initially, I thought it was too complicated to boil water and then add milk separately, but it allows you to adjust to your own tastes.  I usually add a little more milk than instructed to cut down on the spice and add a little more creaminess.  The thing I really like about this chai mix is that it's not sweet at all.  If you want sweet, you add your own sweetener - I usually use a spoonful of white sugar or honey.  After drinking this stuff, I tried some pre-sweetended mix, and there was no comparison.  This stuff tastes ""real"" and without chemicals or preservatives."
499,1351209600,B0024NUM7W,A1SFA2BYES0OH,3,"eh,,ok, but...","I love popcorn, and this product is good except for the fact that it does not and will not give you the taste that you are looking for that you get from movie theaters. Even with the matching seasoning salt, it doesn't do the justice. But its ok,just not buttery at all."
500,1351209600,B000OH97Y4,A25QGGBI6NGHNY,3,Trying a different food,"Because our Rottweiler has some skin issues, we are trying the ProPlan Selects Natural Salmon and Brown Rice food. We are beginning our 3rd bag via subscribe and save. So far, our dog likes it and we haven't had enough time to know if its doing better than the Blue Buffalo we used before. I am thinking of adding Salmon oil.<br /><br />The only negative we have is the kibble is small. My dog sometimes gets choked on the little kibble, so I am going to try and stick with this form, but find a larger kibble. Overall, this is a great food."
