title,primary_image,style,material,color,url,keywords,img_description,caption
EGFheal White Dress Up Storage,https://m.media-amazon.com/images/I/31l+OVMKBFL._SS522_.jpg,,,,https://www.amazon.com/dp/B0C7QD8KYX,"['dress up storage', 'white', 'wood']","This is a white dress-up storage unit designed for children's playrooms or bedrooms. The unit features a sturdy construction with a clean white finish that easily blends with various decor styles. It includes a hanging area with a rod for costumes or clothing, complete with several white hangers. Below the hanging space, there are two open shelves for additional storage, perfect for shoes, hats, or toys. To the right of the hanging area, there are two grey fabric storage bins that slide into cubbies, offering concealed storage for accessories or small items. The top of the unit has a row of decorative crown-like cutouts, adding a playful touch to the design. The base of the unit is slightly recessed, creating a convenient lower storage area that can be used for larger items or as a seating bench. This dress-up storage unit is a functional and charming addition to a child's space, encouraging organization and imaginative play.","White children's dress-up storage unit with hanging area, shelves, and grey fabric bins, perfect for organizing costumes and accessories in playrooms or bedrooms."
"Caroline's Treasures PPD3013JMAT Enchanted Garden Flowers Doormat 24x36 Front Door Mat Indoor Outdoor Rugs for Entryway, Non Slip Washable Low Pile, 24H X 36W",https://m.media-amazon.com/images/I/51Zn-AivGrL._SS522_.jpg,Enchanted Garden Flowers,Rubber,Enchanted Garden Flowers,https://www.amazon.com/dp/B08Q5KDSQK,"['doormat', 'floral', 'non-slip', 'washable', 'low pile', 'indoor', 'outdoor', 'colorful']","This is a vibrant and colorful doormat featuring a design titled ""Enchanted Garden Flowers."" The dimensions of the doormat are 24 inches in height by 36 inches in width. It is suitable for both indoor and outdoor use, making it versatile for placement at a front door or entryway. The doormat is designed to be non-slip and washable, with a low pile that ensures easy door movement and maintenance. The design showcases a variety of stylized flowers in rich hues of purple, red, yellow, and green, set against a dark background that makes the colors pop. This doormat would add a cheerful and welcoming touch to any home entrance.","Colorful ""Enchanted Garden Flowers"" doormat"
"Leick Home 70007-WTGD Mixed Metal and Wood Stepped Tier Bookshelf, White Herringbone/Satin Gold",https://m.media-amazon.com/images/I/31XhtLE1F1L._SS522_.jpg,Bookshelf,,,https://www.amazon.com/dp/B098KNRNLQ,"['bookshelf', 'metal', 'wood', 'white', 'gold', 'stepped tier', 'herringbone pattern']","This is a Leick Home Mixed Metal and Wood Stepped Tier Bookshelf featuring a white herringbone pattern on the shelves, complemented by a satin gold finish on the metal frame. The bookshelf has a modern, open design with a stepped configuration, providing three tiers of shelving for books, decorative items, or other belongings. The white shelves contrast elegantly with the warm metallic tone of the frame, creating a piece that is both functional and stylish, suitable for a variety of interior decor styles.","Modern Leick Home bookshelf with white herringbone shelves and a satin gold metal frame, featuring a stepped tier design for stylish storage."
"Caroline's Treasures CK3435MAT Bichon Frise Doormat 18x27 Front Door Mat Indoor Outdoor Rugs for Entryway, Non Slip Washable Low Pile, 18H X 27W",https://m.media-amazon.com/images/I/51V1IWRrXHL._SS522_.jpg,Bichon Frise,Rubber,Bichon Frise,https://www.amazon.com/dp/B07W8SF5CF,"['doormat', 'non-slip', 'washable', 'low pile', 'floral', 'animal print', 'indoor', 'outdoor']","This is a decorative doormat featuring a Bichon Frise dog as the central design. The doormat measures 18 inches in height and 27 inches in width. It is designed for both indoor and outdoor use, making it versatile for placement at the front door or any entryway. The mat has a non-slip feature to ensure safety and stability, and it is washable, which allows for easy maintenance. The pile of the mat is low, which helps in preventing tripping and allows for doors to pass over it easily. The background of the mat is adorned with a floral pattern in a variety of colors, set against a light blue backdrop, which adds a charming and vibrant touch to the item. The black border frames the design neatly, enhancing its visual appeal.","Decorative doormat featuring a Bichon Frise with a colorful floral background, designed for indoor and outdoor use with a non-slip, washable feature."
"Wildkin Kids Canvas Sling Bookshelf with Storage for Boys and Girls, Wooden Design Features Four Shelves and Two Drawers, Helps Keep Bedrooms, Playrooms, and Classrooms Organized (Natural with Blue)",https://m.media-amazon.com/images/I/51-GsdoM+IS._SS522_.jpg,Natural with Blue Canvas,"Engineered Wood, Polyester",,https://www.amazon.com/dp/B07GBVFZ1Y,"['bookshelf', 'kids', 'canvas', 'wood', 'storage', 'four shelves', 'two drawers', 'natural', 'blue']","This is a Wildkin Kids Canvas Sling Bookshelf with Storage, designed for children's bedrooms, playrooms, or classrooms. The bookshelf features a natural wood finish, giving it a warm and inviting look that blends well with various decor styles. It includes four canvas sling shelves in a deep blue color, which are ideal for displaying books in a way that makes the covers easily visible and accessible to children.

Below the sling shelves, there are two additional wooden shelves that provide extra space for storing toys, games, or additional books. The unit also comes with two matching blue canvas drawers that fit neatly into the lower section, offering concealed storage for smaller items and helping to keep the area tidy.

The overall design is kid-friendly, with a sturdy wooden frame that ensures durability and stability. The combination of open shelving and drawers makes it versatile for organizing a variety of items, encouraging children to keep their spaces organized.","Wildkin Kids Canvas Sling Bookshelf with Storage in natural wood and deep blue, featuring four sling shelves and two lower wooden shelves with matching canvas drawers for versatile organization in children's spaces."
Gbuzozie 38L Round Laundry Hamper Cute Mermaid Girl Storage Basket Waterproof Coating Organizer Bin For Nursery Clothes Toys,https://m.media-amazon.com/images/I/41hYmELREGL._SS522_.jpg,Fashion,fabric,Mermaid Girl,https://www.amazon.com/dp/B09QZ3LYWB,"['laundry hamper', 'round', 'waterproof', 'storage basket', 'nursery', 'toys organizer', 'cute', 'mermaid', 'pink', 'blue', 'fabric']","This is a 38-liter round laundry hamper featuring a cute mermaid girl design, ideal for adding a playful touch to a nursery or child's room. The hamper is made with a waterproof coating, making it suitable for storing not just clothes but also toys and other items. The design showcases a whimsical mermaid with vibrant pink hair and a green tail, set against a soft blue background adorned with sea creatures and coral motifs. The hamper appears to be equipped with two durable handles for easy transport. Its collapsible design allows for convenient storage when not in use. This organizer bin combines functionality with a charming aesthetic, making it a delightful addition to any space that requires tidying up.","A 38-liter round laundry hamper with a waterproof coating, featuring a whimsical mermaid design, perfect for nurseries or children's rooms."
"Tiita Comfy Saucer Chair, Soft Faux Fur Oversized Folding Accent Chair, Lounge Lazy Chair for Kids Teens Adults, Metal Frame Moon Chair for Bedroom, Living Room, Dorm Rooms",https://m.media-amazon.com/images/I/41O7mY3lUvL._SS522_.jpg,Modern,pp cotton,Grey,https://www.amazon.com/dp/B09T5T67VC,"['saucer chair', 'faux fur', 'oversized', 'folding', 'metal frame', 'moon chair', 'grey']","This is a Tiita Comfy Saucer Chair featuring a plush, oversized seat cushion upholstered in soft faux fur. The chair is designed to provide a cozy and comfortable seating experience, suitable for kids, teens, and adults. It has a distinctive moon chair silhouette with a generously padded, tufted cushion that creates an inviting look and feel.

The chair's frame is made of durable metal, finished in black, which folds easily for convenient storage and transport. The color of the faux fur appears to be a neutral grey, making it versatile for various room decors. This chair is ideal for adding a touch of comfort and style to bedrooms, living rooms, dorm rooms, or any space where a casual and relaxing seat is desired.","Plush grey faux fur saucer chair with a foldable metal frame, offering cozy seating for bedrooms or dorms."
"Summer Desk Decor,Welcome Summer Wood Block Sign Desk Decor,Rustic Summer Fruits and Popsicles Wooden Box Plaque Sign Desk Decor for Home Office Shelf Table Decorations",https://m.media-amazon.com/images/I/51sai4l5ttL._SS522_.jpg,,,,https://www.amazon.com/dp/B0C99NS6CZ,"['desk decor', 'wood', 'block sign', 'rustic', 'summer', 'fruits', 'popsicles', 'wooden box', 'plaque', 'table decorations']","This is a ""Welcome Summer"" themed wooden block sign designed as a decorative desk accessory. The sign features a vibrant and colorful watercolor-style illustration with motifs of summer fruits like watermelon slices, lemons, and limes, as well as popsicles, which evoke a refreshing and joyful summer vibe. The phrase ""Welcome Summer"" is prominently displayed in the center in a playful, multicolored font that complements the illustrations surrounding it.

The wooden box plaque has a rustic yet cheerful look, making it suitable for adding a touch of seasonal charm to a home office, shelf, or table. The edges are clean and the sign appears to be self-standing, which allows for easy placement without the need for additional support. The overall design suggests a casual and fun atmosphere, perfect for summer-themed decor.","Colorful ""Welcome Summer"" wooden block sign with summer fruits and popsicles design, ideal for seasonal desk or shelf decor."
"Homebeez 39.1"" Length Bedroom Storage Bench, End Bed Ottoman Bench with Golden Metal Legs, Dressing Chair for Entryway Living Room,Green",https://m.media-amazon.com/images/I/31eBuhJ0NDL._SS522_.jpg,Trumpet Leg,,Green,https://www.amazon.com/dp/B0BWQ8M4Q3,"['storage bench', 'ottoman', 'green', 'metal legs', 'golden legs', 'velvet', 'bedroom furniture', 'entryway furniture', 'living room furniture']","This is a Homebeez bedroom storage bench featuring a luxurious green velvet upholstery that adds a vibrant touch to any room. The bench measures 39.1 inches in length, providing ample space for seating or storage. It is designed with a hinged top that likely opens to reveal a storage compartment, ideal for keeping linens, accessories, or other household items neatly tucked away.

The bench is supported by sleek golden metal legs that give it a modern and elegant look, while also ensuring stability and durability. The combination of the rich green color and the golden accents creates a sophisticated aesthetic that can complement both contemporary and classic interior designs.

This versatile piece of furniture can serve as an end-of-bed ottoman, providing a comfortable place to sit while dressing or putting on shoes. It can also be placed in an entryway, living room, or any other space where additional seating and storage are desired. The bench's chic design and functional features make it a stylish and practical addition to any home.","Luxurious green velvet storage bench with golden metal legs, featuring a hinged top for ample storage space, perfect for adding a vibrant and sophisticated touch to any room."
"Flash Furniture Webb Commercial Grade 24"" Round Blue Metal Indoor-Outdoor Table",https://m.media-amazon.com/images/I/41IWb+KWq7L._SS522_.jpg,Contemporary,Metal,Blue,https://www.amazon.com/dp/B01M3VT58B,"['table', 'metal', 'indoor-outdoor', 'blue', 'round']","This is a commercial-grade 24"" round table designed for both indoor and outdoor use. The table features a vibrant blue finish that adds a pop of color to any setting. The tabletop is smooth and circular, providing ample space for dining or display. Its metal construction ensures durability and stability, while the sleek, tapered legs give it a modern and stylish look. The table also includes protective rubber feet to prevent damage to flooring and to enhance stability. This piece is ideal for cafes, bistros, or home patios looking for a contemporary and functional table.","Commercial-grade 24"" round table with a vibrant blue finish, suitable for indoor and outdoor use, featuring a durable metal construction, sleek tapered legs, and protective rubber feet."
"Mellow 2 Inch Ventilated Memory Foam Mattress Topper, Soothing Lavender Infusion, CertiPUR-US Certified, Queen",https://m.media-amazon.com/images/I/418jBmKzSxL._SS522_.jpg,,,,https://www.amazon.com/dp/B077ZDFXYK,"['mattress topper', 'memory foam', 'ventilated', 'lavender infusion', 'certipur-us certified', 'queen size', 'purple']","This is a queen-sized Mellow 2 Inch Ventilated Memory Foam Mattress Topper featuring a soothing lavender infusion. The topper is designed to provide additional comfort and support to your existing mattress. It is made from memory foam, which is known for its pressure-relieving properties and ability to conform to the body's shape. The lavender infusion is intended to offer a calming and relaxing scent, potentially enhancing sleep quality.

The topper is ventilated, which means it has small holes or channels throughout to promote airflow and help regulate sleeping temperature. This can also contribute to the overall comfort by preventing overheating during the night.

The product is CertiPUR-US certified, ensuring that it is made without harmful chemicals and meets strict standards for content, emissions, and durability. The certification also indicates that the foam has been tested for low VOC (volatile organic compound) emissions for indoor air quality.

The topper appears to have a purple hue, which is likely indicative of the lavender infusion, and it sits atop a mattress that is part of a neatly arranged bed with pillows against a white brick wall backdrop. The room has a modern and minimalistic aesthetic, with natural light coming in from a window on the left.","Queen-sized lavender-infused memory foam mattress topper designed for enhanced comfort and relaxation, featuring ventilation for improved airflow and temperature regulation, and CertiPUR-US certified for safety and quality."
"CangLong Mid Century Modern Side Chair with Wood Legs for Kitchen, Living Dining Room, Set of 1, Black",https://m.media-amazon.com/images/I/31wnzq-TwKL._SS522_.jpg,Modern,,Black,https://www.amazon.com/dp/B08RTLBD1T,"['chair', 'mid-century modern', 'wood', 'black']","This is a CangLong Mid Century Modern Side Chair featuring a sleek black seat with an ergonomic design for comfort. The chair is supported by four sturdy wooden legs that display the natural wood grain, adding a warm contrast to the black seat. The legs are splayed slightly outward, which is characteristic of mid-century modern design, providing both style and stability. This chair is suitable for a variety of settings, including kitchens, dining rooms, or living spaces, and can complement a range of interior decor styles. It is sold as a set of one, allowing for individual purchase or the option to buy multiple to create a cohesive seating arrangement.","Mid-century modern side chair with a sleek black seat and natural wood legs, perfect for dining or living spaces."
"HomePop Metal Accent Table Triangle Base Round Mirror Top, Black, 18.24D x 24W x 18H in",https://m.media-amazon.com/images/I/41cG70UIWTL._SS522_.jpg,Modern,Glass,Black,https://www.amazon.com/dp/B08N5H868H,"['accent table', 'metal', 'mirror top', 'black', 'triangle base', 'round']","This is a modern accent table featuring a sleek, triangular metal base with a black finish that provides stability and an industrial aesthetic. The round tabletop is a mirror, adding a reflective and elegant touch to the piece. The dimensions of the table are approximately 18.24 inches in diameter and 24 inches in width, with a height of 18 inches, making it a versatile size for various uses such as a side table or decorative display stand. The combination of the mirrored surface and the geometric metal base makes this table a stylish addition to contemporary home decor.","Modern accent table with a mirrored round top and a sleek, triangular black metal base, perfect for contemporary decor."
MAEPA RV Shoe Storage for Bedside - 8 Extra Large Pockets - Dark Grey Rv Shoe Organizer with RV Shoe Pockets - Hanging Bedside Storage for RV Camper Bed Length35.4inches/2.95ft(Dark Grey),https://m.media-amazon.com/images/I/31bcwiowcBL._SS522_.jpg,,Oxford,Dark Gray,https://www.amazon.com/dp/B0C4PL1R3F,"['rv shoe storage', 'bedside organizer', 'hanging storage', 'dark grey', 'fabric', 'extra large pockets']","This is a dark grey RV shoe storage organizer designed to provide convenient hanging storage, ideal for use in an RV or camper. It features 8 extra-large pockets that offer ample space for organizing and storing shoes. The organizer is made to hang at the bedside, making it easy to access footwear. The total length of the unit is 35.4 inches, or approximately 2.95 feet, which allows it to accommodate various shoe sizes. The material appears to be a durable fabric, suitable for the interior of an RV, and the color is a versatile dark grey that should blend well with most interiors. The image also shows four metal hooks, which are likely used to hang the organizer securely in place.","Dark grey RV shoe storage organizer with 8 extra-large pockets for convenient bedside hanging, designed to fit various shoe sizes and blend seamlessly with most interiors."
"NearMoon Hand Towel Holder/Towel Ring - Bathroom Towel Bar, Premium Thicken Space Aluminum Towel Rack Wall Towel Hanger, Contemporary Style Bath Hardware Accessories Wall Mounted (Gold)",https://m.media-amazon.com/images/I/51eswTC1ufL._SS522_.jpg,,,,https://www.amazon.com/dp/B09PND1VQ5,"['towel holder', 'towel ring', 'bathroom', 'space aluminum', 'wall mounted', 'gold', 'contemporary']","This is a NearMoon Hand Towel Holder/Towel Ring, designed to be a functional and stylish accessory for a bathroom. The towel holder is made from premium thickened space aluminum, which provides durability and resistance to corrosion. The color of the towel rack is gold, giving it a contemporary and luxurious appearance.

The design features a straight bar with a rectangular profile, which allows for easy hanging and access to a hand towel. The wall-mounted fixture has a clean and modern aesthetic, with concealed mounting hardware that contributes to its sleek appearance. The holder is part of a bath hardware collection, suggesting that it could be coordinated with other accessories in the same style and finish for a cohesive bathroom design.","Gold NearMoon hand towel holder with a sleek, modern design, made from durable space aluminum, perfect for adding a touch of luxury to any bathroom."
"FLYJOE Narrow Side Table with PU Leather Magazine Holder Rustic Slim Little Thin Table for Living Room, Bedroom, Sofa, Set of 2, Black",https://m.media-amazon.com/images/I/41Hsse9SYsL._SS522_.jpg,Country Rustic,Engineered Wood,Black-set of 2,https://www.amazon.com/dp/B0CHYDTQKN,"['side table', 'narrow', 'magazine holder', 'pu leather', 'slim', 'set of 2', 'black']","This set includes two narrow side tables, each featuring a sleek black finish that complements a modern or contemporary decor style. The tables are designed with a slim profile, making them suitable for small spaces such as beside a sofa or bed. The tabletop provides a flat surface for placing drinks, books, or decorative items.

Below the tabletop, each side table incorporates a PU leather magazine holder, offering a convenient storage solution for magazines, newspapers, or small books. The magazine holder's black leather material adds a touch of sophistication and contrasts nicely with the metal frame of the table.

The tables are supported by a sturdy metal frame, ensuring stability and durability. The base is designed to slide under a couch or bed slightly, maximizing space efficiency. This set is ideal for those looking to add functional furniture with a minimal footprint to their living room or bedroom.","Set of 2 narrow side tables with black finish and built-in PU leather magazine holders, featuring a slim design ideal for small spaces and a sturdy metal frame for stability."
"HomePop Home Decor | K2380-YDQY-2 | Luxury Large Faux Leather Square Storage Ottoman | Ottoman with Storage for Living Room & Bedroom, Dark Brown",https://m.media-amazon.com/images/I/416lZwKs-SL._SS522_.jpg,Modern,Engineered Wood,Dark Gray,https://www.amazon.com/dp/B0B94T1TZ1,"['ottoman', 'faux leather', 'storage', 'square', 'dark brown']","This is a luxury large square storage ottoman featuring a faux leather upholstery in a dark brown color. The design includes a simple and elegant tufted top with visible stitching that adds texture and interest. The ottoman stands on four sturdy wooden legs, which provide stability and raise the piece slightly off the ground. The color and material give it a rich, classic look that would complement a variety of living room or bedroom decors. Additionally, this ottoman serves a dual purpose by offering ample storage space inside, making it a functional piece for organizing and decluttering your space.","Luxurious dark brown faux leather storage ottoman with a tufted top and wooden legs, offering ample interior space for organization."
Moroccan Leather Pouf Ottoman for Living Room - Round Leather Ottoman Pouf Cover - Unstuffed Pouf Ottoman Leather Foot Stool - Moroccan Pouf Ottoman - Moroccan Ottoman Pouf Leather (Brown),https://m.media-amazon.com/images/I/51UKACPPL9L._SS522_.jpg,"Modern, Boho, Chic",Leather,Brown,https://www.amazon.com/dp/B0CP45784G,"['ottoman', 'moroccan', 'leather', 'unstuffed', 'foot stool', 'brown']","This is a round Moroccan leather pouf ottoman cover in a rich brown color. It features an intricate, embossed mandala-like pattern in the center, surrounded by stitched segments that create a pleasing geometric design. The stitching is done in a contrasting light color, which accentuates the pouf's shape and design details. This unstuffed pouf cover can be filled to serve as a comfortable footstool or additional seating in a living room or any other space. The leather material adds a touch of luxury and durability, making it both a functional and decorative item. Please note that as an unstuffed cover, it will need to be filled before use.","Round Moroccan leather pouf ottoman cover in brown with an embossed mandala pattern and contrasting stitching, designed for use as a footstool or extra seating once filled."
"AnyDesign Christmas Welcome Doormat Decorative Xmas Holiday Front Floor Mat Indoor Outdoor Carpet Non-Slip Door Mat for Indoor Outdoor Home Office Kitchen Yard Garden Decoration, 17 x 29 Inch",https://m.media-amazon.com/images/I/51RpGVRAFcL._SS522_.jpg,,,,https://www.amazon.com/dp/B0BC85H7Y7,"['doormat', 'christmas', 'holiday', 'decorative', 'non-slip', 'indoor', 'outdoor', 'fabric']","This is a rectangular Christmas-themed welcome doormat measuring 17 x 29 inches. The mat features a natural beige background, likely made of a durable, coarse fabric such as coir or a synthetic equivalent to withstand foot traffic. The word ""Welcome"" is prominently displayed in large, black, cursive lettering across the center. Above the text, there is a festive design of mistletoe with green leaves and a red and white Santa hat, along with a red ornament decorated with white snowflake patterns. The border of the mat has a striped pattern alternating between red and a lighter beige, resembling a candy cane motif, which adds to the holiday spirit of the design. The mat is described as non-slip, suggesting it has a grippy material on the underside to keep it in place on various surfaces, making it suitable for both indoor and outdoor use. It is intended to serve as a decorative and functional piece for home, office, kitchen, yard, or garden settings during the Christmas season.","Festive Christmas-themed welcome doormat with mistletoe, Santa hat, and ornament design, featuring a natural beige background and candy cane striped border."
GXFC ZHAO Welcome Funny Door Mat Shoes and Bras Off Please Personalized Doormat with Anti-Slip Rubber Back (23.6 X 15.7 inch) Prank Gift Home Decor Area Rugs for The Entrance Way Indoor Novelty Mats,https://m.media-amazon.com/images/I/51z8ko3rsiL._SS522_.jpg,Modern,Rubber,"Colorful,Funny,Novelty,Personalized",https://www.amazon.com/dp/B07X61R7N8,"['door mat', 'anti-slip', 'rubber back', 'novelty', 'brown']","This is a novelty doormat designed to be placed at the entrance of a home. The doormat measures 23.6 by 15.7 inches and features a humorous message that reads ""SHOES & BRAS OFF PLEASE"" in bold, black lettering against a brown background, which gives it a playful and inviting appearance. The design includes decorative corner accents that resemble arrow points, adding a touch of whimsy to the overall look.

The mat is made with a durable material suitable for indoor use and is equipped with an anti-slip rubber backing to ensure safety and prevent it from sliding around. This doormat serves as both a functional item for keeping floors clean and a prank gift or home decor piece that can add a lighthearted touch to the entrance of someone's home.","Humorous indoor doormat with ""SHOES & BRAS OFF PLEASE"" message, featuring anti-slip backing and decorative corner accents."
