title,primary_image,style,material,color,url,keywords,img_description,caption
"GOYMFK 1pc Free Standing Shoe Rack, Multi-layer Metal Shoe Cap Rack With 8 Double Hooks For Living Room, Bathroom, Hallway",https://m.media-amazon.com/images/I/416WaLx10jL._SS522_.jpg,Modern,Metal,White,https://www.amazon.com/dp/B0CJHKVG6P,"['shoe rack', 'free standing', 'multi-layer', 'metal', 'with hooks', 'white']","This is a free-standing shoe rack featuring a multi-layer design, constructed from metal for durability. The rack has a sleek white finish that gives it a clean, modern look, suitable for various home decors. It includes multiple tiers dedicated to shoe storage, allowing for an organized display of footwear. Additionally, the rack is equipped with 8 double hooks, providing ample space for hanging items such as hats, scarves, and bags. This functional piece is versatile enough to be used in a living room, bathroom, or hallway, offering both storage and hanging solutions in a compact form.","White metal free-standing shoe rack with multiple tiers for shoes and 8 double hooks for accessories, suitable for various home settings."
"subrtex Leather ding Room, Dining Chairs Set of 2, Black",https://m.media-amazon.com/images/I/31SejUEWY7L._SS522_.jpg,Black Rubber Wood,Sponge,Black,https://www.amazon.com/dp/B0B66QHB23,"['dining chairs', 'set of 2', 'leather', 'black']","This image features a set of two black dining chairs. The chairs are upholstered in a leather-like material, giving them a sleek and sophisticated appearance. They have a high back design with subtle stitching details that create vertical lines, adding to their elegance. The legs of the chairs are straight and also finished in black, which complements the overall design. These chairs would be suitable for a modern or contemporary dining room setting.",Set of 2 sleek black faux leather dining chairs with vertical stitching details.
"Plant Repotting Mat MUYETOL Waterproof Transplanting Mat Indoor 26.8"" x 26.8"" Portable Square Foldable Easy to Clean Gardening Work Mat Soil Changing Mat Succulent Plant Transplanting Mat Garden Gifts",https://m.media-amazon.com/images/I/41RgefVq70L._SS522_.jpg,Modern,Polyethylene,Green,https://www.amazon.com/dp/B0BXRTWLYK,"['plant repotting mat', 'waterproof', 'portable', 'foldable', 'easy to clean', 'gardening work mat', 'soil changing mat', 'succulent transplanting mat', 'green']","This is a square plant repotting mat designed for indoor gardening tasks such as transplanting or changing soil for plants. It measures 26.8 inches by 26.8 inches, providing ample space for gardening activities. The mat is made from a waterproof material in a vibrant green color, which helps to contain soil and water spills, making the cleanup process easier. The edges of the mat are raised with built-in corner loops, which can be used to secure the mat in a folded position or to hang it for storage. The mat's surface is smooth, facilitating easy cleaning. This mat is a practical accessory for gardening enthusiasts, providing a convenient and tidy workspace for handling plants, especially succulents. It's also portable, allowing gardeners to fold it up and take it with them as needed, and it can serve as a thoughtful gift for those who enjoy gardening.",Waterproof green square plant repotting mat
"Pickleball Doormat, Welcome Doormat Absorbent Non-Slip Floor Mat Bathroom Mat 16x24",https://m.media-amazon.com/images/I/61vz1IglerL._SS522_.jpg,Modern,Rubber,A5589,https://www.amazon.com/dp/B0C1MRB2M8,"['doormat', 'absorbent', 'non-slip', 'brown']","This is a rectangular doormat featuring a playful design, ideal for pickleball enthusiasts. The mat has a natural coir fiber construction, known for its durability and excellent scraping properties to remove dirt and debris from shoes. The background color is the natural brown of coir, providing a rustic and welcoming look.

The doormat is adorned with the phrase ""it's a good day to play PICKLEBALL"" in bold, black lettering, which stands out against the coir material for easy readability. Below the text, there is a graphic of two pickleball paddles crossed over a pickleball, adding a thematic touch to the design.

Measuring approximately 16x24 inches, this doormat is a suitable size for most entryways. It is described as absorbent, which suggests it can help in keeping moisture from shoes from entering the home. The non-slip feature implies that the mat has a backing that prevents it from sliding around, providing safety and stability on various floor surfaces. It is also mentioned as a floor mat for the bathroom, indicating it could be versatile for indoor use as well.",Pickleball-themed coir doormat with playful design
"JOIN IRON Foldable TV Trays for Eating Set of 4 with Stand,Folding TV/Snack Tray Table Set,Folding TV Dinner Tables for Small Space,(Grey)",https://m.media-amazon.com/images/I/41p4d4VJnNL._SS522_.jpg,X Classic Style,Iron,Grey Set of 4,https://www.amazon.com/dp/B0CG1N9QRC,"['tv tray table set', 'foldable', 'iron', 'grey']","This image showcases a set of two foldable TV trays, which are part of a set of four. The trays are designed for eating or as snack tables and are ideal for small spaces due to their foldable nature. Each tray features a grey wood grain finish on the tabletop, providing a modern and neutral aesthetic that can complement various interior decor styles. The frames and legs of the trays are made of black iron, offering sturdy support and a sleek contrast to the grey tabletops. The X-shaped leg design allows for easy folding and storage, and the overall minimalist design ensures that the trays can be conveniently tucked away when not in use. The set includes a matching stand to keep the trays organized and accessible.","Set of two foldable TV trays with grey wood grain finish and black iron legs, including a matching stand for easy storage."
"LOVMOR 30'' Bathroom Vanity Sink Base Cabine, Storage Cabinet with 3-Drawers on The Left, Suitable for Bathrooms, Kitchens, Laundry Rooms and Other Places.",https://m.media-amazon.com/images/I/41zMuj2wvvL._SS522_.jpg,"Soft-closing Switch, Soft-closing Switch",Wood,Cameo Scotch,https://www.amazon.com/dp/B0C9WYYFLB,"['bathroom vanity', 'sink base cabinet', 'storage', '3-drawers', 'wood', 'brown']","This is a LOVMOR 30-inch bathroom vanity sink base cabinet featuring a rich, wood-toned finish. The cabinet is designed with three drawers on the left side, providing ample storage space for bathroom essentials, personal items, or cleaning supplies. The drawers appear to have recessed panel fronts and sleek handles, which contribute to the cabinet's classic and elegant look. The right side of the cabinet has a large door, likely concealing additional storage space. This versatile cabinet is not only suitable for bathrooms but can also be used in kitchens, laundry rooms, and other areas of the home where extra storage is needed. The overall design suggests a traditional style that would complement a variety of interior decors.",Traditional LOVMOR 30-inch bathroom vanity sink base cabinet with a rich wood finish and ample storage.
"Folews Bathroom Organizer Over The Toilet Storage, 4-Tier Bathroom Shelves Over Toilet Shelf Above Toilet Storage Rack Freestanding Bathroom Space Saver Adjustable Shelves and Baskets, Black",https://m.media-amazon.com/images/I/41ixgM73DgL._SS522_.jpg,Classic,,,https://www.amazon.com/dp/B09NZY3R1T,"['over-the-toilet storage', '4-tier', 'adjustable shelves', 'freestanding', 'bathroom space saver', 'metal', 'black']","This is a 4-tier bathroom organizer designed to fit over a standard toilet, providing a space-saving storage solution. The unit features a sturdy metal frame with a black finish that offers both durability and a sleek, modern aesthetic. The organizer includes four shelves, with the two upper shelves being flat and ideal for storing items such as towels, toiletries, or decorative objects. The third shelf includes a woven basket, adding a touch of rustic charm and providing a convenient spot for smaller items that might otherwise fall through a wire shelf. The bottom shelf is also flat and can be used for additional storage.

The design of this over-the-toilet storage rack is freestanding, meaning it does not require wall mounting, which makes it a versatile choice for renters or those who prefer not to drill into walls. The shelves are adjustable, allowing for customization based on the height of the items being stored. This feature also makes it easy to accommodate taller items if necessary. The overall structure is designed to maximize the use of vertical space in a bathroom, making it a practical addition for organizing and decluttering.","Modern 4-tier black metal bathroom organizer with adjustable shelves and a woven basket, designed to fit over a standard toilet for space-saving storage."
"GOYMFK 1pc Free Standing Shoe Rack, Multi-layer Metal Shoe Cap Rack With 8 Double Hooks For Living Room, Bathroom, Hallway",https://m.media-amazon.com/images/I/416WaLx10jL._SS522_.jpg,Modern,Metal,White,https://www.amazon.com/dp/B0CJHKVG6P,"['shoe rack', 'free standing', 'multi-layer', 'metal', 'white']","This is a free-standing shoe rack featuring a multi-layer design, ideal for organizing footwear in a living room, bathroom, or hallway. The rack is constructed from metal, providing a sturdy and durable frame. It is finished in a clean white color, which gives it a modern and versatile look that can blend with various interior decors.

The rack includes several horizontal tiers, each designed to hold multiple pairs of shoes, making it a space-efficient solution for shoe storage. Additionally, the top part of the rack is equipped with 8 double hooks, which can be used to hang items such as hats, scarves, or bags. This added functionality makes the rack a multifunctional piece of furniture, not only serving as shoe storage but also as a convenient spot to hang various accessories.

The overall design is sleek and minimalistic, with an emphasis on functionality and space-saving. It would be a practical addition to any home, helping to keep shoes and accessories neatly organized and easily accessible.","White metal free-standing shoe rack with multiple tiers for shoes and 8 double hooks for accessories, offering a sleek and space-efficient storage solution."
"subrtex Leather ding Room, Dining Chairs Set of 2, Black",https://m.media-amazon.com/images/I/31SejUEWY7L._SS522_.jpg,Black Rubber Wood,Sponge,Black,https://www.amazon.com/dp/B0B66QHB23,"['dining chairs', 'set of 2', 'leather', 'black']","This image features a set of two contemporary dining chairs. The chairs are upholstered in black faux leather, which gives them a sleek and modern appearance. The design includes a high backrest with subtle stitching details that create vertical lines, adding an element of texture and sophistication. The legs of the chairs are also black, maintaining a uniform and elegant look. These chairs would complement a modern dining room setting with their clean lines and minimalist style.",Set of 2 contemporary black faux leather dining chairs with vertical stitching details.
"Plant Repotting Mat MUYETOL Waterproof Transplanting Mat Indoor 26.8"" x 26.8"" Portable Square Foldable Easy to Clean Gardening Work Mat Soil Changing Mat Succulent Plant Transplanting Mat Garden Gifts",https://m.media-amazon.com/images/I/41RgefVq70L._SS522_.jpg,Modern,Polyethylene,Green,https://www.amazon.com/dp/B0BXRTWLYK,"['plant repotting mat', 'waterproof', 'portable', 'foldable', 'green']","This is a square plant repotting mat designed for indoor gardening tasks such as transplanting or changing the soil of plants. The mat measures 26.8 inches by 26.8 inches and is made from a waterproof material, which appears to be a durable, easy-to-clean fabric in a vibrant green color. The edges of the mat are raised with integrated corner buttons to help contain soil and water, making the repotting process neater. The mat is foldable and portable, making it convenient for storage and use in various locations. It is suitable for a range of gardening activities, particularly for working with succulents and other small plants. This mat could be a practical gift for gardening enthusiasts.","Square, waterproof, green plant repotting mat"
"Pickleball Doormat, Welcome Doormat Absorbent Non-Slip Floor Mat Bathroom Mat 16x24",https://m.media-amazon.com/images/I/61vz1IglerL._SS522_.jpg,Modern,Rubber,A5589,https://www.amazon.com/dp/B0C1MRB2M8,"['doormat', 'absorbent', 'non-slip', 'brown']","This is a rectangular doormat featuring a playful design that caters to pickleball enthusiasts. The mat's primary color is a natural coir brown, providing a neutral and earthy tone that complements various entryway decors. Emblazoned across the mat in bold, black lettering is the phrase ""it's a good day to play PICKLEBALL,"" with the word ""PICKLEBALL"" being prominently displayed in larger font for emphasis. Below the text, there is a graphic of two crossed pickleball paddles in black, which adds a thematic touch to the design.

The doormat appears to be made of coir, a durable and absorbent material derived from coconut husks, which is excellent for scraping shoes clean. The size is specified as 16x24 inches, making it a suitable size for a standard doorway. The description mentions that it is non-slip, suggesting that the underside of the mat has a gripping feature to keep it in place on various floor surfaces. Additionally, it is described as absorbent, indicating that it can effectively capture moisture and prevent it from being tracked indoors. The mat could also be used in a bathroom setting due to its absorbent qualities.","Rectangular coir doormat with ""it's a good day to play PICKLEBALL"" message"
"JOIN IRON Foldable TV Trays for Eating Set of 4 with Stand,Folding TV/Snack Tray Table Set,Folding TV Dinner Tables for Small Space,(Grey)",https://m.media-amazon.com/images/I/41p4d4VJnNL._SS522_.jpg,X Classic Style,Iron,Grey Set of 4,https://www.amazon.com/dp/B0CG1N9QRC,"['tv tray table set', 'foldable', 'metal', 'grey']","This image showcases a set of four foldable TV trays with a stand, designed for eating or as snack tray tables. The tables are finished in a grey tone, which gives them a modern and neutral look that can easily blend with various interior decors. Each tray features a rectangular top with a wood grain texture, supported by a sturdy iron frame with an A-shaped folding mechanism, allowing for easy storage and portability. The stand included in the set provides a convenient way to keep the tables organized and readily accessible when not in use. These tables are practical for small spaces, offering a temporary dining surface or a place to hold snacks during TV viewing or other activities.","Set of four foldable TV trays with stand, featuring a modern grey wood grain finish and sturdy iron frame, ideal for dining or snacks in small spaces."
"LOVMOR 30'' Bathroom Vanity Sink Base Cabine, Storage Cabinet with 3-Drawers on The Left, Suitable for Bathrooms, Kitchens, Laundry Rooms and Other Places.",https://m.media-amazon.com/images/I/41zMuj2wvvL._SS522_.jpg,"Soft-closing Switch, Soft-closing Switch",Wood,Cameo Scotch,https://www.amazon.com/dp/B0C9WYYFLB,"['bathroom vanity', 'sink base cabinet', 'storage', '3-drawers', 'wood', 'brown']","This is a LOVMOR 30'' Bathroom Vanity Sink Base Cabinet featuring a classic design with a rich brown finish. The cabinet is constructed with three drawers on the left side, offering ample storage for bathroom essentials, personal items, or cleaning supplies. The drawers appear to have recessed panel fronts and sleek handles, which contribute to the cabinet's traditional aesthetic. The right side of the cabinet has two doors with matching recessed panels and handles, concealing additional storage space. This versatile cabinet is suitable not only for bathrooms but also for kitchens, laundry rooms, and other areas where extra storage is needed. The overall design suggests durability and functionality, making it a practical addition to any home.","LOVMOR 30'' Bathroom Vanity Sink Base Cabinet with a classic brown finish, featuring three drawers and two doors for ample storage, suitable for bathrooms, kitchens, and laundry rooms."
"Folews Bathroom Organizer Over The Toilet Storage, 4-Tier Bathroom Shelves Over Toilet Shelf Above Toilet Storage Rack Freestanding Bathroom Space Saver Adjustable Shelves and Baskets, Black",https://m.media-amazon.com/images/I/41ixgM73DgL._SS522_.jpg,Classic,,,https://www.amazon.com/dp/B09NZY3R1T,"['over-the-toilet storage', '4-tier', 'adjustable shelves', 'baskets', 'freestanding', 'bathroom space saver', 'black', 'metal']","This is a 4-tier bathroom organizer designed to fit over a standard toilet, providing a space-saving storage solution. The unit is constructed with a sturdy metal frame in a black finish, which offers both durability and a sleek, modern look. The design includes four shelves that provide ample space for storing bathroom essentials such as towels, toiletries, and cleaning supplies. The shelves are adjustable, allowing for customization based on the height of the items being stored. Additionally, the organizer features baskets that can be used to hold smaller items, ensuring they are neatly contained and easily accessible. The freestanding design means it can be placed over the toilet without the need for wall mounting, making it a versatile and convenient addition to any bathroom.","Black metal 4-tier bathroom organizer with adjustable shelves and baskets, designed to fit over a standard toilet for space-saving storage."
"Lerliuo Nightstand, Side Table, Industrial Bedside Table with 2 Drawers and Open Shelf, Grey Night Stand, End Table with Steel Frame for Bedroom, Dorm, Gray/Black 23.6''H",https://m.media-amazon.com/images/I/41IzLmM91FL._SS522_.jpg,Classic,Stone,Grey,https://www.amazon.com/dp/B09PTXGFZD,"['nightstand', 'side table', 'bedside table', 'industrial', '2 drawers', 'open shelf', 'steel frame', 'grey', 'black', '23.6 inches height']","This is a Lerliuo nightstand featuring an industrial design. The bedside table has a sturdy steel frame in black, providing a strong contrast to the grey wood-look panels that make up the drawers and tabletop. It includes two drawers with black round knobs for easy opening, offering ample storage space for personal items. Above the drawers, there is an open shelf that provides additional space for books or decorative items. The overall dimensions are approximately 23.6 inches in height, making it suitable for most bed heights. The combination of grey and black gives this nightstand a modern and versatile look that can fit into various bedroom decors, from contemporary to rustic.","Industrial-style Lerliuo nightstand with a black steel frame and grey wood-look panels, featuring two drawers and an open shelf."
Boss Office Products Any Task Mid-Back Task Chair with Loop Arms in Grey,https://m.media-amazon.com/images/I/41rMElFrXBL._SS522_.jpg,Loop Arms,Foam,Grey,https://www.amazon.com/dp/B002FL3LL2,"['office chair', 'mid-back', 'task chair', 'loop arms', 'grey', 'fabric', 'swivel', 'adjustable height']","This is a mid-back task chair designed for office use, featuring loop arms for added comfort. The chair is upholstered in a grey fabric that offers a neutral look, suitable for various office decors. Its backrest and seat are contoured to provide support and comfort during extended periods of sitting. The chair includes a pneumatic height adjustment lever, allowing the user to modify the seat height to their preference. The five-star base with caster wheels ensures easy mobility across different floor surfaces. The loop arms are made of durable black plastic, which complements the chair's overall design and provides a place to rest your arms while working.",Mid-back grey fabric office task chair with loop arms and pneumatic height adjustment.
"Kingston Brass BA1752BB Heritage 18-Inch Towel-Bar, Brushed Brass",https://m.media-amazon.com/images/I/21opezr3bUL._SS522_.jpg,Traditional,Brass,Brushed Brass,https://www.amazon.com/dp/B0B9PLM9P8,"['towel bar', 'brass', 'brushed brass', '18-inch', 'wall mounted']","This is the Kingston Brass BA1752BB Heritage 18-Inch Towel Bar in a brushed brass finish. The towel bar features a classic design with two ornate mounting brackets that provide a touch of elegance. The bar itself is a straight, cylindrical rod, perfect for hanging towels. The brushed brass finish gives it a warm, golden tone that exudes a vintage charm, making it suitable for traditional bathroom decors. The solid brass construction ensures durability and long-lasting use.",Classic 18-inch Kingston Brass towel bar
Chief Mfg.Swing-Arm Wall Mount Hardware Mount Black (TS218SU),https://m.media-amazon.com/images/I/41HxUoRXloL._SS522_.jpg,,,Black,https://www.amazon.com/dp/B007E40Z5K,"['wall mount', 'swing-arm', 'hardware mount', 'black', 'metal']","This image shows the Chief Mfg. Swing-Arm Wall Mount, model TS218SU, which is a hardware mount designed for televisions or monitors. The mount is black in color and features a robust, articulated swing-arm design that allows for flexible positioning of the screen. The arm can extend, tilt, and swivel, providing a range of motion for optimal viewing angles. The wall plate and the mounting bracket are designed with multiple holes for secure attachment to the wall and the device, respectively. The construction appears to be made of durable metal, suitable for supporting the weight and size of compatible screens as specified by the manufacturer.",Black articulated swing-arm wall mount for TVs or monitors
"DOMYDEVM Black End Table, Nightstand with Charging Station, Bedside Table with Drawer, Small Side Table with USB Ports and Outlets for Bedroom",https://m.media-amazon.com/images/I/41YrmN-yOEL._SS522_.jpg,Modern,Metal,Black,https://www.amazon.com/dp/B0BFJGDHVF,"['end table', 'nightstand', 'charging station', 'bedside table', 'drawer', 'side table', 'usb ports', 'outlets', 'black', 'wood', 'metal mesh']","This is a black end table or nightstand featuring a built-in charging station. It is designed with a compact and functional structure, ideal for a bedroom setting. The table includes a top surface suitable for holding small items like a plant or a phone, as depicted in the image. Below the top, there is a drawer with a metal mesh front, providing storage while adding an industrial touch to the design. The drawer likely conceals the charging station, which includes USB ports and outlets for convenient device charging. Beneath the drawer, there is an open shelf, perfect for storing books or displaying decorative items. The table is supported by four sturdy legs, and the overall aesthetic is modern and minimalist, making it versatile for various decor styles. The inclusion of a charging station makes it a practical piece of furniture for the modern, tech-savvy user.","Modern black end table with built-in charging station, featuring a drawer and an open shelf, ideal for bedroom use."
"LASCO 35-5019 Hallmack Style 24-Inch Towel Bar Accessory, All Metal Construction, Chrome Plated Finish",https://m.media-amazon.com/images/I/31rrpY5EJOL._SS522_.jpg,,Metal,Chrome,https://www.amazon.com/dp/B00N2OZU42,"['towel bar', 'metal', 'chrome', '24-inch']","This is a 24-inch towel bar accessory designed in the Hallmack style. It features an all-metal construction with a chrome-plated finish, giving it a sleek and shiny appearance. The bar is supported by two end brackets that are also chrome-plated, and it is designed to be mounted on a wall to hold towels. Its polished surface reflects light and is likely to complement a modern or contemporary bathroom decor.","Sleek 24-inch chrome-plated Hallmack style towel bar with polished finish, designed for modern bathroom decors."
"Table-Mate II PRO TV Tray Table - Folding Table with Cup Holder and Tablet Slot- Couch Desk for Working from Home, TV Trays for Eating, Portable and Adjustable TV Table, Slate Gray",https://m.media-amazon.com/images/I/31cbTc2VhaL._SS522_.jpg,Cupholder+Tablet Slot+Side Storage,,Slate Gray,https://www.amazon.com/dp/B093KMM9D3,"['tv tray table', 'folding table', 'cup holder', 'tablet slot', 'couch desk', 'portable', 'adjustable', 'slate gray', 'metal']","This is the Table-Mate II PRO TV Tray Table, a versatile and functional piece designed for convenience and adaptability. The table features a slate gray color, giving it a modern and neutral look that can easily blend with various interior decors. It is constructed with a folding design, allowing for easy storage and portability.

The tabletop includes a textured surface to prevent items from slipping and has a built-in cup holder on one side, ensuring that drinks can be securely placed without the risk of spills. Additionally, there is a tablet slot, which provides a convenient space for electronic devices, making it ideal for working from home or enjoying media.

The table's height and angle are adjustable, offering flexibility to accommodate different seating arrangements and personal preferences. The L-shaped legs are designed to slide under couches or chairs, making it perfect for use while sitting on a sofa or bed.

Constructed from durable materials, this TV tray table is suitable for various activities, such as eating meals, working on a laptop, or holding snacks during movie nights. Its compact and lightweight design makes it an excellent choice for small living spaces or for those who need an easily movable work surface.","Table-Mate II PRO TV Tray Table with built-in cup holder and tablet slot, adjustable height and angle, in slate gray, ideal for versatile use in small living spaces."
