title,primary_image,style,material,color,url,keywords,img_description,caption
"LEASYLIFE Black Metal Trash can,10L/2.6GAL,Open Top Wastebasket Bin,Garbage Can for Bathroom,Living Room,Office,Kitchen,Bedroom,Hotel (Black)",https://m.media-amazon.com/images/I/31NobyGCHQL._SS522_.jpg,,,,https://www.amazon.com/dp/B09TKH23M1,"['trash can', 'metal', 'open top', 'black', '10l', '2.6gal', 'wastebasket', 'garbage can']","This is a black metal trash can with a capacity of 10 liters (2.6 gallons). It features an open-top design for easy waste disposal. The cylindrical shape and sleek black finish give it a modern and minimalist appearance, making it suitable for various settings such as bathrooms, living rooms, offices, kitchens, bedrooms, and hotels. The trash can's smooth surface and simple lines would complement contemporary decor styles.","Modern 10-liter black metal trash can with an open-top design, suitable for various indoor settings with its sleek and minimalist appearance."
"Solid Wood Wine Cabinet, bar Rack - Home Wood Furniture",https://m.media-amazon.com/images/I/31vp24lBBwL._SS522_.jpg,wood,Wood,White/Pine Oak,https://www.amazon.com/dp/B0BW4WN2NL,"['wine cabinet', 'solid wood', 'scandinavian', 'white', 'natural wood']","This is a solid wood wine cabinet featuring a contemporary design. The main structure appears to be finished in a light, possibly white or off-white hue, which contrasts nicely with the natural wood tone of the wine racks and drawer front. The cabinet is divided into two sections: on the left, there are several rows of horizontal wine racks capable of holding multiple bottles, while the right side offers a combination of open shelving and a drawer for additional storage. The cabinet is supported by four angled legs, which give it a modern and slightly Scandinavian aesthetic. The use of solid wood suggests durability and quality, making it a functional yet stylish piece for storing wine and related accessories.","Contemporary solid wood wine cabinet with contrasting white and natural wood finishes, featuring horizontal wine racks, open shelving, a storage drawer, and angled legs for a modern Scandinavian look."
"Black Leather Office Chair Mid Back Leather Desk Chair Modern Excutive Office Chair with Arms and Wheels for Home Office, by Artswish",https://m.media-amazon.com/images/I/317sVlhzMLL._SS522_.jpg,With arms,Sponge,Black,https://www.amazon.com/dp/B0BVQSPCCF,"['office chair', 'mid back', 'leather', 'black', 'with arms', 'with wheels', 'modern']","This is a mid-back leather office chair in black, designed for comfort and style in a home office setting. The chair features a generously padded seat and backrest, upholstered in a sleek black leather material that gives it a professional and modern appearance. The armrests are integrated into the design, providing support without compromising on style. It is mounted on a sturdy five-point base with dual-wheel casters for easy mobility, and the height can be adjusted to suit various desk heights and user preferences. The chair's silhouette is streamlined, making it a suitable match for a range of interior decors, particularly in contemporary and executive office spaces.","Mid-back black leather office chair with padded seat and backrest, integrated armrests, adjustable height, and a five-point base with casters for mobility, suitable for contemporary home offices."
"Convenience Concepts Tucson Flip Top End Table with Charging Station and Shelf, 23.75""L x 11.25""W x 24""H, Charcoal Gray/Black",https://m.media-amazon.com/images/I/41NVHRlEb2L._SS522_.jpg,Modern,"Manufactured Wood,MDF",Charcoal Gray / Black,https://www.amazon.com/dp/B08B45QFG7,"['end table', 'charging station', 'flip top', 'shelf', 'charcoal gray', 'black', 'wood', 'metal']","This is a Convenience Concepts Tucson Flip Top End Table featuring a built-in charging station. The table measures 23.75 inches in length, 11.25 inches in width, and 24 inches in height. It has a sleek and modern design with a charcoal gray finish on the tabletop and shelf, complemented by a black frame. The frame showcases an X-shaped design on the sides, adding both stability and a decorative touch. The flip top reveals a convenient charging station with ample space for powering electronic devices, making it a practical addition to any living space. The lower shelf provides additional storage or display space. This end table combines functionality with contemporary style, suitable for a variety of home decors.","Modern charcoal gray end table with built-in charging station, featuring a flip top and additional lower shelf for storage, set in a black frame with an X-shaped design."
"3-Tier Kitchen Storage Cart with Handle, Multifunction Utility Rolling Cart Kitchen Storage Organizer, Mobile Shelving Unit Cart with Lockable Wheels for Office, Living Room, Kitchen - Black",https://m.media-amazon.com/images/I/41yBXlrog-L._SS522_.jpg,,Plastic,Black,https://www.amazon.com/dp/B0CMX4CMMS,"['kitchen cart', '3-tier', 'rolling', 'storage organizer', 'mobile shelving', 'lockable wheels', 'black']","This is a 3-tier kitchen storage cart featuring a sleek black finish. It is designed as a multifunctional utility rolling cart that can be used for organizing various items. The cart is equipped with a convenient handle at the top, making it easy to maneuver around your space. Each tier provides ample storage space, suitable for holding kitchen supplies, office materials, or items for the living room.

The cart is constructed with a sturdy frame and includes lockable wheels at the base, ensuring both mobility and stability when needed. The lockable feature of the wheels allows the cart to stay in place without unwanted rolling. The open shelving design allows for easy access and visibility of the items stored on each level.

Overall, this kitchen storage organizer is a practical addition to any home or office, offering a space-saving solution and the versatility to be used in various settings.","3-tier black kitchen storage cart with lockable wheels and a handle for easy maneuverability, ideal for organizing supplies in various settings."
"Mimoglad Office Chair, High Back Ergonomic Desk Chair with Adjustable Lumbar Support and Headrest, Swivel Task Chair with flip-up Armrests for Guitar Playing, 5 Years Warranty",https://m.media-amazon.com/images/I/414jZL4tnaL._SS522_.jpg,With arms,Foam,Beige,https://www.amazon.com/dp/B0C2YQZS69,"['office chair', 'high back', 'ergonomic', 'adjustable lumbar support', 'headrest', 'swivel', 'flip-up armrests', 'mesh', 'wheeled base']","This Mimoglad Office Chair is designed with ergonomics in mind to provide comfort during long working hours. It features a high back that supports the natural curvature of the spine, and it is equipped with an adjustable lumbar support to reduce back strain. The headrest at the top of the chair offers additional support for the neck, making it ideal for extended periods of sitting.

The chair is upholstered in a light green fabric that is both stylish and breathable, which is especially beneficial for maintaining comfort and air circulation. Its armrests are designed to flip up, allowing the user to play guitar or perform other activities where arm movement is essential without obstruction.

The chair's frame and base are finished in white, giving it a clean and modern appearance that can easily blend with various office decors. It stands on a five-point caster wheelbase for easy mobility and stability. The height of the chair can be adjusted to accommodate different desk heights and user preferences.

With a 5-year warranty, this chair promises durability and long-term service, ensuring that it is a sound investment for any office or home workspace.","Ergonomic office chair with adjustable lumbar support and flip-up armrests, upholstered in light green fabric with a white frame, featuring a high back and neck-supporting headrest."
"Let the Adventure Begin Door Mat 17""x30"" Decorative Farmhouse Home Campsite Travel Trailer Cabin Indoor Outdoor Front Porch Door Mat,Funny Camping Welcome Mat Decor,Gifts for Campers Camping Lovers",https://m.media-amazon.com/images/I/51Zv2zReYCL._SS522_.jpg,Farmhouse,Rubber,,https://www.amazon.com/dp/B0C8SJSZYS,"['door mat', 'decorative', 'farmhouse', 'indoor', 'outdoor', 'striped', 'text']","This is a decorative door mat featuring an inspirational phrase ""Let the adventure begin"" in a stylized font, accented with arrow and heart designs. The mat measures 17 inches by 30 inches, making it a suitable size for a front porch or entryway. The design incorporates a farmhouse aesthetic with horizontal stripes in a palette of neutral and blue tones, which could complement a variety of home decors, particularly those with a rustic or outdoor theme.

The mat is intended for both indoor and outdoor use, making it versatile for different settings such as a home, campsite, travel trailer, or cabin. Its design and message make it an appealing accessory for those who enjoy camping or traveling, and it could serve as a charming welcome to guests. Additionally, it could be considered as a thoughtful gift for campers or individuals who love the adventure lifestyle.","Decorative ""Let the adventure begin"" door mat with a farmhouse style, perfect for outdoor enthusiasts and travelers."
"1 Pack Adjustable Height Center Support Leg for Bed Frame,Bed Center Slat Heavy Extra Durable Steel Support Legs | Suitable for Bed Frame,Cabinet and Wooden Furniture",https://m.media-amazon.com/images/I/41ci+bNjHPL._SS522_.jpg,Straight,,1 Pack,https://www.amazon.com/dp/B09BVQZM3S,"['bed frame support leg', 'adjustable height', 'steel', 'durable']","The image displays an adjustable height center support leg designed for bed frames and other types of wooden furniture. This support leg is made from heavy-duty steel, ensuring durability and extra support. It features a broad, flat top bracket that can be mounted directly to the center slat of a bed frame or the underside of other furniture pieces for additional stability.

The leg itself is telescopic, allowing for height adjustments to fit various furniture heights. This adjustability is achieved through a threaded rod mechanism that can be extended or retracted and then secured in place. At the base of the leg is a wide, circular foot with a black, non-marring pad to prevent damage to flooring and to enhance stability.

The support leg is finished in a metallic color, likely chrome or stainless steel, which gives it a sleek, modern appearance. This item is typically used to prevent sagging in the middle of a bed or to reinforce other large furniture items that require additional support in the center. The image also shows a close-up of the adjustment mechanism and the base, providing a clear view of the product's components.","Adjustable height center support leg for bed frames and furniture, made from heavy-duty steel with a telescopic design for stability and floor protection."
Stylo Culture Traditional Cotton Patchwork Embroidered Ottoman Stool Pouf Cover Black Floral Seat 45 cm Seating Pouffe Case Bean Bag Home Decor,https://m.media-amazon.com/images/I/61-CBGZCsJL._SS522_.jpg,,Cotton,Black,https://www.amazon.com/dp/B0722V6KMX,,,
"Suptsifira Shoe storage box, 24 Packs Shoe Boxes Clear Plastic Stackable,Shoes Sneaker Container Storage Box, XL Shoe Boxes with Lids for Closet, Storage and Display(White)",https://m.media-amazon.com/images/I/51enKGSxK8L._SS522_.jpg,,Porcelain,White,https://www.amazon.com/dp/B0BZ85JVBN,,,
"Wellynap Computer Desk,31.5 inches Folding Table Computer Desk for Small Spaces Home Office, Gaming Desk Computer Table, No Install Needed, Modern Simple Style Laptop Table, Teak & Black",https://m.media-amazon.com/images/I/51pO-N48teL._SS522_.jpg,Modern,Wood,Teak & Black,https://www.amazon.com/dp/B0CFL2G31X,,,
"Smlttel Gold Clothing Rack With Shelves, Gold Coat Rack Freestanding with Marble Base, Coat Hanger Rack,Hat Tree Coat Rack Standing Clothes Racks for BoutiqueBedroom",https://m.media-amazon.com/images/I/41aRwocdfAL._SS522_.jpg,Modern,Metal,C gold,https://www.amazon.com/dp/B0B93TC1Z8,,,
"Franklin Sports NFL Storage Ottoman + Container - NFL Football Team Folding Organizer Bins - NFL Office, Bedroom + Living Room Dcor - 14"" x 14""",https://m.media-amazon.com/images/I/31ptZB+wS-L._SS522_.jpg,Team Licensed Storage Ottoman with Detachable Lid,Fabric,Team Color,https://www.amazon.com/dp/B0787KRJ8S,,,
"Honey-Can-Do 3-Tier Nesting Bamboo Shoe Rack SHO-09492 Shoe Rack, Wooden Shoe Rack, 3 Tier Shoe Rack, Stackable Shoe Rack, Bamboo Shoe Rack,60 lbs",https://m.media-amazon.com/images/I/51GnnjKaVsL._SS522_.jpg,Shoe,,,https://www.amazon.com/dp/B08WRLKR7T,,,
"Furnistar 15.9 inch Modern Round Velvet Storage Ottoman with Gold Plating Base, Upholstered Footrest Makeup Stool for Bedroom Living Room, Grey(Ship from US)",https://m.media-amazon.com/images/I/31IBS5mzYSL._SS522_.jpg,Modern,Wood,Grey,https://www.amazon.com/dp/B0C4NT8N8C,,,
"AMHANCIBLE C Shaped Side Table, End Tables Set of 2 with Charging Station, Couch Tables That Slide Under with USB Port & Outlet, Snack Table for Living Room,TV Tray, Black, HET02BPBK",https://m.media-amazon.com/images/I/41qDAGoNCrL._SS522_.jpg,Straight Leg,Engineered Wood,Black,https://www.amazon.com/dp/B0BT9SVN1V,,,
LONGWIN Black Hanging Wall Round Mirror Decor Geometric Circle Mirror for Bathroom Bedroom Living Room 10.2inch,https://m.media-amazon.com/images/I/41kC6cU5HXS._SS522_.jpg,Modern,"Glass, Metal",Black,https://www.amazon.com/dp/B094F897P3,,,
"Need Fold Wall Mounted Workbench Folding Wall Table Length 47.2"" Width 20"" Perfect Addition to Garage & Shed/Home Office/Laundry Room/Home Bar/Kitchen & Dining Room",https://m.media-amazon.com/images/I/31SqvdFCutL._SS522_.jpg,Modern,Metal,Teak Color Desktop & Warm White Folding Brackets,https://www.amazon.com/dp/B00UV7B29A,,,
"Big Joe Fuf XL Cover Only Machine Washable, Gray Plush, Soft Polyester",https://m.media-amazon.com/images/I/21ysztDdCYL._SS522_.jpg,Plush,,Grey,https://www.amazon.com/dp/B08T7JP8ZN,,,
"Plymor Rectangle 5mm Beveled Glass Mirror, 6 inch x 12 inch (Pack of 6)",https://m.media-amazon.com/images/I/31wigA5chuL._SS522_.jpg,,Glass,Silver,https://www.amazon.com/dp/B09F3SGZ8Y,,,
TIMCORR CD Case DVD Holder Storage: 144 Capacity DVD Cases Organizer Portable Wallet Storage - CD Plastic Protective Carrying Binder for Home Travel (Black),https://m.media-amazon.com/images/I/411Q2ETwelL._SS522_.jpg,Portable,EVA + PVC + PP + Non-woven fabric,Black,https://www.amazon.com/dp/B0B19ZGGXC,,,
Ginger Cayden Closed Towel Ring - 4905/SN - Satin Nickel,https://m.media-amazon.com/images/I/31LNv7QILdL._SS522_.jpg,,Brass,Satin Nickel,https://www.amazon.com/dp/B00U0ECLG2,,,
"Brightify Black Bathroom Mirrors for Wall, 24 x 36 Inch Rectangle Bathroom Mirrors for Vanity Black Metal Framed Anti-Rust, Matte Black Mirror for Farmhouse Hallway Wall Decor, Horizontal or Vertical",https://m.media-amazon.com/images/I/510A0nIdGZL._SS522_.jpg,Modern,Aluminum,Black,https://www.amazon.com/dp/B0C2HNGCRX,,,
"SogesHome Wood Corner Cabinet Wall Corner Storage Cabinet, Storage Display Table Stand Cabinet, with Doors and Open Shelf, for Small Places, Living Room, White&Teak",https://m.media-amazon.com/images/I/41BTUFVwm+L._SS522_.jpg,Open Frame,,White&teak,https://www.amazon.com/dp/B0C3B4D4RH,,,
Toy Storage for Lego Play Mat Bag - Duplo Toy Organizer Storage Bag by Drawstring for Kids Tidy Toy with Lips can as Gift (Orange 47 inch),https://m.media-amazon.com/images/I/51KKvmDCqBL._SS522_.jpg,,Nylon,Orange,https://www.amazon.com/dp/B0B4CL1M1M,,,
Flash Furniture Jefferson 2 Pk. Contemporary Brown Vinyl Adjustable Height Barstool with Panel Back and Chrome Base,https://m.media-amazon.com/images/I/41GYYVLfGjL._SS522_.jpg,Contemporary,,Brown,https://www.amazon.com/dp/B00FEAN1SY,,,
"Hong Art- Metal Mirror-Matt Black,Glass Panel Black Framed Rounded Corner,Mirrored Rectangle Hangs Horizontal or Vertical,MR2001BK111.8"" 15.74""",https://m.media-amazon.com/images/I/31XytAHobHL._SS522_.jpg,Classic,Metal,Black,https://www.amazon.com/dp/B08GSH4KVM,,,
"Convenience Concepts American Heritage Round End Table, Pink",https://m.media-amazon.com/images/I/311rmB9BDWL._SS522_.jpg,Round End Table,"Solid + Manufactured Wood,Particle Board/Chipboard",Pink,https://www.amazon.com/dp/B01B65BYYI,,,
Flash Furniture Diamond Black Vinyl Luxurious Conference Chair with Accent Nail Trim,https://m.media-amazon.com/images/I/41LYsAMww6L._SS522_.jpg,Fixed,Foam,Black Vinyl,https://www.amazon.com/dp/B000TMHWGO,,,
"Gatco 1918, Modern Rectangle Waste Basket, Matte Black / 11.25"" H Open Top Stainless Steel Trash Can with Removable Lid, 12 Liter Capacity",https://m.media-amazon.com/images/I/31dnAVaEmvL._SS522_.jpg,Rectangle,Stainless Steel,Matte Black,https://www.amazon.com/dp/B07TXMJ5FQ,,,
"Winrise Office Chair Ergonomic Desk Chair, High Back Gaming Chair, Big and Tall Reclining chair Comfy Home Office Desk Chair Lumbar Support Breathable Mesh Computer Chair Adjustable Armrests(B-Orange)",https://m.media-amazon.com/images/I/41hCFaVIC+L._SS522_.jpg,Straight,Sponge,S-black,https://www.amazon.com/dp/B0CGQZBCZP,,,
"Adeco Euro Style Fabric Arm Bench Chair Footstool Cubic Ottomans, Brown",https://m.media-amazon.com/images/I/41hUc8c+DCL._SS522_.jpg,Modern,Engineered Wood,Brown,https://www.amazon.com/dp/B017TNJR72,,,
"Motiv 0202/PC Sine 18-In Towel Bar, Polished Chrome,,18"" Towel Bar",https://m.media-amazon.com/images/I/31a6GfenW0L._SS522_.jpg,,Brass,"18"" Towel Bar",https://www.amazon.com/dp/B001AS8D82,,,
"Imports Dcor PVC Backed Coir Doormat, Eighth Note Welcome, 18""x30""",https://m.media-amazon.com/images/I/51H9lDOICrL._SS522_.jpg,Art Deco,Vinyl,Black and Beige,https://www.amazon.com/dp/B08WF83LMF,,,
"Croydex Chester Square Flexi-Fix Wall Mounted Bathroom Tilt Mirror, 14.96in x 14.96in x 3.4in, Chrome",https://m.media-amazon.com/images/I/41sDO1HW2cL._SS522_.jpg,,,Silver,https://www.amazon.com/dp/B09DGFRM4B,,,
itbe Easy Fit Ready-to-Assemble Multipurpose One Door Wall Steel Cabinet Space Organizer (Blue),https://m.media-amazon.com/images/I/21NWASZgUVL._SS522_.jpg,Flat Panel,Alloy Steel,Blue,https://www.amazon.com/dp/B09FR4XSCT,,,
Delta ARV18-DN Arvo 18-in Wall Mount Towel Bar with 6-in Extender Bath Hardware Accessory in Brushed Nickel,https://m.media-amazon.com/images/I/11zzs81fXBL._SS522_.jpg,"18"" Towel Bar with 6"" Extender",Multiple Base Materials,Spotshield Brushed Nickel,https://www.amazon.com/dp/B09LVSZRZS,,,
"Bamboo Waste Basket | Waste Basket for Bathroom | Waste Basket for Office | Bathroom Trash Can | Bedroom Trash Can | Trash Can Small Wastebasket Bamboo Decor (1, 12"" x 6.5"" x 15.3"")",https://m.media-amazon.com/images/I/318RY00VlIL._SS522_.jpg,,,,https://www.amazon.com/dp/B08VWTB8CH,,,
Way Basics Vinyl Record Storage - 2 Tier Book Shelf Turntable Stand (Fits 170 Albums),https://m.media-amazon.com/images/I/41YMttt7a5L._SS522_.jpg,Modern,Recycled Material,White,https://www.amazon.com/dp/B075M1PKSW,,,
"TocTen Double Bath Towel Bar - Thicken SUS304 Stainless Steel Towel Rack for Bathroom, Bathroom Accessories Double Towel Rod Heavy Duty Wall Mounted Square Towel Holder (Matte Black,24 INCH)",https://m.media-amazon.com/images/I/41cFJKXyA5L._SS522_.jpg,,Stainless Steel,Matte Black,https://www.amazon.com/dp/B0BWRVGQRM,,,
"MoNiBloom Adjustable Bar Stools Set of 2, 360 Swivel Counter Height Barstool Kitchen Counter Island Dining Chair, Dark Grey PU Leather Bistro Swivel Stool for Living Room Kitchen, 250 lbs Capacity",https://m.media-amazon.com/images/I/41jD28iN4bL._SS522_.jpg,Straight,,Dark Grey,https://www.amazon.com/dp/B0CB7SG59J,,,
"LANTEFUL Shoe Rack Organizer Shoe Storage Cabinet 8 Tiers 32 Pair Portable Shoe Storage Sturdy Plastic Black Shoe Shelf with Hooks Shoe Rack with Door for Entryway, Bedroom and Hallway",https://m.media-amazon.com/images/I/51e8SrHHW3L._SS522_.jpg,free standing shoe racks,,Black,https://www.amazon.com/dp/B0C3QDL2XW,,,
"ANDY STAR 24x32 INCH Brushed Nickel Mirror, Rounded Rectangle Silver Metal Framed Mirrors for Bathroom Anti-Rust SUS304, Tube Metal Frame, 1 Deep Wall Mounted Vertically/Horizontal",https://m.media-amazon.com/images/I/41MQWfATggL._SS522_.jpg,,Stainless Steel,Brushed Nickel,https://www.amazon.com/dp/B0CBRGS5D7,,,
"MJL Furniture Designs Upholstered Cubed/Square Olivia Series Ottoman, 17"" x 19"" x 19"", Smoke Grey",https://m.media-amazon.com/images/I/410tv-zDYXL._SS522_.jpg,Contemporary,Wood,Smoke Grey,https://www.amazon.com/dp/B01D378FYE,,,
Cpintltr Small Foot Stool Ottoman Modern Accent Step Stool Seat with Solid Wood Legs Velvet Soft Padded Pouf Ottomans Sofa Footrest Stools for Couch Living Room Bedroom Entryway (Green 2 PCS),https://m.media-amazon.com/images/I/51CjfUJVuLL._SS522_.jpg,,Pine,Green,https://www.amazon.com/dp/B0CKPFKDZY,,,
"YuiHome Extendable Round, Farmhouse 16"" Leaf Table for Dining Room, Kitchen,Natural Wood Wash",https://m.media-amazon.com/images/I/5175Qzg03LL._SS522_.jpg,Farmhouse,"Rubber Wood, Engineered Wood",Natural Wood Wash,https://www.amazon.com/dp/B0CHVQ6BC5,,,
"Ergonomic Office Chair,Office Chair, with Lumbar Support & 3D Headrest & Flip Up Arms Home Office Desk Chairs Rockable High Back Swivel Computer Chair White Frame Mesh Study ChairAll Black",https://m.media-amazon.com/images/I/51vnoZERmPL._SS522_.jpg,With arms,Foam,All Black,https://www.amazon.com/dp/B0CBBV4S1P,,,
"Kate and Laurel Celia Round Metal Foldable Accent Table with Tray Top, Black",https://m.media-amazon.com/images/I/31ZMqrgDD8L._SS522_.jpg,Modern,Iron,Black,https://www.amazon.com/dp/B084WLY61H,,,
"Lizipai Floating Bedside Table, No Assembly Required,Night Stand with Drawer, 19"" X 13"" X 5.9"", White",https://m.media-amazon.com/images/I/41HBX6be98L._SS522_.jpg,no,Wood,White,https://www.amazon.com/dp/B09NBWCTDS,,,
"CordaRoy's Chenille Bean Bag Ottoman Footstool, 26"" x 17"", Rainforest",https://m.media-amazon.com/images/I/51HpCirQNAL._SS522_.jpg,Modern,Engineered Wood,Rainforest,https://www.amazon.com/dp/B0BSZ96YG7,,,
"Plebs Home Solid Desktop Store Cart, with Rubber Wood Countertop, Island has 8 Handle-Free Drawers, Including a Flatware Organizer and 5 Wheels, for Dining, Kitchen, Living Room-Dark Blue, 53.15 Inch",https://m.media-amazon.com/images/I/51WFQwBEqjL._SS522_.jpg,Slab,Wood,Dark Blue,https://www.amazon.com/dp/B0CD7FSWMK,,,
"ErGear Ergonomic Desk Chair, Office Chair with 2'' Adjustable Lumbar Support, Computer Chair with Flip-Up Armrests & Headrest, High Back Office Desk Chair with 4'' Thicken Seat for Home Office, Black",https://m.media-amazon.com/images/I/41C4FUmS-hL._SS522_.jpg,With arms,Memory Foam,Black,https://www.amazon.com/dp/B0C99D3V15,,,
"Kingston Brass Millennium Towel-Ring, 7.63"", Oil Rubbed Bronze",https://m.media-amazon.com/images/I/31+kzwXTjxS._SS522_.jpg,,Brass,Oil Rubbed Bronze,https://www.amazon.com/dp/B00FM0WG7I,,,
"Homebeez 18.9"" Round Velvet Storage Ottoman Multi-Function Vanity Stool Footrest with Storage for Bedroom/Living Room,Orange",https://m.media-amazon.com/images/I/51vTxE-9lHL._SS522_.jpg,Modern,Wood,Orange,https://www.amazon.com/dp/B09DKG6JDN,,,
Mickey and Friends Collapsible Nylon Basket Bucket Toy Storage Tote Bag,https://m.media-amazon.com/images/I/410mEc5bblL._SS522_.jpg,,,,https://www.amazon.com/dp/B0B7Q5LB2C,,,
Homepop Home Decor | Backless Nailhead Trim Counter Height Bar Stools | 24 Inch Bar Stools | Decorative Home Furniture (Blue Tweed),https://m.media-amazon.com/images/I/41HPIScA4sL._SS522_.jpg,Contemporary,,Blue,https://www.amazon.com/dp/B01LWPSVUW,,,
"Camco Life Is Better at The Campsite Outdoor & Indoor Welcome Mat - Weather and Doormat | Traps Dirt and Liquid | Spongey Comfortable Feel | Measures 26  "" x 15"" - Blue (53201) - 53201-A",https://m.media-amazon.com/images/I/51DN2is3ZjL._SS522_.jpg,Outdoor & Indoor,Rubber,Blue,https://www.amazon.com/dp/B07D7RQNJV,,,
MoNiBloom Round Folding Faux Fur Saucer Chair for Bedroom Living Room Dorm Courtyard Foldable Metal Frame Oversized Large Comfy Furry Padded Soft Lounge Lazy Cozy Moon Chair for Adults (Burgundy),https://m.media-amazon.com/images/I/41eoFKL3gKL._SS522_.jpg,Modern,Polyester,Burgundy,https://www.amazon.com/dp/B0CD7TH3BF,,,
"YMYNY Vanity Stool Chair with Storage, Square Velvet Ottoman Foot Stool, Modern Multifunctional Makeup Stool for Bedroom, Living Room, Office, Gold Legs, 18.9 * 15.75 * 11.6"", Dusty Blue, UHBD024G",https://m.media-amazon.com/images/I/519Am3LPMvL._SS522_.jpg,Modern,,Dusty Blue,https://www.amazon.com/dp/B0C1NSNDW2,,,
"Casual Home 5 Piece Tray Table Set, Espresso",https://m.media-amazon.com/images/I/41WweDJqgZL._SS522_.jpg,Tray Table Set,Wood,Espresso,https://www.amazon.com/dp/B0069H9BYO,,,
"Simplify Hanging Grey 20-Pocket Shoe Boho Closet Storage Organization | Dimensions: 0.25"" x 22"" x 54"" | Hangs on Door| Closet | 20 Pockets | Grey | Closet Organization",https://m.media-amazon.com/images/I/41eYiOqsldL._SS522_.jpg,,80% Linen printed nonwoven +20% solid nonwoven+ 20%PAPERBOARD,Grey,https://www.amazon.com/dp/B09J1RM23P,,,
"Get Set Style Black Glass Side Table, Square Glass End Table Modern Coffee Table with Storage, Glass Mirrored Table for Living Room, Balcony, Bedroom, Office",https://m.media-amazon.com/images/I/51gG6ukN1nL._SS522_.jpg,Modern and Elegant,Tempered Glass,Shiny Black,https://www.amazon.com/dp/B0C5DH6ZY6,,,
"Watson & Whitely Swivel Bar Stools Set of 2, Faux Leather Upholstered Counter Height Barstool with Back, 26"" H Seat Height Counter Stools with Solid Wood Legs (Black)",https://m.media-amazon.com/images/I/41nDc6aFKoL._SS522_.jpg,Modern,,Black,https://www.amazon.com/dp/B0CKQTTZ5V,,,
Sweet Jojo Designs Boho Rainbow Girl Ottoman Pouf Cover Unstuffed Poof Floor Footstool Square Cube Pouffe Storage Baby Nursery Kids Room Blush Pink Yellow Bohemian Modern Neutral Vintage Taupe Beige,https://m.media-amazon.com/images/I/31nn4NwuKfL._SS522_.jpg,Shabby Chic,Engineered Wood,Multi Color,https://www.amazon.com/dp/B0BZJYM4Q6,,,
