title,primary_image,style,material,color,url,keywords,img_description,caption
"PINPLUS Storage Ottoman Bench, Linen Coffee Table Ottoman with Tray, Large Storage Bench with Wooden Legs, Toy Chest Foot Stools, Ottomans with Storage for Living Room Bedroom, White, 30"" x 15"" x 15""",https://m.media-amazon.com/images/I/41gj8mVGFGL._SS522_.jpg,Modern,Engineered Wood,White,https://www.amazon.com/dp/B0BZ3RYRNY,,,
"Red Co. 14 x 18 inch Large Decorative Frameless Beveled Edge Wall Hanging Mirror, Rectangular",https://m.media-amazon.com/images/I/21M6+MAnWpL._SS522_.jpg,Modern,Glass,Silver,https://www.amazon.com/dp/B087Z3RXLN,,,
PONTMENT Foot Stool Leather Footstool Solid Wood Vintage Foot Rest Faux Leather Ottoman Upholstered Footrest for Living Room/Sofa/Couch.,https://m.media-amazon.com/images/I/51ElPbhgU7L._SS522_.jpg,,,,https://www.amazon.com/dp/B0C38VPJ15,,,
"Kingston Brass BA2714C Milano Towel-Ring, 6-Inch, Polished Chrome",https://m.media-amazon.com/images/I/41X7yXWQ+PS._SS522_.jpg,Contemporary,Brass,Polished Chrome,https://www.amazon.com/dp/B0003SDM18,,,
"Lazy Chair with Ottoman, Modern Lounge Accent Chair with Footrest, Pillow and Blanket, Leisure Sofa Chair Reading Chair with Armrests and Side Pocket for Living Room, Bedroom & Small Space, Grey",https://m.media-amazon.com/images/I/415U1ul6gpL._SS522_.jpg,,,Grey,https://www.amazon.com/dp/B0CCRXWDF1,,,
"latifolia Shoe Cabinet, Vintage Shoe Storage Cabinet with 2 Doors, 4 Tier Bamboo Shoe Organizer Cabinet for Entryway, Closet, Hallway",https://m.media-amazon.com/images/I/41Mst-29ZdL._SS522_.jpg,Modern,Bamboo,Brown,https://www.amazon.com/dp/B0CGX7Y9HQ,,,
"Jumweo Towel Racks for Bathroom, Metal Towel Rack Wall Mounted for Large Towels, Rolled Bath Towel Holder for Bathroom Wall, BathTowelStorageShelf with Wood Shelf for Small Bathroom",https://m.media-amazon.com/images/I/411VfNriJEL._SS522_.jpg,,,,https://www.amazon.com/dp/B0CM6PR2ZB,,,
"Christopher Knight Home Gentry Bonded Leather Dining Chairs, 2-Pcs Set, Black",https://m.media-amazon.com/images/I/412PrvRCw-L._SS522_.jpg,Leather,Foam,Black,https://www.amazon.com/dp/B005FFA3LQ,,,
BokWin 4 Sets No Mortise Bed Rail Fittings Wooden Bed Frame Connectors Metal Bed Rail Fasteners,https://m.media-amazon.com/images/I/41ocbpXWJgL._SS522_.jpg,,Iron,,https://www.amazon.com/dp/B09CGPQT1L,,,
"Simple Deluxe Gaming Chair, Big and Tall Gamer Chair, Racing Style Adjustable Swivel Office Chair, Ergonomic Video Game Chairs with Headrest and Lumbar Support",https://m.media-amazon.com/images/I/41ZTMbqu1JL._SS522_.jpg,With arms,,Black,https://www.amazon.com/dp/B0B51LYB8T,,,
OIGUMR Shield Wall Mirror Mirror Wall Decor Vintage Mirror (11.3 x 8.5 inch Gold),https://m.media-amazon.com/images/I/41LSP7xb2qL._SS522_.jpg,,Resin,Gold,https://www.amazon.com/dp/B0BMXD3D6J,,,
"ChooChoo Farmhouse End Table, Modern End Table with Storage Shelf, X-Design Side Table Living Room (White and Brown)",https://m.media-amazon.com/images/I/41P7V9O6gaL._SS522_.jpg,Modern,Engineered Wood,White and Brown,https://www.amazon.com/dp/B0CJHT9KH6,,,
"ZIYOO Twin Bed Frame 14 Inch High 3 Inches Wide Wood Slats with 2500 Pounds Support, No Box Spring Needed for Foam Mattress,Underbed Storage Space, Easy Assembly, Noise Free",https://m.media-amazon.com/images/I/31dZ6tsbHOL._SS522_.jpg,,,Black,https://www.amazon.com/dp/B07RY46G23,,,
"MoNiBloom Set of 2 Plastic Barstools with PU Cushion, Height Adjustable White Bar Stools with High Backrest and 360 Swivel, Modern Counter Height Barstool for Kitchen Dining Room and Pub",https://m.media-amazon.com/images/I/31fCq+IIEuL._SS522_.jpg,Modern,,White,https://www.amazon.com/dp/B0CB7SM7MM,,,
KingCamp Stable Folding Camping Table Bamboo Outdoor Folding Tables Adjustable Height Portable Picnic,https://m.media-amazon.com/images/I/41Sc-GGZBeL._SS522_.jpg,YELLOW,"Aluminum,Bamboo","Yellow-27.6""d X 47.2""w X 27.56""h",https://www.amazon.com/dp/B08ZHPDZX5,,,
"Artistic Weavers Berma Knitted Jute Round Pouf 14""H x 20""W x 20""D, Slate",https://m.media-amazon.com/images/I/51wZvzlzMDL._SS522_.jpg,Natural,Engineered Wood,Slate,https://www.amazon.com/dp/B00JVZEZE2,,,
Dwellicity Hello Welcome Mat Black and Gray Striped Coir Mat,https://m.media-amazon.com/images/I/51nGbm-6b-L._SS522_.jpg,Modern,Polyvinyl Chloride,,https://www.amazon.com/dp/B099NTP2SZ,,,
"Lifewit 70.9"" Narrow Long Console Sofa Table with Metal Frame for Living Room, Industrial Entryway Table for Hallway Entrance Office Corridor Coffee Table Behind Sofa, Easy Assembly,Rustic Brown",https://m.media-amazon.com/images/I/417XCOhUDgL._SS522_.jpg,Modern,Engineered Wood,Rustic Brown,https://www.amazon.com/dp/B0BZYWTH2D,,,
"Henn&Hart 20"" Wide Round Side Table with Mirror Shelf in Antique Brass, Table for Living Room, Bedroom",https://m.media-amazon.com/images/I/41+Mg7qmpYL._SS522_.jpg,Side Table,Glass,Antique Brass/Mirror,https://www.amazon.com/dp/B07WK22XDX,,,
"klotski Kids Table and 2 Chair Set, Wood Activity Toddler Table and Chair Set with Storage, Children Table with Non-Slip Legs/Round Edge Design for Activity/Play/Art/Read/Craft",https://m.media-amazon.com/images/I/41QhFgJUCgL._SS522_.jpg,,,,https://www.amazon.com/dp/B0CGZW945K,,,
"Kraftware Grant Signature Home San Remo Pinecone Round Waste Basket, 10.75"", Brown",https://m.media-amazon.com/images/I/419nFYjmvGL._SS522_.jpg,,Vinyl,Brown,https://www.amazon.com/dp/B0751KYGV4,,,
"Alise Bath 3 Towel Bars,Towel Holder Towel Racks for Bathroom Wall Mount,Heavy Duty SUS304 Stainless Steel Towel Hanger Towel Rails,GK9603-B Matte Black,25-Inch",https://m.media-amazon.com/images/I/41frWw+ttRL._SS522_.jpg,,"Stainless Steel, Metal",Matte Black,https://www.amazon.com/dp/B0BGN333H4,,,
"Round Mirror, Black Round Mirror 24 Inch, Round Wall Mirror, Round Bathroom Mirror, Circle Mirrors for Wall, Metal Framed Mirror for Bathroom, Vanity, Bedroom, Entryway, Hallway",https://m.media-amazon.com/images/I/41igYIRb2fL._SS522_.jpg,Modern,Metal,Black,https://www.amazon.com/dp/B08TTKV6LY,,,
"Gexpusm Wood Coffee Table, Natural Wood Coffee Table, Solid Wood Center Large Coffee Table for Living Room (Octagonal Coffee Table)",https://m.media-amazon.com/images/I/51xwMLJtrtL._SS522_.jpg,4 independent iron legs,Wood,Octagonal Coffee Table,https://www.amazon.com/dp/B0BWXB7C1B,,,
"Karl home Accent Chair Mid-Century Modern Chair with Pillow Upholstered Lounge Arm Chair with Solid Wood Frame & Soft Cushion for Living Room, Bedroom, Belcony, Beige",https://m.media-amazon.com/images/I/51+a05Mxh+L._SS522_.jpg,Mid-Century Modern,,Beige,https://www.amazon.com/dp/B0BLP4W97Y,,,
"Kottova Vanity Mirror with Lights,Makeup Mirror Tabletop,Hollywood Mirror with Phone Holder,9 LED Dimmable Bulbs, 3 Color Modes,Touch Control, 360 Rotation,Detachable 10X Magnification Mirror,Black",https://m.media-amazon.com/images/I/41Z2VFHxc2L._SS522_.jpg,,,,https://www.amazon.com/dp/B0BJ1Y5TDN,,,
"L.R. Resources Corcovado Metallic Braided Pouf Ottoman, 14"" x 20"", Grey/White",https://m.media-amazon.com/images/I/51QokReEa1L._SS522_.jpg,Bohemian,Cotton,Grey / White,https://www.amazon.com/dp/B078YDGBM8,,,
"GREENSTELL Coat Rack, Wooden Coat Rack Freestanding with Shelf, Coat Tree with 4 Height Options 50.5""-72.6"" for Clothes/Bag/Hats, Hanger Stand for Entryway/Living Room/Bedroom/Office, Black",https://m.media-amazon.com/images/I/31lWN-XSfCL._SS522_.jpg,Rustic,Wood,Black,https://www.amazon.com/dp/B09M8M4P9L,,,
"COLLECTIVE HOME Mail Organizer with Mirror, Wall Pocket, Wood Wall Hanging Decor, Wooden Mail Holder, Collect Beautiful Moments, Decorative Accent Mirror for Foyer, Bathroom, Bedroom. (Black)",https://m.media-amazon.com/images/I/510ciQYiY4L._SS522_.jpg,Rustic,Black,White,https://www.amazon.com/dp/B0BWY1HPMB,,,
"Nightstand with Charging Station and LED Light, Side End Table with Glass Door, Modern Bedside Table for Bedroom, Living Room",https://m.media-amazon.com/images/I/41Co0zmXyyL._SS522_.jpg,With power outlet,"Glass, Engineered Wood",Black,https://www.amazon.com/dp/B0C6K8LMG8,,,
"Kmitmuk 2 Pack Cabinet Towel Holder, White Kitchen Towel Rack Stainless Steel Towel Bar Universal Fit On Cupboard Doors",https://m.media-amazon.com/images/I/21b4+99Ox0L._SS522_.jpg,,,,https://www.amazon.com/dp/B0CGXJ3VR7,,,
"GIA Toolix Backless Stool with Metal Seat, Gunmetal, 4-Pack",https://m.media-amazon.com/images/I/41mgAYeNExL._SS522_.jpg,Tapered,,Gunmetal,https://www.amazon.com/dp/B01FL46UD0,,,
"It's_Organized Gaming Desk 55 inch PC Computer Desk, K-Frame Home Office Desk Professional Gamer Workstation with Cup Holder Headphone Hook Gaming Handle Rack Free Mousepad, Black",https://m.media-amazon.com/images/I/41oiXo1q4wL._SS522_.jpg,Gaming,Alloy Steel,Black,https://www.amazon.com/dp/B08CR34X1X,,,
"Serta Executive Office Padded Arms, Adjustable Ergonomic Gaming Desk Chair with Lumbar Support, Faux Leather and Mesh, Black/Blue",https://m.media-amazon.com/images/I/41ZBS1hvHzL._SS522_.jpg,with-arms,Foam,Black/Blue,https://www.amazon.com/dp/B07644FZVS,,,
"KoiHome Wooden Daybed with 2 Storage Drawers, Twin Size Platform Bed Frame, Daybed Twin for Kids Boy Girls Bedroom,Living Room, Office, No Box Spring Needed, Twin Size Day Beds Sofas in Espresso",https://m.media-amazon.com/images/I/511irNkgawL._SS522_.jpg,,,Espresso,https://www.amazon.com/dp/B0CHMQC63H,,,
"Soerreo Shoe Slot Storage Box Adjustable Shoe Rack Save Space Suitable for High Low Heels, Sneakers and Sandals (10 Piece Set)",https://m.media-amazon.com/images/I/4127YVIANkL._SS522_.jpg,Modern,Plastic,10 Piece Set,https://www.amazon.com/dp/B07X5VSLV1,,,
"Arch Window Wall Mirror for Living Room,White Cathedral Wooden Decorative Arch Windowpane Mirror Large Vintage Farmhouse Mirror",https://m.media-amazon.com/images/I/419YPa-PWhL._SS522_.jpg,French Country,Wood,Black,https://www.amazon.com/dp/B0CJV7SF48,,,
"Jennifer Taylor Home Jacob 18"" Storage Cube Ottoman, Tan Floral Jacquard",https://m.media-amazon.com/images/I/51KOhS-ZWZL._SS522_.jpg,Contemporary,Engineered Wood,Tan Floral Jacquard,https://www.amazon.com/dp/B0C9FWFGRP,,,
"C COMFORTLAND Unstuffed Faux Leather Ottoman Pouf, Round Foot Rest Poof Ottomans, Floor Foot Stool Poufs, Bean Bag Cover with Storage for Living Room, Bedroom, Grey (No Filler)",https://m.media-amazon.com/images/I/51qAukZMUDL._SS522_.jpg,Modern,This is an empty shell that you have to stuff.,Grey3,https://www.amazon.com/dp/B0BWY5RPD1,,,
"ZZQXTC Over Toilet Storage Cabinet, Bathroom Storage Cabinet with Doors and Shelves, Wood Metal Bathroom Space Saver Above Toilet, White",https://m.media-amazon.com/images/I/31cXPz4r76L._SS522_.jpg,wood,Wood,Over the Toilet Storage Cabinet White,https://www.amazon.com/dp/B0CBDLJ32L,,,
"40ft Upholstery Elastic Webbing,Two Inch (2"") Wide Stretch Latex Band for Furniture Sofa, Couch, Chair Repair Modification (5cm Green)",https://m.media-amazon.com/images/I/51oKu+lxwzL._SS522_.jpg,,,,https://www.amazon.com/dp/B0CG9CDKQ7,,,
"Kujielan Oval Wall Mirror with Leaf Decorative Frame,Cirle Mirrors for Wall,Modern Wall Decor for Living Room,Bedroom,Bathroom,Vanity,Entryway,Black",https://m.media-amazon.com/images/I/419muJNV1JL._SS522_.jpg,Contemporary,Metal,Black,https://www.amazon.com/dp/B0CF9W6WW2,,,
"RRG Coat Rack Stand, Metal Coat Tree with Heavy Base 8 Welded Hooks Coat Stand for Entryway, Hall, Bedroom, Corner, Office 67 (Gold)",https://m.media-amazon.com/images/I/214BED2RP6L._SS522_.jpg,8 T-shaped Hooks,Metal,"Gold - T 67""/170cm",https://www.amazon.com/dp/B09VBPNY7P,,,
"Mirrors for Wall Decor, Golden Hanging Mirror Golden Butterfly Wall Hanging Makeup Mirror with Chain Round Decorative Mirror for Bathroom Bedroom Living Room Housewarming Gift",https://m.media-amazon.com/images/I/31TgX2crLUS._SS522_.jpg,,Iron,Gold,https://www.amazon.com/dp/B097R4M5Y5,,,
"Mokoze Wavy Mirror Irregular Border 10.24""x6.3"" Makeup Mirror for Wall-Mounted and Dressing Table Mirrors, Room Decor for Living Room Bedrooms and Mirror for Desk (White)",https://m.media-amazon.com/images/I/319OzJXVrxL._SS522_.jpg,,Plastic,White,https://www.amazon.com/dp/B0C9QHJ611,,,
"(100) 12"" Record Outer Sleeves - Outer Resealable Sleeves - Extreme HD Poly 3 Mil 12 3/4"" x 12 1/2"" | Record Rescue",https://m.media-amazon.com/images/I/41uJZW57cBL._SS522_.jpg,,"Vinyl, Plastic, Polypropylene (PP)",,https://www.amazon.com/dp/B07B8VT4DC,,,
"Christopher Knight Home Munro Recliner, Navy Blue + Teak",https://m.media-amazon.com/images/I/31exiSJMk8L._SS522_.jpg,Contemporary,Foam,Navy Blue + Teak,https://www.amazon.com/dp/B09DS1VPFS,,,
"3-Tier Side Table,Narrow End Table with Storage Shelf,Minimalist Bedside Tables Nightstand,Small Bookshelf Bookcase for Spaces,Bathroom Shelve,Display Rack for Bedroom,Living Room,Office,Dorms,2 Pack",https://m.media-amazon.com/images/I/41tzKL1XIPL._SS522_.jpg,Modern,Engineered Wood,White,https://www.amazon.com/dp/B0CP732ZN8,,,
"DBTHTSK Sofa Latch,Bed Replacement Parts,Heavy Duty Connector Bracket Interlocking Tapered Hardware Accessories Furniture Connector for Furniture, Sofa, Bed (2 Pairs)",https://m.media-amazon.com/images/I/41gQlYHLvcL._SS522_.jpg,,,,https://www.amazon.com/dp/B0C2GQK6ZD,,,
"Boraam Sonoma Bench, Storm Gray Wire-Brush",https://m.media-amazon.com/images/I/316Y4ewyCLL._SS522_.jpg,,,Storm Gray Wire-brush,https://www.amazon.com/dp/B07T9M8Y88,,,
"Kwikset BTBCB2Y, Tuscan Bronze",https://m.media-amazon.com/images/I/21lfjygKjaL._SS522_.jpg,Transitional,Metal,Tuscan Bronze,https://www.amazon.com/dp/B001AHXWQ6,,,
"Ilyapa 2-Tier Gold Metal Record Player Stand with 16 Slot Vinyl Record Holder - Honeycomb Design Turntable Shelf with Record Shelf, Vinyl Record Player Stand",https://m.media-amazon.com/images/I/4107MgspWhL._SS522_.jpg,,,,https://www.amazon.com/dp/B0BT6FF83T,,,
"GZsenwo (2 Pieces) 3-5/8"" Stainless Steel Replacement Recliner Sofa Mechanism Tension Spring - Long Neck Hook",https://m.media-amazon.com/images/I/41GvGSllzML._SS522_.jpg,,Stainless Steel,2pcs,https://www.amazon.com/dp/B0C6SYFYZN,,,
"HomePop by Kinfine Fabric Upholstered Round Storage Ottoman - Velvet Button Tufted Ottoman with Removable Lid, Tan Woven",https://m.media-amazon.com/images/I/51x3kXXPgxL._SS522_.jpg,"Glam,Farmhouse,Traditional",Engineered Wood,Tan Woven,https://www.amazon.com/dp/B0BG6BJ3DL,,,
"EFTILE HOME 2 Foot Stool Handmade Wooden 3 Legs Footrest for Living Room, Bedroom, Nursery, Patio,Hallway, Lounge, Decorative Furniture (16x14x14; Kiwi)",https://m.media-amazon.com/images/I/41-mDeiQw+L._SS522_.jpg,,Wood,Kiwi,https://www.amazon.com/dp/B0CKJ4YZC9,,,
"Soft Foot Stool Ottoman Footrest Vanity Stool with Storage Shelf, Velvet Multifunctional Modern Padded Shoe Changing Seat Step Stool Pouf for Makeup Room, Living Room, Bathroom, Metal Legs Black",https://m.media-amazon.com/images/I/41oTGNme97L._SS522_.jpg,,Iron,Black,https://www.amazon.com/dp/B0CKW44X29,,,
"GAOMON Black 4 Drawer Dresser for Bedroom, Wood Chest of Drawers with Metal Legs, Modern Storage Dresser Chest Cabinet Organizer, Large Dresser for Living Room, Hallway, Closet",https://m.media-amazon.com/images/I/41GkzVqoNyL._SS522_.jpg,,,Black,https://www.amazon.com/dp/B0CM1B86CJ,,,
"Alise 24-Inch Bathroom Lavatory Towel Rack Towel Shelf with 2 Towel Bars Wall Mount Towel Holder,GYT7060-C SUS 304 Stainless Steel Polished Chrome",https://m.media-amazon.com/images/I/51FqMNM3yYL._SS522_.jpg,,,,https://www.amazon.com/dp/B0B6HXHQSW,,,
"Seventable Nightstand with Charging Station and LED Lights, Modern Design End Side Table with 2 Drawers, Nightstand Open Compartment for Bedroom, Black",https://m.media-amazon.com/images/I/41Wn14U8LlL._SS522_.jpg,Modern,Engineered Wood,Black,https://www.amazon.com/dp/B09DLBNY6W,,,
"Furinno Coffee Table with Bins, Espresso/Brown & Simplistic End Table, Espresso/Black",https://m.media-amazon.com/images/I/31CY4VJNyxL._SS522_.jpg,Modern,"Beech,Particle Board",Espresso/Brown,https://www.amazon.com/dp/B08C7Y4RB3,,,
"Mod Made Mid Century Modern Chrome Wire Counter Stool for Bar or Kitchen, Set of 2, Black",https://m.media-amazon.com/images/I/41BxXleMgGL._SS522_.jpg,Straight,,Black Pad,https://www.amazon.com/dp/B09Q1ZHQFR,,,
"Bloomingville 15 Inches Mango Wood and Metal Organic Shaped Shelf, Matte Black Wall Mirror",https://m.media-amazon.com/images/I/21-b0yTRSNL._SS522_.jpg,Rustic,Metal,Black,https://www.amazon.com/dp/B0CFSPXPYF,,,
"Gnyonat Accent Chair with Ottoman,Living Room Chairs,Reading Chairs for Bedroom Comfy,Soft Fabric Reading Chair (Blue)",https://m.media-amazon.com/images/I/41Gau9oSdRL._SS522_.jpg,,,Blue,https://www.amazon.com/dp/B0C3TYNRJC,,,
"SLLFLY Water Bottle Organizer,Stackable Water Bottle Holder for Cabinet Kitchen,Wine Drink Rack for Kitchen Countertop Freezer Pantry Organization and Storage",https://m.media-amazon.com/images/I/51EAJVwOuLL._SS522_.jpg,Clear,,Clear,https://www.amazon.com/dp/B0BZNKKCC3,,,
"jela Kids Couch Large, Floor Sofa Modular Funiture for Kids Adults, Playhouse Play Set for Toddlers Babies, Modular Foam Play Couch Indoor Outdoor (57""x28""x18"", Charcoal)",https://m.media-amazon.com/images/I/41Zury7vcHL._SS522_.jpg,Padded,Suede,Charcoal,https://www.amazon.com/dp/B0BL9CDX29,,,
Flexson TV Mount Attachment for Sonos Beam - Black,https://m.media-amazon.com/images/I/31vbAI-UxEL._SS522_.jpg,,,Black,https://www.amazon.com/dp/B07DQ6GPK6,,,
"Small Collapsible Kids Hamper Fold Office Waste Bins Pop Up Basket Laundry Sorter For Bedroom Closet,Living Room,Camp Pink",https://m.media-amazon.com/images/I/41v-ozvbCqL._SS522_.jpg,,Polyester,"11.8""*19.7"" Pink",https://www.amazon.com/dp/B07K2Q2NRC,,,
"Diyalor 2.6 Gallon Small Trash Can with Handle,Durable Bathroom Wastebasket Garbage Can (Pack of 2, Black)",https://m.media-amazon.com/images/I/219EPmkeeJL._SS522_.jpg,,,,https://www.amazon.com/dp/B09QCMCPYC,,,
"DAYTOYS C Shaped End Table-Movable Sofa Table with Metal Frames-Height Adjustable Sofa Tables with Storage Basket for Living Room, Bedroom, Bedside (Black)",https://m.media-amazon.com/images/I/41pgntXmHrL._SS522_.jpg,Classic,Wood,Black,https://www.amazon.com/dp/B0C32RWCV7,,,
"Phantoscope Storage Ottoman Round15 Inch, Velvet Folding Storage Boxes Footrest Foot Ottoman Toy Box, Padded Seat for Dorm Living Room Bedroom, Support 220lbs Coffee",https://m.media-amazon.com/images/I/31V7JNrxMgL._SS522_.jpg,Modern,Engineered Wood,Coffee,https://www.amazon.com/dp/B095HPZ7DD,,,
Casual Home Night Owl Nightstand with USB Ports-Espresso,https://m.media-amazon.com/images/I/3142Zp+eYuL._SS522_.jpg,Night Owl,"Walnut,Solid Wood,MDF",Espresso,https://www.amazon.com/dp/B019C4PPTU,,,
"NOVICA 302212 Handmade Wood and Reverse Painted Glass Wall Mounted Mirror, Burgundy and Metallic, Cuzco Snowflake'",https://m.media-amazon.com/images/I/51bKwT153nL._SS522_.jpg,Colonial,"Wood, Glass",Burgundy,https://www.amazon.com/dp/B07N41BVDG,,,
Toy Storage Basket and Play Mat for Building Bricks - Collapsible Canvas Organizer Bag with Drawstring - For Kids,https://m.media-amazon.com/images/I/61f83XRzygL._SS522_.jpg,,fabric,Grey,https://www.amazon.com/dp/B08PMH8F89,,,
RICOO SQ4965 No-Gap Wall Mount for Samsung Q7 Q8 & Q9 Screens Ultra Flat & Tilting TV Bracket for 49 55 & 65 Inch QLED Devices Super Slim Television Support Weight Capacity 110lbs Black,https://m.media-amazon.com/images/I/41VNr1xTfEL._SS522_.jpg,,,black,https://www.amazon.com/dp/B083WKFRRR,,,
Hosley Wooden Frame Mirror 20 Inch High. Ideal for Weddings Special Occasions and for Wall Decor Home Spa Aromatherapy Reiki. P2,https://m.media-amazon.com/images/I/410lp8RwjvL._SS522_.jpg,Contemporary,Wood,Brown,https://www.amazon.com/dp/B07BQHWWRW,,,
"BRIAN & DANY Foldable Storage Ottoman Footrest and Seat Cube with Wooden Feet and Lid, Khaki 15 x15 x14.7",https://m.media-amazon.com/images/I/413YS7nQBnL._SS522_.jpg,Modern,Wood,Khaki,https://www.amazon.com/dp/B08BNDNGHJ,,,
"ReplacementScrews Bed Frame Rail Screws Compatible with IKEA Part 116894 (HEMNES, BRIMNES, etc) Euro Screws (Pack of 20)",https://m.media-amazon.com/images/I/31-vY+TuWOL._SS522_.jpg,Flat,Metal,Multicolored,https://www.amazon.com/dp/B0CMXYMDH4,,,
"mDesign Round Metal in-Lay Accent Table with Hairpin Legs - Side/End Table - Decorative Legs, Marble Top - Home Decor Accent Furniture for Living Room, Bedroom - Set of 2 - Soft Brass/Mirror",https://m.media-amazon.com/images/I/413u0H2o1IL._SS522_.jpg,Modern,Steel/Mirror,Soft Brass/Mirror,https://www.amazon.com/dp/B08XPR7662,,,
"NSFRCLHO Round End Table, Tempered Glass End Table with Metal Frame, Small Coffee Table, Black Sofa Side Table for Living Room, Balcony, Bedroom",https://m.media-amazon.com/images/I/41z8YktAkGL._SS522_.jpg,Classic,Tempered Glass,Black,https://www.amazon.com/dp/B089YWCTN2,,,
pranovo Metal Sofa Handle Cable Recliner Chair Couch Release Lever Replacement (2 Pack B#),https://m.media-amazon.com/images/I/3144eTNpeEL._SS522_.jpg,,Aluminum,Black,https://www.amazon.com/dp/B00R5VYYIG,,,
"Stuffed Animal Storage Bean Bag Chair Cover for Kids, 24x24 Inch Velvet Extra Soft Large Storage Bean Bag for Organizing Children Plush Toys Room Decor for Girls(Cover Only)",https://m.media-amazon.com/images/I/41dBlMhHThL._SS522_.jpg,,velvet,Cover Only,https://www.amazon.com/dp/B08JLH2PVH,,,
"Pinkpum Shoe Ogranizer for Closet, 12 Pack Shoe Storage Boxes Clear Plastic Stackable Shoe Box, Shoe Containers Storage with Lids, Sneaker Container Bin Holder, Clear White",https://m.media-amazon.com/images/I/41huFJxt+FL._SS522_.jpg,,Acrylonitrile Butadiene Styrene,Clear,https://www.amazon.com/dp/B0B6P65LGH,,,
"BOOSDEN Padded Folding Chair 2 Pack, Foldable Chair with Thick Cushion, Heavy Duty Metal Folding Chair for Outdoor & Indoor & Dining & Party, Red",https://m.media-amazon.com/images/I/41H64LdIQ8L._SS522_.jpg,,,2 Pack Thick Chair | Red,https://www.amazon.com/dp/B0CC4SZBQ9,,,
"Kingston Brass SCC8247 Edenscape Pedestal Steel Construction Towel-Rack, Brushed Brass 25.75 x 14.44 x 32",https://m.media-amazon.com/images/I/31FOa-k+EtL._SS522_.jpg,Modern,Alloy Steel,Brushed Brass,https://www.amazon.com/dp/B0B5VJNZHL,,,
"Industrial Rolling Bar 3-Tier Kitchen Serving Cart, Wine Storage Rack, Rustic Pipe Dining Cart with Wheels, Restaurant Wine Glass Holder, 15.7x15.7x33.4inches",https://m.media-amazon.com/images/I/51rjiq645tL._SS522_.jpg,,"Solid Wood,Iron",Brown+black,https://www.amazon.com/dp/B07RGDWW5C,,,
Chill Sack Bean Bag Chair: Giant 5' Memory Foam Furniture Bean Bag - Big Sofa with Soft Micro Fiber Cover - Lime,https://m.media-amazon.com/images/I/51fQFu92tsL._SS522_.jpg,Furniture Foam,,Microsuede - Lime,https://www.amazon.com/dp/B00P21TM2O,,,
"Caroline's Treasures BB5130JMAT Day of The Dead Red Flowers Skull Doormat 24x36 Front Door Mat Indoor Outdoor Rugs for Entryway, Non Slip Washable Low Pile, 24H X 36W",https://m.media-amazon.com/images/I/41Q15C0DMDL._SS522_.jpg,Day of the Dead Red Flowers Skull,Rubber,Day of the Dead Red Flowers Skull,https://www.amazon.com/dp/B01MR9GSZE,,,
"glitzhome Adjustable Bar Stool Set of 2 Swivel Mid-Century Modern PU Leather Counter Dining Chairs with Back, Begin",https://m.media-amazon.com/images/I/51OPfpn9ovL._SS522_.jpg,Mid-Century,,Begin,https://www.amazon.com/dp/B08ZC5CYXG,,,
Symmons 673TR-STN Identity Wall-Mounted Towel Ring in Satin Nickel,https://m.media-amazon.com/images/I/31cLgr4MIBL._SS522_.jpg,Contemporary,Brass,Satin Nickel,https://www.amazon.com/dp/B01LYD3YB1,,,
"glitzhome Kitchen Island with Storage Kitchen Cart on Wheels Rolling Kitchen Cart Island Table with Tower Holder Spice Rack Drawer for Dining Room Kitchen, 34.25H, Red",https://m.media-amazon.com/images/I/51wSfraUuhL._SS522_.jpg,Shaker,"Mdf,Metal,Plastic",Red,https://www.amazon.com/dp/B09D2T4GP4,,,
"Lipper International Child's Toy Chest, 33.25"" W x 17.75"" D x 24.5"" H, Walnut Finish",https://m.media-amazon.com/images/I/41IWlgQ25-L._SS522_.jpg,,"Engineered Wood, Beechwood, Metal",Walnut Finish,https://www.amazon.com/dp/B005H05TWC,,,
"dnbss LED Nightstand with Charging Station, SwivelTop Bedside Table with Wheels, Smart Night Stand with Laptop Table Workstation for Bedroom, Modern End Side Table (Black)",https://m.media-amazon.com/images/I/41CANS+MiTL._SS522_.jpg,Modern,Wood,1-black,https://www.amazon.com/dp/B0BNWVLYV1,,,
"Remote Control Holder,TV Remote Caddy/Box with 5 Compartments,Bedside Table Organizer for Controller,Glasses,makeup brushes,jewelry and Media Player,Pen/Pencil Storage(Orange)",https://m.media-amazon.com/images/I/41p58TdmyoL._SS522_.jpg,,Leather,Orange,https://www.amazon.com/dp/B0C2GZNDXF,,,
"MoNiBloom Foldable Storage Free Standing Shoes Shelf, Bamboo Multifunctional 4-Tier Shoe Organizer for 16-20 Pairs Entryway, Hallway, Corridor, Natural",https://m.media-amazon.com/images/I/41SpDKbBslL._SS522_.jpg,Modern,Bamboo,,https://www.amazon.com/dp/B09JSR3CYZ,,,
"Walker Edison Furniture Modern Round Nesting Coffee Accent Table Living Room, Walnut/Gold",https://m.media-amazon.com/images/I/51U3y0LRMeL._SS522_.jpg,Coffee Table,Manufactured Wood,Walnut/Gold,https://www.amazon.com/dp/B072P27BTW,,,
Way Basics Book Shelf 4 Cubby Storage (Tool-free Assembly),https://m.media-amazon.com/images/I/31eEZQKN+rL._SS522_.jpg,Modern,Recycled Material,,https://www.amazon.com/dp/B071HWKHQL,,,
"Mind Reader Trash Can and Toilet Brush Set, Bathroom Decor, Swivel Lid, Accessories, 8.75"" W x 11.25"" H, 2 Piece Set, Gray",https://m.media-amazon.com/images/I/31ktspfOC9L._SS522_.jpg,,,,https://www.amazon.com/dp/B0BJ7PQ9XH,,,
"#4203 Adjustable 1/4"" Threaded Non-Skid Leveling Glides Black Pad 4-Pack",https://m.media-amazon.com/images/I/31Oas3rE7sL._SS522_.jpg,,,,https://www.amazon.com/dp/B01M0S28J1,,,
Funny Welcome Doormat for Entryway Front Porch Mat Welcome Madafakas Bulldog with Gun Doormat for Front Door Decor Personalized Kitchen Mat with Anti-Slip Rubber Back Novelty Gift Mat(23.7 X 15.9 in),https://m.media-amazon.com/images/I/415x2v3cW5L._SS522_.jpg,Farmhouse,Rubber,"Colorful,Funny,Novelty,Personalized",https://www.amazon.com/dp/B09VFPFBND,,,
"KINGYES Folding Adjustable Backrest Adirondack Chair, Gray",https://m.media-amazon.com/images/I/41RnRNOgDDL._SS522_.jpg,With arms,,Grey,https://www.amazon.com/dp/B0B2JRSBL3,,,
